author_id,created_at,entities_cashtags,entities_hashtags,entities_urls,tweet_id,possibly_sensitive,public_metrics_like_count,public_metrics_quote_count,public_metrics_reply_count,public_metrics_retweet_count,source,text,entities_mentions,in_reply_to_user_id,created_at_user,location,name,profile_image_url,public_metrics_followers_count,public_metrics_following_count,public_metrics_listed_count,public_metrics_tweet_count,username,media_type
69620713,2021-06-28 09:21:03,,,"trib.al/GOLi5XV, trib.al/bZrqk4w, pic.twitter.com/FhNvcg1GpG, ",1409502105753337856,False,15,1,0,3,SocialFlow,"Bigger iPads and changes to the Apple Car team? Mark Gurman @markgurman dives into what big tech is exploring in his new newsletter https://t.co/qK6bwvY6fM

Sign up here to get Power On in your inbox each Sunday ➡️ https://t.co/9plZQfiPf5 https://t.co/FhNvcg1GpG","markgurman, ",,2009-08-28 11:52:42,New York,Bloomberg Markets,https://pbs.twimg.com/profile_images/991798238519971840/0dG9AoKr_normal.jpg,1063544,286,14319,156022,markets,photo
69620713,2021-06-28 05:28:05,,,"trib.al/d6gz3Cu, trib.al/G9hMuFV, pic.twitter.com/D0qJNwpxHM, ",1409443477063188482,False,6,1,0,0,SocialFlow,"Bigger iPads and changes to the Apple Car team? Mark Gurman @markgurman dives into what big tech is exploring in his new newsletter https://t.co/3IzSztXYwn

Sign up here to get Power On in your inbox each Sunday ➡️ https://t.co/z43JoBPxsR https://t.co/D0qJNwpxHM","markgurman, ",,2009-08-28 11:52:42,New York,Bloomberg Markets,https://pbs.twimg.com/profile_images/991798238519971840/0dG9AoKr_normal.jpg,1063544,286,14319,156022,markets,photo
69620713,2021-06-25 00:26:03,,,"trib.al/kpnlSYk, ",1408280303358128141,False,6,0,1,2,SocialFlow,The shuttering of Apple Daily begs the question of whether the chill of Hong Kong's national security law will spread to its other media https://t.co/7zQeoagTFg,,,2009-08-28 11:52:42,New York,Bloomberg Markets,https://pbs.twimg.com/profile_images/991798238519971840/0dG9AoKr_normal.jpg,1063544,286,14319,156022,markets,
69620713,2021-06-22 16:46:47,,,"trib.al/FIuvDik, ",1407439950723829766,False,68,4,1,15,SocialFlow,Microsoft becomes just the second U.S. public company to reach a $2 trillion market value https://t.co/Wq8vuqxJAl,,,2009-08-28 11:52:42,New York,Bloomberg Markets,https://pbs.twimg.com/profile_images/991798238519971840/0dG9AoKr_normal.jpg,1063544,286,14319,156022,markets,
69620713,2021-06-18 02:21:26,,,"trib.al/QvCbgJl, ",1405772624421023746,False,14,0,0,6,SocialFlow,"Biel Crystal, a supplier of cover glass to Apple, is planning a Hong Kong IPO that could raise as much as $2 billion https://t.co/sPPwblt5JC",,,2009-08-28 11:52:42,New York,Bloomberg Markets,https://pbs.twimg.com/profile_images/991798238519971840/0dG9AoKr_normal.jpg,1063544,286,14319,156022,markets,
69620713,2021-06-18 00:33:37,"AAPL, ",,"trib.al/Z5LAJ5f, ",1405745491342610433,False,12,0,0,3,SocialFlow,"JUST IN: Biel Crystal, a supplier of cover glass to Apple, is planning a Hong Kong IPO that could raise as much as $2 billion https://t.co/ycqrMHY3Xa $AAPL",,,2009-08-28 11:52:42,New York,Bloomberg Markets,https://pbs.twimg.com/profile_images/991798238519971840/0dG9AoKr_normal.jpg,1063544,286,14319,156022,markets,
69620713,2021-06-16 15:58:02,,,"trib.al/BQYA5pp, ",1405253352812953605,False,21,4,2,5,SocialFlow,Apple would be prohibited from pre-installing its own apps on Apple devices under antitrust reform legislation introduced last week in Congress https://t.co/tYrlFuEElf,,,2009-08-28 11:52:42,New York,Bloomberg Markets,https://pbs.twimg.com/profile_images/991798238519971840/0dG9AoKr_normal.jpg,1063544,286,14319,156022,markets,
69620713,2021-06-15 22:11:40,,,"trib.al/Xlhbj0e, ",1404984993898696705,False,11,0,0,5,SocialFlow,"Apna, an app startup that helps India’s blue-collar workers find jobs, has raised $70 million from Tiger Global and Insight Partners at a valuation of $570 million https://t.co/sdajgQOnF0",,,2009-08-28 11:52:42,New York,Bloomberg Markets,https://pbs.twimg.com/profile_images/991798238519971840/0dG9AoKr_normal.jpg,1063544,286,14319,156022,markets,
69620713,2021-06-15 07:17:28,,,"trib.al/2W9bBhI, ",1404759961687793668,False,11,2,1,4,SocialFlow,"The U.K.’s antitrust regulator opens a probe into Google and Apple’s mobile ecosystems, saying it feared the companies’ dominance is stifling competition https://t.co/he6QYbB6WA",,,2009-08-28 11:52:42,New York,Bloomberg Markets,https://pbs.twimg.com/profile_images/991798238519971840/0dG9AoKr_normal.jpg,1063544,286,14319,156022,markets,
69620713,2021-06-15 07:12:35,,,"trib.al/q7RKxGz, ",1404758731179663364,False,19,1,3,5,SocialFlow,"Apple is working on new watch models and health features, spanning display and speed upgrades, an extreme sports edition and body temperature and blood sugar sensors https://t.co/iYGWsjT78d",,,2009-08-28 11:52:42,New York,Bloomberg Markets,https://pbs.twimg.com/profile_images/991798238519971840/0dG9AoKr_normal.jpg,1063544,286,14319,156022,markets,
69620713,2021-06-15 04:12:38,,,"trib.al/bFZTmLJ, ",1404713444335624194,False,29,1,1,7,SocialFlow,"Apple debuts Beats Studio Buds, its AirPods for Android https://t.co/EqnYkBS0zD",,,2009-08-28 11:52:42,New York,Bloomberg Markets,https://pbs.twimg.com/profile_images/991798238519971840/0dG9AoKr_normal.jpg,1063544,286,14319,156022,markets,
69620713,2021-06-15 03:55:54,,,"trib.al/w28WM7g, ",1404709236500832256,False,18,3,0,10,SocialFlow,Apple under fire in Washington over its compliance with secret Trump-era subpoenas for user data on more than 100 users including U.S. lawmakers https://t.co/QxXYHRmx8z,,,2009-08-28 11:52:42,New York,Bloomberg Markets,https://pbs.twimg.com/profile_images/991798238519971840/0dG9AoKr_normal.jpg,1063544,286,14319,156022,markets,
69620713,2021-06-14 23:26:05,,,"trib.al/PmY1fGG, ",1404641333013266435,False,21,0,4,3,SocialFlow,"Apple is working on new watch models and health features, spanning display and speed upgrades, an extreme sports edition and body temperature and blood sugar sensors https://t.co/OaJEZeWaVJ",,,2009-08-28 11:52:42,New York,Bloomberg Markets,https://pbs.twimg.com/profile_images/991798238519971840/0dG9AoKr_normal.jpg,1063544,286,14319,156022,markets,
69620713,2021-06-14 06:48:03,,,"trib.al/wyL5iP5, ",1404390170321997826,False,16,1,0,5,SocialFlow,"Apple is working on new watch models and health features, spanning display and speed upgrades, an extreme sports edition and body temperature and blood sugar sensors https://t.co/TT6mmmd9Y3",,,2009-08-28 11:52:42,New York,Bloomberg Markets,https://pbs.twimg.com/profile_images/991798238519971840/0dG9AoKr_normal.jpg,1063544,286,14319,156022,markets,
69620713,2021-06-11 03:04:03,,,"trib.al/NRugbxI, ",1403246633748467712,False,13,1,2,4,SocialFlow,Nio's William Li has a passionate customer base with the loyalty of Apple fans — and a dash of Elon Musk cult-of-personality thrown in https://t.co/EyHGwsGjBZ,,,2009-08-28 11:52:42,New York,Bloomberg Markets,https://pbs.twimg.com/profile_images/991798238519971840/0dG9AoKr_normal.jpg,1063544,286,14319,156022,markets,
69620713,2021-06-10 17:34:16,,,"trib.al/1isGTYh, ",1403103242330968068,False,17,0,2,4,SocialFlow,"Apple has hired a former senior executive from BMW's electric car division, to help lead its own vehicle efforts https://t.co/lQkKTV68Wr",,,2009-08-28 11:52:42,New York,Bloomberg Markets,https://pbs.twimg.com/profile_images/991798238519971840/0dG9AoKr_normal.jpg,1063544,286,14319,156022,markets,
69620713,2021-06-07 23:56:21,,,"trib.al/HHIqIzq, ",1402112234407477249,False,11,2,0,4,SocialFlow,"Warmer, rainier springs are a boon to fire blight, a disease that hits cider apple trees hard. It may soon threaten all apples, and other fruit crops https://t.co/qQvnIYdOhb",,,2009-08-28 11:52:42,New York,Bloomberg Markets,https://pbs.twimg.com/profile_images/991798238519971840/0dG9AoKr_normal.jpg,1063544,286,14319,156022,markets,
69620713,2021-06-07 20:57:39,,,"trib.al/sD0Y1T9, ",1402067263939883012,False,11,0,1,3,SocialFlow,"-China faces internal anger over a U.S. plane in Taiwan
-A global tax plan is being crafted to include Amazon
-Apple previews next-gen operating systems

Here are some of the things to know at the start of Asia's trading day https://t.co/MDClwVt8xP",,,2009-08-28 11:52:42,New York,Bloomberg Markets,https://pbs.twimg.com/profile_images/991798238519971840/0dG9AoKr_normal.jpg,1063544,286,14319,156022,markets,
69620713,2021-06-07 20:51:25,,,"trib.al/ca7bF6g, ",1402065697203789828,False,7,0,0,4,SocialFlow,How Apple can challenge its streaming rivals with lossless audio https://t.co/bUwlQ6MKTF,,,2009-08-28 11:52:42,New York,Bloomberg Markets,https://pbs.twimg.com/profile_images/991798238519971840/0dG9AoKr_normal.jpg,1063544,286,14319,156022,markets,
69620713,2021-06-07 15:11:51,,,"trib.al/5fsG6H5, ",1401980239413137409,False,16,0,1,5,SocialFlow,How Apple can challenge its streaming rivals with lossless audio https://t.co/BFG0IQNykf,,,2009-08-28 11:52:42,New York,Bloomberg Markets,https://pbs.twimg.com/profile_images/991798238519971840/0dG9AoKr_normal.jpg,1063544,286,14319,156022,markets,
69620713,2021-06-07 14:47:50,,,"trib.al/MQTHGvv, ",1401974195261689856,False,10,0,1,3,SocialFlow,"Apple gave the iPad software the biggest revamp to its Home screen since launching the device over a decade ago, adding a new widgets system https://t.co/N3CS8KKntS",,,2009-08-28 11:52:42,New York,Bloomberg Markets,https://pbs.twimg.com/profile_images/991798238519971840/0dG9AoKr_normal.jpg,1063544,286,14319,156022,markets,
69620713,2021-06-05 11:12:06,,,"trib.al/YlvuSMl, ",1401195131148115969,False,23,1,0,6,SocialFlow,Apple will debut major software updates for the iPhone and iPad at its developers’ conference next week to an audience that has grown increasingly critical of the company’s App Store policies https://t.co/aY4BKMrlZH,,,2009-08-28 11:52:42,New York,Bloomberg Markets,https://pbs.twimg.com/profile_images/991798238519971840/0dG9AoKr_normal.jpg,1063544,286,14319,156022,markets,
69620713,2021-06-04 03:08:26,,,"trib.al/7rvJVog, ",1400711024819544067,False,13,0,0,1,SocialFlow,Apple is working on a new iPad Pro with wireless charging and the first iPad mini redesign in six years https://t.co/tZtUvICBV9,,,2009-08-28 11:52:42,New York,Bloomberg Markets,https://pbs.twimg.com/profile_images/991798238519971840/0dG9AoKr_normal.jpg,1063544,286,14319,156022,markets,
69620713,2021-06-04 03:04:32,,,"trib.al/L8ju61x, ",1400710043272634369,False,18,1,3,1,SocialFlow,Apple is working on a new iPad Pro with wireless charging and the first iPad mini redesign in six years https://t.co/5fV3FtFQtF,,,2009-08-28 11:52:42,New York,Bloomberg Markets,https://pbs.twimg.com/profile_images/991798238519971840/0dG9AoKr_normal.jpg,1063544,286,14319,156022,markets,
69620713,2021-06-04 00:17:05,"AAPL, ",,"trib.al/TgxtZ5m, ",1400667900558647299,False,25,0,3,3,SocialFlow,EXCLUSIVE: Apple is planning to release a new iPad Pro with wireless charging in 2022. It's also set to launch a redesigned iPad mini later this year https://t.co/IDCxN8QU2e $AAPL,,,2009-08-28 11:52:42,New York,Bloomberg Markets,https://pbs.twimg.com/profile_images/991798238519971840/0dG9AoKr_normal.jpg,1063544,286,14319,156022,markets,
69620713,2021-06-02 00:01:51,,,"trib.al/7PMlNSc, ",1399939293179748362,False,16,0,0,4,SocialFlow,"Apple can no longer sidestep the criticism directed at peers like Amazon, Google, and Facebook https://t.co/BynbwMq8Fy via @BW","BW, ",,2009-08-28 11:52:42,New York,Bloomberg Markets,https://pbs.twimg.com/profile_images/991798238519971840/0dG9AoKr_normal.jpg,1063544,286,14319,156022,markets,
69620713,2021-05-28 15:02:44,,,"trib.al/s8embdI, ",1398354069039857664,False,9,1,1,2,SocialFlow,Apple aimed to purchase the livestreaming music platform Verzuz before the it was bought by the video network Triller https://t.co/YaRpGiF2cK,,,2009-08-28 11:52:42,New York,Bloomberg Markets,https://pbs.twimg.com/profile_images/991798238519971840/0dG9AoKr_normal.jpg,1063544,286,14319,156022,markets,
69620713,2021-05-26 14:12:20,,,"trib.al/KA8EgtU, ",1397616606721806341,False,29,1,2,6,SocialFlow,"Jeff Bezos says the retail industry is far more competitive than the smartphone market, a clear nod to Apple and Google https://t.co/zN3oL5VdRH",,,2009-08-28 11:52:42,New York,Bloomberg Markets,https://pbs.twimg.com/profile_images/991798238519971840/0dG9AoKr_normal.jpg,1063544,286,14319,156022,markets,
69620713,2021-05-26 07:50:06,,,"trib.al/BG4wXbG, ",1397520413970911233,False,24,1,0,6,SocialFlow,Xiaomi’s quarterly profit beat estimates after the world’s third-largest smartphone maker narrowed the gap with market leaders Samsung and Apple in shipments https://t.co/TgQaxwGoc3,,,2009-08-28 11:52:42,New York,Bloomberg Markets,https://pbs.twimg.com/profile_images/991798238519971840/0dG9AoKr_normal.jpg,1063544,286,14319,156022,markets,
69620713,2021-05-24 17:17:54,,,"trib.al/Uoy2r4t, ",1396938533693231104,False,11,0,0,7,SocialFlow,Apple and Epic Games offered their closing arguments in an antitrust trial with the potential to upend the billion-dollar world of mobile apps https://t.co/VcKYQXKmRF,,,2009-08-28 11:52:42,New York,Bloomberg Markets,https://pbs.twimg.com/profile_images/991798238519971840/0dG9AoKr_normal.jpg,1063544,286,14319,156022,markets,
69620713,2021-05-18 03:52:04,,,"trib.al/kerPo9s, ",1394561408340221953,False,10,1,0,3,SocialFlow,"Hassle-free travel, Apple probe and Israel talks in today's Brussels Edition https://t.co/6BECsv4uIO",,,2009-08-28 11:52:42,New York,Bloomberg Markets,https://pbs.twimg.com/profile_images/991798238519971840/0dG9AoKr_normal.jpg,1063544,286,14319,156022,markets,
69620713,2021-05-17 23:23:05,,,"trib.al/d7wKQrK, ",1394493716556140545,False,19,0,2,8,SocialFlow,"Apple is grappling with supply chain constraints for its new high-end iPad Pro, potentially compounding an already month-and-a-half wait for the company’s priciest tablet https://t.co/V6QvnHreX2",,,2009-08-28 11:52:42,New York,Bloomberg Markets,https://pbs.twimg.com/profile_images/991798238519971840/0dG9AoKr_normal.jpg,1063544,286,14319,156022,markets,
69620713,2021-05-17 16:51:07,,,"trib.al/nixT2I3, ",1394395078135881728,False,4,0,0,4,SocialFlow,"Apple’s annual worldwide developer conferences cost the company about $50 million a year to put on, according to testimony from its antitrust trial with Epic Games https://t.co/x6ByRa0jzR",,,2009-08-28 11:52:42,New York,Bloomberg Markets,https://pbs.twimg.com/profile_images/991798238519971840/0dG9AoKr_normal.jpg,1063544,286,14319,156022,markets,
69620713,2021-05-17 14:34:04,,,"trib.al/xEjeIwT, ",1394360586117451778,False,13,0,2,3,SocialFlow,Apple began its defense -- which will include testimony from Tim Cook -- in a closely watched antitrust trial after Epic Games rested its case on Monday https://t.co/w747zm7f5G,,,2009-08-28 11:52:42,New York,Bloomberg Markets,https://pbs.twimg.com/profile_images/991798238519971840/0dG9AoKr_normal.jpg,1063544,286,14319,156022,markets,
69620713,2021-05-14 07:13:00,,,"trib.al/QsTYQ2y, ",1393162424400896002,False,12,3,2,3,SocialFlow,The Mac vs. PC rivals saw their feud simmer down in recent years. Now it’s back and could be a sign of more battles to come. https://t.co/z4vRwdU7Yp,,,2009-08-28 11:52:42,New York,Bloomberg Markets,https://pbs.twimg.com/profile_images/991798238519971840/0dG9AoKr_normal.jpg,1063544,286,14319,156022,markets,
69620713,2021-05-12 21:47:20,,,"trib.al/oAjeKGH, ",1392657682243465218,False,21,1,1,3,SocialFlow,"JUST IN: Apple says an employee it hired from Facebook recently has left within weeks of joining after internal backlash over comments deemed racist and sexist in his 2016 book, Chaos Monkeys, where he called women in Silicon Valley ""soft and weak""
https://t.co/rpmhF0pAJb",,,2009-08-28 11:52:42,New York,Bloomberg Markets,https://pbs.twimg.com/profile_images/991798238519971840/0dG9AoKr_normal.jpg,1063544,286,14319,156022,markets,
69620713,2021-05-10 22:10:05,,,"trib.al/wS0jq0o, ",1391938632265707520,False,29,2,4,14,SocialFlow,Apple is facing a class-action lawsuit in London over claims it overcharged nearly 20 million U.K. customers for App Store purchases https://t.co/2ZhzNBuRzS,,,2009-08-28 11:52:42,New York,Bloomberg Markets,https://pbs.twimg.com/profile_images/991798238519971840/0dG9AoKr_normal.jpg,1063544,286,14319,156022,markets,
69620713,2021-05-06 06:00:59,,,"trib.al/wNMIX1C, ",1390245196810575873,False,3,0,1,2,SocialFlow,The veteran Apple executive who runs day-to-day operations at the App Store will be playing defense in the company’s trial with Fortnite developer Epic Games https://t.co/btUunL08XF,,,2009-08-28 11:52:42,New York,Bloomberg Markets,https://pbs.twimg.com/profile_images/991798238519971840/0dG9AoKr_normal.jpg,1063544,286,14319,156022,markets,
69620713,2021-05-04 17:46:03,,,"trib.al/use6wTF, ",1389697859285565446,False,10,0,2,7,SocialFlow,"Apple rolled out a second advertising slot to the App Store, adding another potential revenue generator for its niche ads business https://t.co/yOR6VWgjIP",,,2009-08-28 11:52:42,New York,Bloomberg Markets,https://pbs.twimg.com/profile_images/991798238519971840/0dG9AoKr_normal.jpg,1063544,286,14319,156022,markets,
69620713,2021-05-04 15:29:07,,,"trib.al/h34X7VT, ",1389663399714467849,False,8,0,0,4,SocialFlow,Hecklers who dialed into the court feed for the Apple-Epic Games trial -- and who figured out how to unmute themselves -- let everyone know they just want Fortnite back on the iPhone https://t.co/KdEm45xMv5,,,2009-08-28 11:52:42,New York,Bloomberg Markets,https://pbs.twimg.com/profile_images/991798238519971840/0dG9AoKr_normal.jpg,1063544,286,14319,156022,markets,
69620713,2021-05-04 07:45:09,,,"trib.al/78VQvZp, ",1389546636343402496,False,9,1,3,1,SocialFlow,Apple’s relationship with Epic Games soured when Fortnite came out. This is how the two companies became bitter enemies. https://t.co/N55FQ0FSYv @BW,"BW, ",,2009-08-28 11:52:42,New York,Bloomberg Markets,https://pbs.twimg.com/profile_images/991798238519971840/0dG9AoKr_normal.jpg,1063544,286,14319,156022,markets,
69620713,2021-05-03 22:45:06,,,"trib.al/iFwmZ7K, ",1389410729707675648,False,7,0,1,6,SocialFlow,Apple’s relationship with Epic Games soured when Fortnite came out. This is how the two companies became bitter enemies. https://t.co/zoyjFJVyZN @BW,"BW, ",,2009-08-28 11:52:42,New York,Bloomberg Markets,https://pbs.twimg.com/profile_images/991798238519971840/0dG9AoKr_normal.jpg,1063544,286,14319,156022,markets,
69620713,2021-05-03 18:27:05,,,"trib.al/UrokPoH, ",1389345797016334343,False,31,1,1,9,SocialFlow,"Apple hires Samy Bengio, a scientist who ended his 14-year career at Google after the ousting of two women AI researchers who reported to him https://t.co/mq0rRIHh3j",,,2009-08-28 11:52:42,New York,Bloomberg Markets,https://pbs.twimg.com/profile_images/991798238519971840/0dG9AoKr_normal.jpg,1063544,286,14319,156022,markets,
69620713,2021-05-03 15:03:02,,,"trib.al/qe45c4i, ",1389294445238050821,False,21,0,5,8,SocialFlow,"Apple's App Store has left users and developers “trapped” in an anticompetitive marketplace, says attorneys for Epic Games at the start of an antitrust trial of Apple's treatment of developers https://t.co/csVUqYqMao",,,2009-08-28 11:52:42,New York,Bloomberg Markets,https://pbs.twimg.com/profile_images/991798238519971840/0dG9AoKr_normal.jpg,1063544,286,14319,156022,markets,
69620713,2021-05-03 04:54:26,,,"trib.al/YTS3SUB, ",1389141287035621377,False,10,0,1,1,SocialFlow,"European vaccine progress, Buffett's take on the economy and Apple's court fight https://t.co/dQhPPzdBlf",,,2009-08-28 11:52:42,New York,Bloomberg Markets,https://pbs.twimg.com/profile_images/991798238519971840/0dG9AoKr_normal.jpg,1063544,286,14319,156022,markets,
69620713,2021-05-03 01:50:46,,,"trib.al/eUcU8Mp, ",1389095066556407810,False,17,0,4,5,SocialFlow,"European vaccine progress, Buffett's take on the economy and Apple's court fight https://t.co/VMXJYML1jB",,,2009-08-28 11:52:42,New York,Bloomberg Markets,https://pbs.twimg.com/profile_images/991798238519971840/0dG9AoKr_normal.jpg,1063544,286,14319,156022,markets,
69620713,2021-04-30 04:27:12,,,"trib.al/K3TXnYU, ",1388047268218085383,False,16,1,1,7,SocialFlow,Apple is set for another showdown with the European Union’s antitrust chief as she escalates an antitrust probe over its App Store https://t.co/PVK9y8G8tp,,,2009-08-28 11:52:42,New York,Bloomberg Markets,https://pbs.twimg.com/profile_images/991798238519971840/0dG9AoKr_normal.jpg,1063544,286,14319,156022,markets,
69620713,2021-04-29 15:33:07,,,"trib.al/ELoOuHi, ",1387852465287176192,False,25,0,5,8,SocialFlow,Apple shares fell on concern from investors and analysts that the iPhone maker may not sustain its massive growth https://t.co/BZB9uTC0bG,,,2009-08-28 11:52:42,New York,Bloomberg Markets,https://pbs.twimg.com/profile_images/991798238519971840/0dG9AoKr_normal.jpg,1063544,286,14319,156022,markets,
69620713,2021-04-29 15:05:48,,,"trib.al/2jKBdbU, ",1387845590822924297,False,28,3,1,9,SocialFlow,Apple and Alphabet herald the return of a buyback boom https://t.co/9I1jeaRpRW,,,2009-08-28 11:52:42,New York,Bloomberg Markets,https://pbs.twimg.com/profile_images/991798238519971840/0dG9AoKr_normal.jpg,1063544,286,14319,156022,markets,
69620713,2021-04-29 02:14:13,,,"trib.al/uRuOnhW, ",1387651415334604802,False,12,0,0,5,SocialFlow,"Tech earnings boost stocks, a change in Northern Ireland and the Fed holds steady. Here’s what is moving markets https://t.co/TeNRQJeog7",,,2009-08-28 11:52:42,New York,Bloomberg Markets,https://pbs.twimg.com/profile_images/991798238519971840/0dG9AoKr_normal.jpg,1063544,286,14319,156022,markets,
69620713,2021-04-28 22:44:01,,,"trib.al/SPPtQum, ",1387598516768411654,False,43,2,1,10,SocialFlow,Apple reported quarterly revenue that crushed Wall Street expectations https://t.co/YyQlSt6WqK,,,2009-08-28 11:52:42,New York,Bloomberg Markets,https://pbs.twimg.com/profile_images/991798238519971840/0dG9AoKr_normal.jpg,1063544,286,14319,156022,markets,
69620713,2021-04-28 21:36:43,,,"trib.al/WLE9Uva, ",1387581579837550595,False,10,0,2,4,SocialFlow,"-The Fed upgrades its view of the U.S. economy
-Apple crushes Wall Street revenue estimates
-Bitcoin is facing a make-or-break moment

Here are some of the things to know at the start of Asia's trading day https://t.co/NLzqSdwtxa",,,2009-08-28 11:52:42,New York,Bloomberg Markets,https://pbs.twimg.com/profile_images/991798238519971840/0dG9AoKr_normal.jpg,1063544,286,14319,156022,markets,
69620713,2021-04-26 17:35:01,,,"trib.al/A5AgGYP, ",1386795977714057217,False,43,1,1,11,SocialFlow,"Apple said it will open a $1 billion engineering hub in North Carolina, marking its first major campus on the East Coast https://t.co/zOtkOh9i3t",,,2009-08-28 11:52:42,New York,Bloomberg Markets,https://pbs.twimg.com/profile_images/991798238519971840/0dG9AoKr_normal.jpg,1063544,286,14319,156022,markets,
69620713,2021-04-26 08:38:45,,,"trib.al/lazaKdD, ",1386661021738274818,False,83,2,6,27,SocialFlow,"Apple Inc. is increasing its U.S. investments by 20% over the next five years, adding some 20,000 jobs and funding a research center in North Carolina https://t.co/WGUoTJk6BR",,,2009-08-28 11:52:42,New York,Bloomberg Markets,https://pbs.twimg.com/profile_images/991798238519971840/0dG9AoKr_normal.jpg,1063544,286,14319,156022,markets,
69620713,2021-04-23 15:23:04,,,"trib.al/nQx4VR8, ",1385675609997721600,False,34,0,3,6,SocialFlow,Apple is launching a program to help employees get vaccinated against Covid-19 https://t.co/kYVaOX4s0x,,,2009-08-28 11:52:42,New York,Bloomberg Markets,https://pbs.twimg.com/profile_images/991798238519971840/0dG9AoKr_normal.jpg,1063544,286,14319,156022,markets,
69620713,2021-04-22 07:30:08,,,"trib.al/GhM6jTC, ",1385194205190967303,False,20,0,1,11,SocialFlow,"Apple prepares a major revamp of its mobile software, sources say https://t.co/gKRnfvCIgD",,,2009-08-28 11:52:42,New York,Bloomberg Markets,https://pbs.twimg.com/profile_images/991798238519971840/0dG9AoKr_normal.jpg,1063544,286,14319,156022,markets,
69620713,2021-04-21 18:33:56,,,"trib.al/DOFmHgw, ",1384998867331133447,False,11,1,0,4,SocialFlow,Spotify and Match accused Apple of abusing its power over software developers that depend on the App Store to reach users https://t.co/e3Zvo9blar,,,2009-08-28 11:52:42,New York,Bloomberg Markets,https://pbs.twimg.com/profile_images/991798238519971840/0dG9AoKr_normal.jpg,1063544,286,14319,156022,markets,
69620713,2021-04-21 03:35:53,,,"trib.al/6fcVgZ2, ",1384772866646872065,False,22,2,1,14,SocialFlow,One of Apple's primary suppliers suffers a ransomware attack from a Russian operator claiming to have stolen blueprints of its latest products https://t.co/188sHIFriD,,,2009-08-28 11:52:42,New York,Bloomberg Markets,https://pbs.twimg.com/profile_images/991798238519971840/0dG9AoKr_normal.jpg,1063544,286,14319,156022,markets,
69620713,2021-04-21 00:12:05,,,"trib.al/mIUNAmj, ",1384721578735374338,False,28,1,1,9,SocialFlow,"Apple rolled out the first redesign of its flagship desktop iMac computer in almost a decade, showcasing its latest machine with in-house designed chips https://t.co/gYQC900SMG",,,2009-08-28 11:52:42,New York,Bloomberg Markets,https://pbs.twimg.com/profile_images/991798238519971840/0dG9AoKr_normal.jpg,1063544,286,14319,156022,markets,
69620713,2021-04-20 20:50:34,,,"trib.al/vYLWZl4, ",1384670864982036481,False,12,0,2,5,SocialFlow,"-HSBC's Asia pivot stokes tension between Hong Kong and London
-Apple reveals new Mac, iPad Pro
-All six English teams pull out of Europe's rebel league

Here are some of the things to know at the start of Asia's trading day https://t.co/MJzTVwz0to",,,2009-08-28 11:52:42,New York,Bloomberg Markets,https://pbs.twimg.com/profile_images/991798238519971840/0dG9AoKr_normal.jpg,1063544,286,14319,156022,markets,
