author_id,created_at,entities_cashtags,entities_hashtags,entities_urls,tweet_id,possibly_sensitive,public_metrics_like_count,public_metrics_quote_count,public_metrics_reply_count,public_metrics_retweet_count,source,text,entities_mentions,in_reply_to_user_id,created_at_user,location,name,profile_image_url,public_metrics_followers_count,public_metrics_following_count,public_metrics_listed_count,public_metrics_tweet_count,username,media_type
69620713,2021-04-20 16:35:46,,,"trib.al/KED8af6, ",1384606742580015111,False,52,3,2,13,SocialFlow,"Apple rolled out the first redesign of its flagship desktop iMac computer in almost a decade, showcasing its latest machine with in-house designed chips https://t.co/CbJ3tAAUk0",,,2009-08-28 11:52:42,New York,Bloomberg Markets,https://pbs.twimg.com/profile_images/991798238519971840/0dG9AoKr_normal.jpg,1063544,286,14319,156022,markets,
69620713,2021-04-20 14:59:04,,,"trib.al/jrZhlnx, ",1384582407697883140,False,14,1,4,4,SocialFlow,"Apple launched a new accessory called AirTag that will find physical items like bags, wallets and keys, competing with similar products from Tile and Samsung https://t.co/E4K3lmlnoj",,,2009-08-28 11:52:42,New York,Bloomberg Markets,https://pbs.twimg.com/profile_images/991798238519971840/0dG9AoKr_normal.jpg,1063544,286,14319,156022,markets,
69620713,2021-04-20 14:05:07,,,"trib.al/Wt8mRh2, ",1384568827212599297,False,25,3,0,6,SocialFlow,Apple unveiled an upgraded Apple TV set-top box with a faster processor and revamped remote control https://t.co/3WXdqHT8JQ,,,2009-08-28 11:52:42,New York,Bloomberg Markets,https://pbs.twimg.com/profile_images/991798238519971840/0dG9AoKr_normal.jpg,1063544,286,14319,156022,markets,
69620713,2021-04-14 00:34:03,,,"trib.al/cU29Qw0, ",1382190389453586433,False,14,0,0,5,SocialFlow,Apple’s first product unveiling of 2021 will take place on April 20 https://t.co/yjSUwft2Pn,,,2009-08-28 11:52:42,New York,Bloomberg Markets,https://pbs.twimg.com/profile_images/991798238519971840/0dG9AoKr_normal.jpg,1063544,286,14319,156022,markets,
69620713,2021-04-12 01:54:02,,,"trib.al/CwKHUGQ, ",1381485744334716928,False,15,0,0,7,SocialFlow,"There could be initial supply shortages of Apple's 12.9-inch iPad Pro as production issues hit its next-generation MiniLED display, sources say https://t.co/WhtEta6D0F",,,2009-08-28 11:52:42,New York,Bloomberg Markets,https://pbs.twimg.com/profile_images/991798238519971840/0dG9AoKr_normal.jpg,1063544,286,14319,156022,markets,
69620713,2021-04-11 23:56:54,,,"trib.al/YueXM37, ",1381456267118579712,False,19,0,3,8,SocialFlow,"JUST IN: There could be initial supply shortages of Apple's 12.9-inch iPad Pro as production issues hit its next-generation MiniLED display, sources say https://t.co/u6COsscWzq",,,2009-08-28 11:52:42,New York,Bloomberg Markets,https://pbs.twimg.com/profile_images/991798238519971840/0dG9AoKr_normal.jpg,1063544,286,14319,156022,markets,
69620713,2021-04-11 23:42:06,,,"trib.al/0TEqJgT, ",1381452541679001600,False,10,2,1,2,SocialFlow,Apple said in a letter to Senators Amy Klobuchar and Mike Lee that it will make a top executive available at an upcoming hearing regarding the App Store after lawmakers publicly criticized the company for not doing so https://t.co/q8T1QzQ6gg,,,2009-08-28 11:52:42,New York,Bloomberg Markets,https://pbs.twimg.com/profile_images/991798238519971840/0dG9AoKr_normal.jpg,1063544,286,14319,156022,markets,
69620713,2021-03-29 15:30:00,,,"trib.al/3Cx2wC2, ",1376617656967700482,False,24,2,5,7,SocialFlow,Apple is encouraging employees to get vaccines by offering paid time off for appointments and paid sick leave for those experiencing side effects https://t.co/Oydj2trxw8,,,2009-08-28 11:52:42,New York,Bloomberg Markets,https://pbs.twimg.com/profile_images/991798238519971840/0dG9AoKr_normal.jpg,1063544,286,14319,156022,markets,
69620713,2021-03-29 11:31:16,,,"trib.al/84ssdyG, ",1376557578084306944,False,14,1,3,4,SocialFlow,"Swatch’s attempt to register the phrase ""One more thing"" might have been an attempt to “annoy” Apple, but according to a judge in London, Apple can’t stop it https://t.co/mSxT4mBHID",,,2009-08-28 11:52:42,New York,Bloomberg Markets,https://pbs.twimg.com/profile_images/991798238519971840/0dG9AoKr_normal.jpg,1063544,286,14319,156022,markets,
69620713,2021-03-26 06:20:32,,,"trib.al/n5957rM, pic.twitter.com/A4XP1vYu49, ",1375392215535648769,False,51,3,4,14,SocialFlow,"BREAKING: Apple is considering launching an Apple Watch with a rugged casing aimed at athletes, hikers and others who use the device in more extreme environments https://t.co/mRmi0NvVhd https://t.co/A4XP1vYu49",,,2009-08-28 11:52:42,New York,Bloomberg Markets,https://pbs.twimg.com/profile_images/991798238519971840/0dG9AoKr_normal.jpg,1063544,286,14319,156022,markets,animated_gif
69620713,2021-03-22 06:01:00,,,"trib.al/oeQ4Grm, ",1373937747556188160,False,8,0,1,1,SocialFlow,Suppliers to the auto industry are eager to see an Apple EV https://t.co/6mTT3xkuk0,,,2009-08-28 11:52:42,New York,Bloomberg Markets,https://pbs.twimg.com/profile_images/991798238519971840/0dG9AoKr_normal.jpg,1063544,286,14319,156022,markets,
69620713,2021-03-19 04:13:04,,,"trib.al/QWx3C7l, ",1372823421944467457,False,16,0,2,9,SocialFlow,Apple says its App Store rules will apply globally after reports that Chinese developers are preparing workarounds for upcoming limits on ad tracking https://t.co/Hd4jGcBeFj,,,2009-08-28 11:52:42,New York,Bloomberg Markets,https://pbs.twimg.com/profile_images/991798238519971840/0dG9AoKr_normal.jpg,1063544,286,14319,156022,markets,
69620713,2021-03-19 03:18:02,,,"trib.al/kgqW5lS, ",1372809575313801216,False,17,0,1,5,SocialFlow,Apple and Amazon are bullish on manufacturing in India. Will other companies follow? https://t.co/VSFX3YDovi,,,2009-08-28 11:52:42,New York,Bloomberg Markets,https://pbs.twimg.com/profile_images/991798238519971840/0dG9AoKr_normal.jpg,1063544,286,14319,156022,markets,
69620713,2021-03-18 04:34:09,,,"trib.al/lybZRrP, ",1372466340469018625,False,27,0,2,9,SocialFlow,Apple and Amazon are bullish on manufacturing in India. Will other companies follow? https://t.co/bCUYzgzzUU,,,2009-08-28 11:52:42,New York,Bloomberg Markets,https://pbs.twimg.com/profile_images/991798238519971840/0dG9AoKr_normal.jpg,1063544,286,14319,156022,markets,
69620713,2021-03-17 22:21:03,"AAPL, ",,"trib.al/beRlgqd, ",1372372446775549957,False,26,1,0,6,SocialFlow,"Apple plans to announce new iPads as early as April, adding to a product line that has performed particularly well as people work and study from home https://t.co/WxQvKcGogh $AAPL",,,2009-08-28 11:52:42,New York,Bloomberg Markets,https://pbs.twimg.com/profile_images/991798238519971840/0dG9AoKr_normal.jpg,1063544,286,14319,156022,markets,
69620713,2021-03-17 21:09:08,,,"trib.al/Q6LMlev, ",1372354349150707713,False,32,2,2,11,SocialFlow,"-Fed signals near-zero rates through 2023
-U.S. moves toward banning more Chinese wireless carriers
-Apple nears the launch of its new iPad

Here are some of the things you need to know at the start of Asia's trading day https://t.co/6UKingFeZE",,,2009-08-28 11:52:42,New York,Bloomberg Markets,https://pbs.twimg.com/profile_images/991798238519971840/0dG9AoKr_normal.jpg,1063544,286,14319,156022,markets,
69620713,2021-03-17 18:45:40,,,"trib.al/k8FYFaA, ",1372318245139705857,False,36,2,2,15,SocialFlow,Apple and Amazon are bullish on manufacturing in India. Will other companies follow? https://t.co/SG8YndSHNj,,,2009-08-28 11:52:42,New York,Bloomberg Markets,https://pbs.twimg.com/profile_images/991798238519971840/0dG9AoKr_normal.jpg,1063544,286,14319,156022,markets,
69620713,2021-03-17 04:46:40,,,"trib.al/5WFQVfD, ",1372107102290862084,False,32,2,2,12,SocialFlow,Apple has severed ties with Chinese component supplier Ofilm over allegations it’s involved in a Xinjiang work program https://t.co/O04wE5cLQZ,,,2009-08-28 11:52:42,New York,Bloomberg Markets,https://pbs.twimg.com/profile_images/991798238519971840/0dG9AoKr_normal.jpg,1063544,286,14319,156022,markets,
69620713,2021-03-11 06:12:00,,,"trib.al/S7Ld0bZ, ",1369969350829039616,False,22,1,0,6,SocialFlow,"To build a car, Apple has three primary options https://t.co/N93T2d0bkE",,,2009-08-28 11:52:42,New York,Bloomberg Markets,https://pbs.twimg.com/profile_images/991798238519971840/0dG9AoKr_normal.jpg,1063544,286,14319,156022,markets,
69620713,2021-03-11 05:07:33,,,"trib.al/lPW8lfX, ",1369953130587299844,False,32,1,2,7,SocialFlow,"Toyota offers a warning to Apple, which is plotting a foray into the auto industry: There’s more to the business of selling cars than just having the technology to produce them https://t.co/VwjP1dsSAZ",,,2009-08-28 11:52:42,New York,Bloomberg Markets,https://pbs.twimg.com/profile_images/991798238519971840/0dG9AoKr_normal.jpg,1063544,286,14319,156022,markets,
69620713,2021-03-11 00:27:06,,,"trib.al/6LL3sgi, ",1369882551930720256,False,19,2,0,6,SocialFlow,"NEW: To build a car, Apple has three primary options https://t.co/GTaCWoQQTK",,,2009-08-28 11:52:42,New York,Bloomberg Markets,https://pbs.twimg.com/profile_images/991798238519971840/0dG9AoKr_normal.jpg,1063544,286,14319,156022,markets,
69620713,2021-03-09 14:31:08,,,"trib.al/XqmDSLw, ",1369370186315366419,False,13,2,0,4,SocialFlow,"Having once upended the market for earbuds with its AirPods, Apple looks to again change the course of the advanced headphones market https://t.co/k0itMGzveQ",,,2009-08-28 11:52:42,New York,Bloomberg Markets,https://pbs.twimg.com/profile_images/991798238519971840/0dG9AoKr_normal.jpg,1063544,286,14319,156022,markets,
69620713,2021-03-09 01:58:13,,,"trib.al/3Vy8tKN, ",1369180706430193666,False,31,3,4,11,SocialFlow,BMW has a message for Apple: bring it on https://t.co/2Bq8JFa7xA,,,2009-08-28 11:52:42,New York,Bloomberg Markets,https://pbs.twimg.com/profile_images/991798238519971840/0dG9AoKr_normal.jpg,1063544,286,14319,156022,markets,
69620713,2021-03-01 12:04:08,,,"trib.al/lVmYh61, ",1366434088446550022,False,34,0,1,10,SocialFlow,All of Apple’s retail stores in the U.S. are now open for the first time since pandemic closures began nearly a year ago https://t.co/nLyZ8d0qHh,,,2009-08-28 11:52:42,New York,Bloomberg Markets,https://pbs.twimg.com/profile_images/991798238519971840/0dG9AoKr_normal.jpg,1063544,286,14319,156022,markets,
69620713,2021-02-24 05:29:17,,,"trib.al/cJKTVod, ",1364522783477288961,False,34,1,4,11,SocialFlow,"BMW could make for a strong ally for Apple that would pair its car project with leading innovation and manufacturing know-how, according to Sanford C. Bernstein analysts https://t.co/OXaDfWyHcg",,,2009-08-28 11:52:42,New York,Bloomberg Markets,https://pbs.twimg.com/profile_images/991798238519971840/0dG9AoKr_normal.jpg,1063544,286,14319,156022,markets,
69620713,2021-02-23 14:40:38,,,"trib.al/MG6xz5m, ",1364299144500826115,False,8,0,0,5,SocialFlow,"Tim Cook fielded questions on M&amp;A, the impact of Covid-19 and supply chain issues during a virtual Apple shareholder meeting Tuesday https://t.co/soUGjWhxxI",,,2009-08-28 11:52:42,New York,Bloomberg Markets,https://pbs.twimg.com/profile_images/991798238519971840/0dG9AoKr_normal.jpg,1063544,286,14319,156022,markets,
69620713,2021-02-17 23:56:06,,,"trib.al/1bO1DqI, pic.twitter.com/ZLsWf9ofNr, ",1362264607943974917,False,18,1,0,5,SocialFlow,"Warren Buffett’s Berkshire Hathaway just revealed three stakes it snapped up in secret https://t.co/Ndw76Cm0jN
https://t.co/ZLsWf9ofNr",,,2009-08-28 11:52:42,New York,Bloomberg Markets,https://pbs.twimg.com/profile_images/991798238519971840/0dG9AoKr_normal.jpg,1063544,286,14319,156022,markets,video
69620713,2021-02-17 17:56:06,,,"trib.al/IUZmhNx, pic.twitter.com/ZLsWf9ofNr, ",1362174009597689858,False,22,0,1,7,SocialFlow,"Warren Buffett’s Berkshire Hathaway just revealed three stakes it snapped up in secret https://t.co/1MZuFBQVlY
https://t.co/ZLsWf9ofNr",,,2009-08-28 11:52:42,New York,Bloomberg Markets,https://pbs.twimg.com/profile_images/991798238519971840/0dG9AoKr_normal.jpg,1063544,286,14319,156022,markets,video
69620713,2021-02-17 10:56:05,,,"trib.al/3VlZNDC, pic.twitter.com/ZLsWf9ofNr, ",1362068307176783877,False,29,1,2,7,SocialFlow,"Warren Buffett’s Berkshire Hathaway just revealed three stakes it snapped up in secret https://t.co/OClblkC24H
https://t.co/ZLsWf9ofNr",,,2009-08-28 11:52:42,New York,Bloomberg Markets,https://pbs.twimg.com/profile_images/991798238519971840/0dG9AoKr_normal.jpg,1063544,286,14319,156022,markets,video
69620713,2021-02-17 04:56:11,,,"trib.al/gUwMy9F, pic.twitter.com/ZLsWf9ofNr, ",1361977735535550465,False,16,1,2,7,SocialFlow,"Warren Buffett’s Berkshire Hathaway just revealed three stakes it snapped up in secret https://t.co/pUEXi1Yq19
https://t.co/ZLsWf9ofNr",,,2009-08-28 11:52:42,New York,Bloomberg Markets,https://pbs.twimg.com/profile_images/991798238519971840/0dG9AoKr_normal.jpg,1063544,286,14319,156022,markets,video
69620713,2021-02-17 00:01:26,,,"trib.al/nE3MEl2, ",1361903560154353667,False,63,2,6,20,SocialFlow,Warren Buffett’s Berkshire Hathaway reveals three new secret buys https://t.co/rwm5sp0dIm,,,2009-08-28 11:52:42,New York,Bloomberg Markets,https://pbs.twimg.com/profile_images/991798238519971840/0dG9AoKr_normal.jpg,1063544,286,14319,156022,markets,
69620713,2021-02-11 05:37:04,,,"trib.al/GpP2hbV, ",1359813699427577860,False,14,1,0,4,SocialFlow,Who will build the Apple Car? Here are the candidates to watch https://t.co/NUnMdT0DvT,,,2009-08-28 11:52:42,New York,Bloomberg Markets,https://pbs.twimg.com/profile_images/991798238519971840/0dG9AoKr_normal.jpg,1063544,286,14319,156022,markets,
69620713,2021-02-11 02:06:29,,,"trib.al/9rcnOef, ",1359760701590556673,False,23,1,0,7,SocialFlow,Who will build the Apple Car? Here are the candidates to watch https://t.co/SDIAEAID08,,,2009-08-28 11:52:42,New York,Bloomberg Markets,https://pbs.twimg.com/profile_images/991798238519971840/0dG9AoKr_normal.jpg,1063544,286,14319,156022,markets,
69620713,2021-02-10 21:47:05,,,"trib.al/SSCjxas, ",1359695425121435648,False,17,3,2,6,SocialFlow,Who will build the Apple Car? Here are the candidates to watch https://t.co/KRCGapTXSy,,,2009-08-28 11:52:42,New York,Bloomberg Markets,https://pbs.twimg.com/profile_images/991798238519971840/0dG9AoKr_normal.jpg,1063544,286,14319,156022,markets,
69620713,2021-02-10 08:01:01,,,"trib.al/HRKP1hq, ",1359487538734526464,False,40,2,4,9,SocialFlow,"This is the inside story of how Tim Cook made his mark after Steve Jobs, deepened ties with China, navigated the Trump era, used privacy to pressure Facebook, and built Apple into a $2.3 trillion fortress. https://t.co/jlxJ8VVaNg via @BW","BW, ",,2009-08-28 11:52:42,New York,Bloomberg Markets,https://pbs.twimg.com/profile_images/991798238519971840/0dG9AoKr_normal.jpg,1063544,286,14319,156022,markets,
69620713,2021-02-10 05:25:05,,,"trib.al/QMiuNgQ, ",1359448293173047299,False,26,0,1,8,SocialFlow,"This is the inside story of how Tim Cook made his mark after Steve Jobs, deepened ties with China, navigated the Trump era, used privacy to pressure Facebook, and built Apple into a $2.3 trillion fortress. https://t.co/OdR4Rg43me via @BW","BW, ",,2009-08-28 11:52:42,New York,Bloomberg Markets,https://pbs.twimg.com/profile_images/991798238519971840/0dG9AoKr_normal.jpg,1063544,286,14319,156022,markets,
69620713,2021-02-09 22:11:07,,,"trib.al/6ZWJNhA, ",1359339085488357380,False,47,1,6,10,SocialFlow,"This is the inside story of how Tim Cook made his mark after Steve Jobs, deepened ties with China, navigated the Trump era, used privacy to pressure Facebook, and built Apple into a $2.3 trillion fortress. https://t.co/0ALQAjojGf via @BW","BW, ",,2009-08-28 11:52:42,New York,Bloomberg Markets,https://pbs.twimg.com/profile_images/991798238519971840/0dG9AoKr_normal.jpg,1063544,286,14319,156022,markets,
69620713,2021-02-09 18:03:24,,,"trib.al/NNbg7LX, ",1359276745623564288,False,32,1,1,9,SocialFlow,"This is the inside story of how Tim Cook made his mark after Steve Jobs, deepened ties with China, navigated the Trump era, used privacy to pressure Facebook, and built Apple into a $2.3 trillion fortress. https://t.co/9uWnfOuSDy via @BW","BW, ",,2009-08-28 11:52:42,New York,Bloomberg Markets,https://pbs.twimg.com/profile_images/991798238519971840/0dG9AoKr_normal.jpg,1063544,286,14319,156022,markets,
69620713,2021-02-08 14:00:27,,,"trib.al/V85DirK, ",1358853215593373700,False,57,19,8,17,SocialFlow,"RBC Capital Markets says Apple should follow in Tesla’s footsteps — by getting into cryptocurrencies, not building electric vehicles https://t.co/C9HXsdm1g4",,,2009-08-28 11:52:42,New York,Bloomberg Markets,https://pbs.twimg.com/profile_images/991798238519971840/0dG9AoKr_normal.jpg,1063544,286,14319,156022,markets,
69620713,2021-02-08 00:41:02,,,"trib.al/RHVcWUi, ",1358652034937987072,False,33,3,0,12,SocialFlow,Hyundai and Kia say they are not in discussion with Apple on making electric vehicles https://t.co/LQREbUCIP9,,,2009-08-28 11:52:42,New York,Bloomberg Markets,https://pbs.twimg.com/profile_images/991798238519971840/0dG9AoKr_normal.jpg,1063544,286,14319,156022,markets,
69620713,2021-02-07 20:57:40,,,"trib.al/t5JEKy7, ",1358595821743329280,False,20,1,0,6,SocialFlow,"Japanese firm Renesas Electronics says it’s in talks to acquire Dialog Semiconductor, the U.K. chip designer whose clients include Apple https://t.co/JRzLUpFihT",,,2009-08-28 11:52:42,New York,Bloomberg Markets,https://pbs.twimg.com/profile_images/991798238519971840/0dG9AoKr_normal.jpg,1063544,286,14319,156022,markets,
69620713,2021-02-07 19:46:22,,,"trib.al/cyPkLaR, ",1358577882432483332,False,42,8,2,21,SocialFlow,Hyundai and Kia say they are not in discussion with Apple on making electric vehicles https://t.co/IsaVqgTk7m,,,2009-08-28 11:52:42,New York,Bloomberg Markets,https://pbs.twimg.com/profile_images/991798238519971840/0dG9AoKr_normal.jpg,1063544,286,14319,156022,markets,
69620713,2021-02-07 08:39:30,,,"trib.al/qnMRghH, ",1358410058158264325,False,37,1,3,15,SocialFlow,"BREAKING: Dialog Semiconductor, the U.K. chip designer whose clients include Apple Inc., is holding talks with suitors including Renesas Electronics
https://t.co/SwMcMBjo60",,,2009-08-28 11:52:42,New York,Bloomberg Markets,https://pbs.twimg.com/profile_images/991798238519971840/0dG9AoKr_normal.jpg,1063544,286,14319,156022,markets,
69620713,2021-02-05 18:00:32,,,"trib.al/wKXpNP3, ",1357826469209243650,False,48,4,7,11,SocialFlow,"Apple has held talks with Hyundai and Kia about building an electric vehicle, though the discussions paused recently https://t.co/VEB4A282zP",,,2009-08-28 11:52:42,New York,Bloomberg Markets,https://pbs.twimg.com/profile_images/991798238519971840/0dG9AoKr_normal.jpg,1063544,286,14319,156022,markets,
69620713,2021-02-02 21:54:01,,,"trib.al/mGn6pBw, ",1356798066603483141,False,159,18,6,55,SocialFlow,"Apple to invest $3.6 billion in Kia to make electric vehicles, DongA newspaper says https://t.co/Eoaj4OErXH",,,2009-08-28 11:52:42,New York,Bloomberg Markets,https://pbs.twimg.com/profile_images/991798238519971840/0dG9AoKr_normal.jpg,1063544,286,14319,156022,markets,
69620713,2021-02-01 09:19:12,,,"trib.al/IP7wW0r, ",1356245721855512577,False,38,0,3,9,SocialFlow,"Apple is selling bonds just days after a blowout period for sales, still eager to take advantage of cheap borrowing costs amid a cautious earnings outlook https://t.co/GAsJArerS0",,,2009-08-28 11:52:42,New York,Bloomberg Markets,https://pbs.twimg.com/profile_images/991798238519971840/0dG9AoKr_normal.jpg,1063544,286,14319,156022,markets,
69620713,2021-02-01 03:25:59,,,"trib.al/iaJzz6J, ",1356156832071475201,False,13,1,1,5,SocialFlow,The EU seeks to overturn Apple’s victory in a $15.8 billion tax dispute https://t.co/TLb2YeVRLj,,,2009-08-28 11:52:42,New York,Bloomberg Markets,https://pbs.twimg.com/profile_images/991798238519971840/0dG9AoKr_normal.jpg,1063544,286,14319,156022,markets,
69620713,2021-01-25 20:45:12,,,"trib.al/ROHlkE9, ",1353881644042776577,False,25,0,2,8,SocialFlow,Apple's top hardware executive is stepping down from his role to lead a new project at the company https://t.co/MS2GZFAeG8,,,2009-08-28 11:52:42,New York,Bloomberg Markets,https://pbs.twimg.com/profile_images/991798238519971840/0dG9AoKr_normal.jpg,1063544,286,14319,156022,markets,
69620713,2021-01-25 11:04:24,,,"bloom.bg/3r32xur, pic.twitter.com/o6K70is6Ss, ",1353735481306066949,False,118,8,2,48,TweetDeck,Apple at all time high https://t.co/MhOqzpxJD8 https://t.co/o6K70is6Ss,,,2009-08-28 11:52:42,New York,Bloomberg Markets,https://pbs.twimg.com/profile_images/991798238519971840/0dG9AoKr_normal.jpg,1063544,286,14319,156022,markets,photo
69620713,2021-01-24 21:23:49,,,"trib.al/rC1xK7R, ",1353528972974452737,False,16,1,0,7,SocialFlow,Hedge funds have fallen back in love with technology giants after spending the final months of last year cutting back on these stocks https://t.co/FFWArUrVrX,,,2009-08-28 11:52:42,New York,Bloomberg Markets,https://pbs.twimg.com/profile_images/991798238519971840/0dG9AoKr_normal.jpg,1063544,286,14319,156022,markets,
69620713,2021-01-22 08:39:40,,,"trib.al/z7Pq0Kf, ",1352611894666944512,False,53,3,7,21,SocialFlow,Google and Facebook are facing antitrust lawsuits. Amazon and Apple could be next https://t.co/ZrGWtvUJ4e,,,2009-08-28 11:52:42,New York,Bloomberg Markets,https://pbs.twimg.com/profile_images/991798238519971840/0dG9AoKr_normal.jpg,1063544,286,14319,156022,markets,
69620713,2021-01-21 20:39:11,,,"trib.al/mHks7lw, ",1352430580386902018,False,29,0,3,10,SocialFlow,"Bitcoin slumps — again. China fails to meet its U.S. trade deal targets. Apple is working on a virtual reality headset. 

Here are the things you need to know at the start of Asia's trading day https://t.co/oTC7cDbVqW",,,2009-08-28 11:52:42,New York,Bloomberg Markets,https://pbs.twimg.com/profile_images/991798238519971840/0dG9AoKr_normal.jpg,1063544,286,14319,156022,markets,
69620713,2021-01-13 04:21:40,,,"trib.al/C9PB7NB, ",1349285476872683520,False,22,6,2,6,SocialFlow,"Foxconn is setting up a car venture, strengthening its automotive capabilities as Apple looks to expand into vehicles https://t.co/8U4HXwwJcX",,,2009-08-28 11:52:42,New York,Bloomberg Markets,https://pbs.twimg.com/profile_images/991798238519971840/0dG9AoKr_normal.jpg,1063544,286,14319,156022,markets,
69620713,2021-01-07 20:18:30,,,"trib.al/M3cTywM, pic.twitter.com/Ss4OFN7ioZ, ",1347351943958683650,False,229,16,4,82,SocialFlow,"BREAKING: Hyundai shares surged as much as 18%, the most intraday since 1988, after a report said the carmaker was in talks with Apple to cooperate on developing self-driving vehicles https://t.co/fFf9rTAWb8 https://t.co/Ss4OFN7ioZ",,,2009-08-28 11:52:42,New York,Bloomberg Markets,https://pbs.twimg.com/profile_images/991798238519971840/0dG9AoKr_normal.jpg,1063544,286,14319,156022,markets,photo
69620713,2020-12-23 04:46:19,,,"trib.al/MXN0he2, ",1341681534743539713,False,63,0,5,16,SocialFlow,VW's CEO says cash-rich technology giants invading the auto industry pose a much bigger challenge than traditional rivals like Toyota https://t.co/tqV3vC59xZ,,,2009-08-28 11:52:42,New York,Bloomberg Markets,https://pbs.twimg.com/profile_images/991798238519971840/0dG9AoKr_normal.jpg,1063544,286,14319,156022,markets,
69620713,2020-12-23 03:20:05,,,"trib.al/NMT0Kpl, ",1341659832709996545,False,12,0,0,2,SocialFlow,"BREAKING: Hong Kong’s Jimmy Lai freed on bail, local media report. 

Shares of Next Digital jumped as much as 15% after the reports of Lai’s bail. https://t.co/xTpnXCzRUH",,,2009-08-28 11:52:42,New York,Bloomberg Markets,https://pbs.twimg.com/profile_images/991798238519971840/0dG9AoKr_normal.jpg,1063544,286,14319,156022,markets,
69620713,2020-12-22 18:20:00,,,"trib.al/wcNwScW, ",1341523914640470016,False,27,6,3,5,SocialFlow,"Apple’s reported foray into making its own self-driving, electric cars creates “a new Tesla bear case,” according to Morgan Stanley https://t.co/qFS55Jd9X2",,,2009-08-28 11:52:42,New York,Bloomberg Markets,https://pbs.twimg.com/profile_images/991798238519971840/0dG9AoKr_normal.jpg,1063544,286,14319,156022,markets,
69620713,2020-12-22 13:09:35,,,"trib.al/SSCI5m4, pic.twitter.com/zNK0ylNcvl, ",1341445798010220545,False,214,26,13,84,SocialFlow,Apple's stock returns to near-record levels after Reuters said the tech giant plans to build a self-driving car in 2024 https://t.co/O2JBAGn5Xy https://t.co/zNK0ylNcvl,,,2009-08-28 11:52:42,New York,Bloomberg Markets,https://pbs.twimg.com/profile_images/991798238519971840/0dG9AoKr_normal.jpg,1063544,286,14319,156022,markets,photo
69620713,2020-12-22 01:54:31,,,"trib.al/6IFWQtU, ",1341275912147525632,False,8,0,1,5,SocialFlow,"Cautious sentiment as investors eye a mutated Covid-19 in Britain, and Apple is pushing on with self-driving car plans. Get ready for Tuesday https://t.co/eWm7hoku3R",,,2009-08-28 11:52:42,New York,Bloomberg Markets,https://pbs.twimg.com/profile_images/991798238519971840/0dG9AoKr_normal.jpg,1063544,286,14319,156022,markets,
69620713,2020-12-10 23:27:03,,,"trib.al/zi0Haco, ",1337252531240640514,False,44,0,1,9,SocialFlow,Apple CEO Tim Cook tells employees that it “seems likely” that the majority of teams won’t be back in the office before June 2021 https://t.co/ByJlyJGORU,,,2009-08-28 11:52:42,New York,Bloomberg Markets,https://pbs.twimg.com/profile_images/991798238519971840/0dG9AoKr_normal.jpg,1063544,286,14319,156022,markets,
69620713,2020-12-02 08:07:03,,,"trib.al/jzzaUkG, ",1334121903221510145,False,24,2,2,6,SocialFlow,Apple is sued in several European countries on charges of making misleading claims about the battery life of older iPhones https://t.co/uA4vnVldGF,,,2009-08-28 11:52:42,New York,Bloomberg Markets,https://pbs.twimg.com/profile_images/991798238519971840/0dG9AoKr_normal.jpg,1063544,286,14319,156022,markets,
