author_id,created_at,entities_cashtags,entities_hashtags,entities_urls,tweet_id,possibly_sensitive,public_metrics_like_count,public_metrics_quote_count,public_metrics_reply_count,public_metrics_retweet_count,source,text,entities_mentions,in_reply_to_user_id,created_at_user,location,name,profile_image_url,public_metrics_followers_count,public_metrics_following_count,public_metrics_listed_count,public_metrics_tweet_count,username,media_type
69620713,2021-09-16 03:59:02,,,"trib.al/fV5oJCe, ",1438412096744697863,False,16,0,3,1,SocialFlow,"Unless you're an influencer, you're fine with an older iPhone https://t.co/flxOkaN76E via @bopinion","bopinion, ",,2009-08-28 11:52:42,New York,Bloomberg Markets,https://pbs.twimg.com/profile_images/991798238519971840/0dG9AoKr_normal.jpg,1063544,286,14319,156022,markets,
69620713,2021-09-16 01:00:43,,,"trib.al/eU50cJk, ",1438367218753024004,False,14,1,2,10,SocialFlow,China's Oppo is cutting around 20% of staff in key teams after expanding too rapidly and trying to take on Apple https://t.co/c8a4TIWhSZ,,,2009-08-28 11:52:42,New York,Bloomberg Markets,https://pbs.twimg.com/profile_images/991798238519971840/0dG9AoKr_normal.jpg,1063544,286,14319,156022,markets,
69620713,2021-09-15 12:19:59,,,"trib.al/dZpILEB, ",1438175775744790536,False,9,1,2,2,SocialFlow,“Failure to identify future tech today could mean missing out on the next big revolution” https://t.co/7SA6biSiUi,,,2009-08-28 11:52:42,New York,Bloomberg Markets,https://pbs.twimg.com/profile_images/991798238519971840/0dG9AoKr_normal.jpg,1063544,286,14319,156022,markets,
69620713,2021-09-14 19:57:03,,"5things, ","trib.al/5UUuCUn, ",1437928413935906816,False,12,1,3,5,SocialFlow,#5things: Xi turns down Biden’s invitation for a face-to-face meeting. Differing Covid strategies are tearing Australia apart. Apple launches the iPhone 13. Here’s what you need to know at the start of Asia's trading day https://t.co/PrU3PXUePn,,,2009-08-28 11:52:42,New York,Bloomberg Markets,https://pbs.twimg.com/profile_images/991798238519971840/0dG9AoKr_normal.jpg,1063544,286,14319,156022,markets,
69620713,2021-09-14 17:49:58,,,"trib.al/IfOuWBI, ",1437896430690217994,False,21,0,3,8,SocialFlow,Apple unveiled a new iPhone 13 with a similar design and lineup as last year’s models https://t.co/aZiOch8Ofl,,,2009-08-28 11:52:42,New York,Bloomberg Markets,https://pbs.twimg.com/profile_images/991798238519971840/0dG9AoKr_normal.jpg,1063544,286,14319,156022,markets,
69620713,2021-09-14 16:48:01,,,"trib.al/tvoUycl, ",1437880841737314304,False,17,0,1,1,SocialFlow,"Apple unveil a revamped iPad mini, alongside a faster entry-level model https://t.co/uMQTqZj8Us",,,2009-08-28 11:52:42,New York,Bloomberg Markets,https://pbs.twimg.com/profile_images/991798238519971840/0dG9AoKr_normal.jpg,1063544,286,14319,156022,markets,
69620713,2021-09-14 15:22:33,,,"trib.al/fyeZod4, ",1437859331458932748,False,22,1,0,3,SocialFlow,"Apple unveiled an upgraded Apple Watch, adding larger displays, new watch faces and an updated user interface, but didn’t provide a specific release date https://t.co/m6BBhRT6f1",,,2009-08-28 11:52:42,New York,Bloomberg Markets,https://pbs.twimg.com/profile_images/991798238519971840/0dG9AoKr_normal.jpg,1063544,286,14319,156022,markets,
69620713,2021-09-14 06:52:48,,"5Things, ","trib.al/L102edZ, pic.twitter.com/aNJhsTX2wf, ",1437731046959767562,False,29,1,3,17,SocialFlow,"#5Things
-Inflation 
-Oil supply
-Long Covid
-Markets quiet
-Apple
https://t.co/nCdYP7o0AQ https://t.co/aNJhsTX2wf",,,2009-08-28 11:52:42,New York,Bloomberg Markets,https://pbs.twimg.com/profile_images/991798238519971840/0dG9AoKr_normal.jpg,1063544,286,14319,156022,markets,photo
69620713,2021-09-10 19:17:06,,,"trib.al/hIbHSMl, ",1436468806168322057,False,19,1,1,3,SocialFlow,"Friday's ruling ordering Apple to make changes to its App Store business model, could cost the company a few billion dollars annually https://t.co/d5rpvAgwxe",,,2009-08-28 11:52:42,New York,Bloomberg Markets,https://pbs.twimg.com/profile_images/991798238519971840/0dG9AoKr_normal.jpg,1063544,286,14319,156022,markets,
69620713,2021-09-10 11:48:33,,,"trib.al/K3uwtxv, pic.twitter.com/pyBP8v1V6R, ",1436355925292601356,False,168,14,16,48,SocialFlow,Apple drops https://t.co/d6h4MO28jp https://t.co/pyBP8v1V6R,,,2009-08-28 11:52:42,New York,Bloomberg Markets,https://pbs.twimg.com/profile_images/991798238519971840/0dG9AoKr_normal.jpg,1063544,286,14319,156022,markets,photo
69620713,2021-09-10 11:42:58,,,"trib.al/mZTTdYt, ",1436354519978369026,False,26,4,0,14,SocialFlow,Apple was ordered by a court to change the way it operates its lucrative App Store https://t.co/LjKXivmJLs,,,2009-08-28 11:52:42,New York,Bloomberg Markets,https://pbs.twimg.com/profile_images/991798238519971840/0dG9AoKr_normal.jpg,1063544,286,14319,156022,markets,
69620713,2021-09-08 17:53:05,,,"trib.al/4ToFb3g, ",1435722888087277571,False,13,0,3,3,SocialFlow,Ford poaching away Apple’s car chief suggests there’s more than just a recovery narrative coming out of Dearborn. A turnaround is actually taking hold https://t.co/4YImSWPhln,,,2009-08-28 11:52:42,New York,Bloomberg Markets,https://pbs.twimg.com/profile_images/991798238519971840/0dG9AoKr_normal.jpg,1063544,286,14319,156022,markets,
69620713,2021-09-02 20:30:08,,"5things, ","trib.al/KMnLXrI, ",1433588083673473025,False,5,0,0,1,SocialFlow,#5things: HSBC bets on China's swelling middle class. Three vaccine shots could become standard in the U.S. Apple's new watch will jam more data onto your wrist. Here’s what you need to know at the start of Asia's trading day https://t.co/GYeGvScTFb,,,2009-08-28 11:52:42,New York,Bloomberg Markets,https://pbs.twimg.com/profile_images/991798238519971840/0dG9AoKr_normal.jpg,1063544,286,14319,156022,markets,
69620713,2021-09-02 10:17:05,,,"trib.al/EVJO8ej, ",1433433804052520963,False,18,0,1,3,SocialFlow,A federal judge allowed a lawsuit against Apple to proceed with a claim that its Siri voice assistant violates users’ privacy https://t.co/lyqAYLQ4wU,,,2009-08-28 11:52:42,New York,Bloomberg Markets,https://pbs.twimg.com/profile_images/991798238519971840/0dG9AoKr_normal.jpg,1063544,286,14319,156022,markets,
69620713,2021-09-02 01:06:48,,,"trib.al/TQGffhJ, ",1433295319677157382,False,6,0,0,0,SocialFlow,"Apple data show a rise in driving activity in India and Indonesia, where strict restrictions were rolled back., while traffic in Vietnam and Australia eased on extended lockdowns https://t.co/PHcxBL1aEk",,,2009-08-28 11:52:42,New York,Bloomberg Markets,https://pbs.twimg.com/profile_images/991798238519971840/0dG9AoKr_normal.jpg,1063544,286,14319,156022,markets,
69620713,2021-09-01 23:34:03,,,"trib.al/SJrBe3n, ",1433271980942372866,False,18,1,3,7,SocialFlow,Apple will allow third-party app developers to link from their software to external websites to let customers sign up for services https://t.co/HwYxT5U7pW,,,2009-08-28 11:52:42,New York,Bloomberg Markets,https://pbs.twimg.com/profile_images/991798238519971840/0dG9AoKr_normal.jpg,1063544,286,14319,156022,markets,
69620713,2021-09-01 20:32:04,"AAPL, ",,"trib.al/zNwhByd, pic.twitter.com/AeKixGAmKx, ",1433226183546703878,False,40,4,1,22,SocialFlow,"BREAKING: Apple will allow third-party app developers to link from their software to external websites to let customers sign up for services, resolving a long-running dispute https://t.co/BttgQ2RX4M $AAPL https://t.co/AeKixGAmKx",,,2009-08-28 11:52:42,New York,Bloomberg Markets,https://pbs.twimg.com/profile_images/991798238519971840/0dG9AoKr_normal.jpg,1063544,286,14319,156022,markets,animated_gif
69620713,2021-09-01 09:55:04,,,"trib.al/UKfSgqx, ",1433065875729526784,False,6,0,1,1,SocialFlow,"Apple's upcoming smartwatch model is suffering production snags as manufacturers adjust to a new design, likely leading to delays https://t.co/U8cFxBQqqP",,,2009-08-28 11:52:42,New York,Bloomberg Markets,https://pbs.twimg.com/profile_images/991798238519971840/0dG9AoKr_normal.jpg,1063544,286,14319,156022,markets,
69620713,2021-09-01 03:32:02,,,"trib.al/3rqMdLp, ",1432969482218127360,False,9,0,1,5,SocialFlow,"Apple's upcoming smartwatch model is suffering production snags as manufacturers adjust to a new design, likely leading to delays https://t.co/yHWoIu0RYO",,,2009-08-28 11:52:42,New York,Bloomberg Markets,https://pbs.twimg.com/profile_images/991798238519971840/0dG9AoKr_normal.jpg,1063544,286,14319,156022,markets,
69620713,2021-08-31 16:22:05,,,"trib.al/zPjARxP, ",1432800882471677952,False,8,0,0,3,SocialFlow,"Apple's upcoming smartwatch model is suffering production snags as manufacturers adjust to a new design, likely leading to delays https://t.co/ecpdYrHOkX",,,2009-08-28 11:52:42,New York,Bloomberg Markets,https://pbs.twimg.com/profile_images/991798238519971840/0dG9AoKr_normal.jpg,1063544,286,14319,156022,markets,
69620713,2021-08-31 10:22:44,,,"trib.al/LkyH9qp, ",1432710451863896075,False,26,0,2,3,SocialFlow,"South Korea became the first country to force Apple and Google to open up their app stores to other payment systems, setting a potentially radical precedent https://t.co/g1QQMdAREb",,,2009-08-28 11:52:42,New York,Bloomberg Markets,https://pbs.twimg.com/profile_images/991798238519971840/0dG9AoKr_normal.jpg,1063544,286,14319,156022,markets,
69620713,2021-08-30 18:13:05,,,"trib.al/vCrjs7J, ",1432466430109397001,False,51,4,2,21,SocialFlow,Apple plans to add satellite capabilities to future iPhones to aid with emergency situations https://t.co/mDw0qsDo6h,,,2009-08-28 11:52:42,New York,Bloomberg Markets,https://pbs.twimg.com/profile_images/991798238519971840/0dG9AoKr_normal.jpg,1063544,286,14319,156022,markets,
69620713,2021-08-30 13:59:45,,,"trib.al/XwmBPqa, ",1432402675904225280,False,13,1,1,6,SocialFlow,Apple has acquired classical-music streaming service Primephonic https://t.co/gfQy9sOA8g,,,2009-08-28 11:52:42,New York,Bloomberg Markets,https://pbs.twimg.com/profile_images/991798238519971840/0dG9AoKr_normal.jpg,1063544,286,14319,156022,markets,
69620713,2021-08-22 22:36:01,,,"trib.al/KDsdMLa, ",1429633496969060354,False,11,1,1,5,SocialFlow,"Apple reverses controversial changes to the iOS 15 Safari browser on the iPhone while also delaying the update’s marquee feature

@markgurman has all the details in this week's Power On https://t.co/wZMqGU7MUg","markgurman, ",,2009-08-28 11:52:42,New York,Bloomberg Markets,https://pbs.twimg.com/profile_images/991798238519971840/0dG9AoKr_normal.jpg,1063544,286,14319,156022,markets,
69620713,2021-08-20 01:47:06,,,"trib.al/wE3wp0O, ",1428594418861420545,False,24,2,1,8,SocialFlow,"Apple is delaying its return to corporate offices from October until January at the earliest because of surging Covid-19 cases and new variants, according to a memo sent to employees https://t.co/XARnkKKC4j",,,2009-08-28 11:52:42,New York,Bloomberg Markets,https://pbs.twimg.com/profile_images/991798238519971840/0dG9AoKr_normal.jpg,1063544,286,14319,156022,markets,
69620713,2021-08-20 00:35:59,,,"trib.al/TZeb3iP, pic.twitter.com/OUHXEuO4eZ, ",1428576524337360896,False,60,3,1,23,SocialFlow,BREAKING: Apple is delaying its return to offices until January at the earliest as Covid cases surge https://t.co/aRraylKygB https://t.co/OUHXEuO4eZ,,,2009-08-28 11:52:42,New York,Bloomberg Markets,https://pbs.twimg.com/profile_images/991798238519971840/0dG9AoKr_normal.jpg,1063544,286,14319,156022,markets,animated_gif
69620713,2021-08-16 17:32:01,,,"trib.al/B6KOqLx, ",1427382667138449418,False,92,2,1,12,SocialFlow,Apple told U.S. and European retail staff it plans to bring back in-person classes at its stores on Aug. 30 https://t.co/LmmDritRaN,,,2009-08-28 11:52:42,New York,Bloomberg Markets,https://pbs.twimg.com/profile_images/991798238519971840/0dG9AoKr_normal.jpg,1063544,286,14319,156022,markets,
69620713,2021-08-16 17:19:04,,,"trib.al/Qtlwyyp, ",1427379404603277312,False,35,1,1,8,SocialFlow,"Apple plans one of its biggest product rollouts ever for 2021, including new iPhones, AirPods, Apple Watches, iPads, Macs and more. @markgurman has all the details in this week's Power On https://t.co/UVrWop5Gxx via @business","markgurman, business, ",,2009-08-28 11:52:42,New York,Bloomberg Markets,https://pbs.twimg.com/profile_images/991798238519971840/0dG9AoKr_normal.jpg,1063544,286,14319,156022,markets,
69620713,2021-08-16 07:41:03,,,"trib.al/e1b7MO8, ",1427233944626470915,False,11,1,3,4,SocialFlow,U.S. lawmakers are taking a direct shot at Apple and Google's app stores https://t.co/D8oUaLOQlN,,,2009-08-28 11:52:42,New York,Bloomberg Markets,https://pbs.twimg.com/profile_images/991798238519971840/0dG9AoKr_normal.jpg,1063544,286,14319,156022,markets,
69620713,2021-08-16 05:49:07,,,"trib.al/GsefULM, ",1427205774242091012,False,19,2,1,8,SocialFlow,"Apple plans one of its biggest product rollouts ever for 2021, including new iPhones, AirPods, Apple Watches, iPads, Macs and more. @markgurman has all the details in this week's Power On https://t.co/HQ4z5Cb9kU","markgurman, ",,2009-08-28 11:52:42,New York,Bloomberg Markets,https://pbs.twimg.com/profile_images/991798238519971840/0dG9AoKr_normal.jpg,1063544,286,14319,156022,markets,
69620713,2021-08-16 00:28:03,,,"trib.al/qxT8I9U, ",1427124975920721923,False,57,5,4,14,SocialFlow,"Apple plans one of its biggest product rollouts ever for 2021, including new iPhones, AirPods, Apple Watches, iPads, Macs and more. @markgurman has all the details in this week's Power On https://t.co/c428Vmh844","markgurman, ",,2009-08-28 11:52:42,New York,Bloomberg Markets,https://pbs.twimg.com/profile_images/991798238519971840/0dG9AoKr_normal.jpg,1063544,286,14319,156022,markets,
69620713,2021-08-13 17:44:09,,,"trib.al/dQ0wPQx, ",1426298556592365568,False,38,3,1,12,SocialFlow,Apple was told to pay $300 million in royalties after a retrial in a patent dispute over wireless technology used in its iPhones and other products https://t.co/fsamdjXzxF,,,2009-08-28 11:52:42,New York,Bloomberg Markets,https://pbs.twimg.com/profile_images/991798238519971840/0dG9AoKr_normal.jpg,1063544,286,14319,156022,markets,
69620713,2021-08-13 16:18:35,,,"trib.al/3NBpfYK, ",1426277019650772999,False,10,2,1,4,SocialFlow,Apple has warned retail and online sales staff to be ready to field questions from consumers about the company’s upcoming features for limiting the spread of child pornography https://t.co/MfOcQMfOll,,,2009-08-28 11:52:42,New York,Bloomberg Markets,https://pbs.twimg.com/profile_images/991798238519971840/0dG9AoKr_normal.jpg,1063544,286,14319,156022,markets,
69620713,2021-08-12 02:09:17,,,"trib.al/lVvwDU1, ",1425700900325236739,False,17,3,1,4,SocialFlow,Samsung is positioning its new Galaxy Z Flip 3 as a direct rival to Apple’s upcoming iPhone release https://t.co/Q1qzyiPEbo,,,2009-08-28 11:52:42,New York,Bloomberg Markets,https://pbs.twimg.com/profile_images/991798238519971840/0dG9AoKr_normal.jpg,1063544,286,14319,156022,markets,
69620713,2021-08-11 03:18:04,,,"trib.al/jrAZJra, ",1425355822113202178,False,36,1,5,11,SocialFlow,iPhone camera and chip improvements can seem a little uninspiring. But the real magic is their effect on Apple’s earnings https://t.co/XpSOfYFjma,,,2009-08-28 11:52:42,New York,Bloomberg Markets,https://pbs.twimg.com/profile_images/991798238519971840/0dG9AoKr_normal.jpg,1063544,286,14319,156022,markets,
69620713,2021-08-11 01:47:05,,,"trib.al/CQd8pqT, ",1425332923675332610,False,22,1,2,4,SocialFlow,"Apple's next iPhones will get major camera updates, including a video version of Portrait mode, and a faster A15 chip https://t.co/G9MO8tyRbM",,,2009-08-28 11:52:42,New York,Bloomberg Markets,https://pbs.twimg.com/profile_images/991798238519971840/0dG9AoKr_normal.jpg,1063544,286,14319,156022,markets,
69620713,2021-08-09 07:15:08,,,"trib.al/kAjhrPF, ",1424690705843331072,False,24,2,4,6,SocialFlow,"Amazon's move into digital advertising has mostly come at the expense of Google, but now it's starting to grab market share from Facebook too https://t.co/cqbMzmHeBz",,,2009-08-28 11:52:42,New York,Bloomberg Markets,https://pbs.twimg.com/profile_images/991798238519971840/0dG9AoKr_normal.jpg,1063544,286,14319,156022,markets,
69620713,2021-08-06 17:43:04,,,"trib.al/FneIz5R, ",1423761565954760707,False,6,4,3,5,SocialFlow,"Apple defended concerns about its upcoming child safety features, saying it doesn’t believe it creates a backdoor that reduces privacy https://t.co/KOGB6BvSg9",,,2009-08-28 11:52:42,New York,Bloomberg Markets,https://pbs.twimg.com/profile_images/991798238519971840/0dG9AoKr_normal.jpg,1063544,286,14319,156022,markets,
69620713,2021-08-06 00:07:09,,,"trib.al/W3NcEls, ",1423495838005964802,False,23,4,3,12,SocialFlow,Apple will analyze photos stored in a user’s iCloud Photos account for sexually explicit images of children and then report instances to relevant authorities https://t.co/xIIFDiMRYI,,,2009-08-28 11:52:42,New York,Bloomberg Markets,https://pbs.twimg.com/profile_images/991798238519971840/0dG9AoKr_normal.jpg,1063544,286,14319,156022,markets,
69620713,2021-08-05 16:33:26,,,"trib.al/Q5jojh8, ",1423381657046982658,False,19,4,4,6,SocialFlow,Apple will analyze photos stored in a user’s iCloud Photos account for sexually explicit images of children and then report instances to relevant authorities https://t.co/oc5onvaK7p,,,2009-08-28 11:52:42,New York,Bloomberg Markets,https://pbs.twimg.com/profile_images/991798238519971840/0dG9AoKr_normal.jpg,1063544,286,14319,156022,markets,
69620713,2021-08-03 18:34:06,,,"trib.al/71d6Q9a, ",1422687244679368708,False,35,5,0,11,SocialFlow,"Apple and Affirm are planning to launch a “buy now, pay later” program for Apple device purchases in Canada https://t.co/SpfLRbYzZw",,,2009-08-28 11:52:42,New York,Bloomberg Markets,https://pbs.twimg.com/profile_images/991798238519971840/0dG9AoKr_normal.jpg,1063544,286,14319,156022,markets,
69620713,2021-08-02 09:32:06,,,"trib.al/hWdZoLu, ",1422188460543258625,False,27,1,2,5,SocialFlow,"The iPhone, iPad, Mac and Apple Watch all use different chargers. It's time for Apple to simplify that. https://t.co/MZKFWjMpQ2",,,2009-08-28 11:52:42,New York,Bloomberg Markets,https://pbs.twimg.com/profile_images/991798238519971840/0dG9AoKr_normal.jpg,1063544,286,14319,156022,markets,
69620713,2021-08-02 01:32:05,,,"trib.al/FxU07NK, ",1422067660783820803,False,40,3,2,6,SocialFlow,"The iPhone, iPad, Mac and Apple Watch all use different chargers. It's time for Apple to simplify that. https://t.co/iCayle2xuM",,,2009-08-28 11:52:42,New York,Bloomberg Markets,https://pbs.twimg.com/profile_images/991798238519971840/0dG9AoKr_normal.jpg,1063544,286,14319,156022,markets,
69620713,2021-07-31 12:45:10,,,"trib.al/4uxRmto, ",1421512272833351689,False,14,2,3,7,SocialFlow,"The “Tinder for anti-vaxxers"" is getting no love from the Google or Apple app stores https://t.co/jVXebb6UkH",,,2009-08-28 11:52:42,New York,Bloomberg Markets,https://pbs.twimg.com/profile_images/991798238519971840/0dG9AoKr_normal.jpg,1063544,286,14319,156022,markets,
69620713,2021-07-31 12:10:06,,,"trib.al/5PN0MQT, ",1421503445715013634,False,4,1,1,1,SocialFlow,What’s buzzing on social media this morning https://t.co/BwSF1nt5BM,,,2009-08-28 11:52:42,New York,Bloomberg Markets,https://pbs.twimg.com/profile_images/991798238519971840/0dG9AoKr_normal.jpg,1063544,286,14319,156022,markets,
69620713,2021-07-30 14:34:15,,,"trib.al/zOilPDr, ",1421177336637034500,False,12,1,2,5,SocialFlow,"Individual investors are piling into the likes of Apple and Microsoft, showing a new appetite for megacap stocks after a rush of earnings sent some of the biggest tech names slumping https://t.co/lEwpxB5LlO",,,2009-08-28 11:52:42,New York,Bloomberg Markets,https://pbs.twimg.com/profile_images/991798238519971840/0dG9AoKr_normal.jpg,1063544,286,14319,156022,markets,
69620713,2021-07-30 14:21:46,,,"trib.al/mLjxKfq, ",1421174193731821570,False,41,5,4,5,SocialFlow,Elon Musk denies a report from an upcoming book that he spoke with Tim Cook about Apple potentially buying Tesla https://t.co/tmAuDFwgej,,,2009-08-28 11:52:42,New York,Bloomberg Markets,https://pbs.twimg.com/profile_images/991798238519971840/0dG9AoKr_normal.jpg,1063544,286,14319,156022,markets,
69620713,2021-07-30 06:21:37,,,"trib.al/a4ulRpH, ",1421053359671365632,False,16,2,2,6,SocialFlow,"""Buy now, pay later"" installment plans are having a moment again, and Apple, PayPal, and other tech giants want in https://t.co/Yw7dIpqmA2",,,2009-08-28 11:52:42,New York,Bloomberg Markets,https://pbs.twimg.com/profile_images/991798238519971840/0dG9AoKr_normal.jpg,1063544,286,14319,156022,markets,
69620713,2021-07-29 10:57:09,,,"trib.al/ZXMPp00, ",1420760312567844864,False,15,1,1,4,SocialFlow,Apple Back in Bond Market With Shareholder Returns in Focus https://t.co/P40ojHMD4e,,,2009-08-28 11:52:42,New York,Bloomberg Markets,https://pbs.twimg.com/profile_images/991798238519971840/0dG9AoKr_normal.jpg,1063544,286,14319,156022,markets,
69620713,2021-07-28 17:59:03,,,"trib.al/ggtUJXP, ",1420504100660207617,False,13,2,2,2,SocialFlow,Apple plans to restore a mask requirement at most of its U.S. retail stores for both customers and staff https://t.co/IlNgNs6eI7,,,2009-08-28 11:52:42,New York,Bloomberg Markets,https://pbs.twimg.com/profile_images/991798238519971840/0dG9AoKr_normal.jpg,1063544,286,14319,156022,markets,
69620713,2021-07-27 20:59:04,,"5things, ","trib.al/JhC8tqy, ",1420187014775951364,False,11,1,0,3,SocialFlow,#5things: The slump in U.S.-listed Chinese shares accelerates. Apple warns of slowing sales growth. Phuket’s quarantine-free reopening to tourists is under threat. Here’s what you need to know at the start of Asia's day https://t.co/OPXTW0GkMp,,,2009-08-28 11:52:42,New York,Bloomberg Markets,https://pbs.twimg.com/profile_images/991798238519971840/0dG9AoKr_normal.jpg,1063544,286,14319,156022,markets,
69620713,2021-07-20 04:09:06,,,"trib.al/0Ordler, ",1417396132402106368,False,23,1,1,2,SocialFlow,Apple is pushing back its return to office deadline by at least a month as Covid variants surge https://t.co/J9z1djPYuf,,,2009-08-28 11:52:42,New York,Bloomberg Markets,https://pbs.twimg.com/profile_images/991798238519971840/0dG9AoKr_normal.jpg,1063544,286,14319,156022,markets,
69620713,2021-07-20 00:03:11,,,"trib.al/mr02Lhx, pic.twitter.com/i1IpnSvcbO, ",1417334244595183640,False,61,5,1,24,SocialFlow,"EXCLUSIVE: Apple is delaying its return-to-office deadline by at least a month, to October at the earliest, as Covid variants surge across many countries https://t.co/mvqqP3dhub https://t.co/i1IpnSvcbO",,,2009-08-28 11:52:42,New York,Bloomberg Markets,https://pbs.twimg.com/profile_images/991798238519971840/0dG9AoKr_normal.jpg,1063544,286,14319,156022,markets,animated_gif
69620713,2021-07-13 15:33:51,,,"trib.al/B5eHrZa, ",1415031742021443586,False,31,5,0,5,SocialFlow,"Apple is working on a new “buy now, pay later” service that will let consumers pay for any Apple Pay purchase in installments, rivaling offerings from Affirm and PayPal https://t.co/qCn7vQZKfh",,,2009-08-28 11:52:42,New York,Bloomberg Markets,https://pbs.twimg.com/profile_images/991798238519971840/0dG9AoKr_normal.jpg,1063544,286,14319,156022,markets,
69620713,2021-07-07 21:36:38,,,"trib.al/10DXlpI, ",1412948711219605505,False,15,2,0,5,SocialFlow,"-The Fed sees elevated uncertainty
-Haiti plunges into chaos after president’s assassination
-Apple surges to a record close

Here are some of the things to know at the start of Asia's trading day https://t.co/o46jIhD6pw",,,2009-08-28 11:52:42,New York,Bloomberg Markets,https://pbs.twimg.com/profile_images/991798238519971840/0dG9AoKr_normal.jpg,1063544,286,14319,156022,markets,
69620713,2021-07-07 17:09:15,,,"trib.al/vDZOkH5, ",1412881419102216193,False,15,2,1,4,SocialFlow,"Apple closed at record high Wednesday, smashing its January peak as some on Wall Street forecast a stronger rally over the next six months https://t.co/f5UerOPxZ0",,,2009-08-28 11:52:42,New York,Bloomberg Markets,https://pbs.twimg.com/profile_images/991798238519971840/0dG9AoKr_normal.jpg,1063544,286,14319,156022,markets,
69620713,2021-06-28 21:25:25,,,"trib.al/vFQoWg7, ",1409684396228198412,False,17,0,0,8,SocialFlow,"-Wall Street banks funnel cash back to investors
-Fear grips Hong Kong media after China crushes Apple Daily
-Hedge funds turn to Japanese startups

Here are some of the things to know at the start of Asia's trading day https://t.co/zEizETo6Xf",,,2009-08-28 11:52:42,New York,Bloomberg Markets,https://pbs.twimg.com/profile_images/991798238519971840/0dG9AoKr_normal.jpg,1063544,286,14319,156022,markets,
69620713,2021-06-28 13:21:03,,,"trib.al/V7foj7G, trib.al/jdzIldv, pic.twitter.com/y7Z8Rk2dpU, ",1409562500367007748,False,8,1,4,1,SocialFlow,"Bigger iPads and changes to the Apple Car team? Mark Gurman @markgurman dives into what big tech is exploring in his new newsletter https://t.co/zNuGCahCSz

Sign up here to get Power On in your inbox each Sunday ➡️ https://t.co/gAscgpWsoq https://t.co/y7Z8Rk2dpU","markgurman, ",,2009-08-28 11:52:42,New York,Bloomberg Markets,https://pbs.twimg.com/profile_images/991798238519971840/0dG9AoKr_normal.jpg,1063544,286,14319,156022,markets,photo
69620713,2021-06-28 11:59:03,,,"trib.al/nFLxDRl, trib.al/1XlV6XC, pic.twitter.com/IjDj4UVzWu, ",1409541867067346950,False,5,1,0,0,SocialFlow,"Bigger iPads and changes to the Apple Car team? Mark Gurman @markgurman dives into what big tech is exploring in his new newsletter https://t.co/ANV8Gj0Hwc

Sign up here to get Power On in your inbox each Sunday ➡️ https://t.co/FoirBpoRp9 https://t.co/IjDj4UVzWu","markgurman, ",,2009-08-28 11:52:42,New York,Bloomberg Markets,https://pbs.twimg.com/profile_images/991798238519971840/0dG9AoKr_normal.jpg,1063544,286,14319,156022,markets,photo
