author_id,created_at,entities_cashtags,entities_hashtags,entities_urls,tweet_id,possibly_sensitive,public_metrics_like_count,public_metrics_quote_count,public_metrics_reply_count,public_metrics_retweet_count,source,text,entities_mentions,in_reply_to_user_id,created_at_user,location,name,profile_image_url,public_metrics_followers_count,public_metrics_following_count,public_metrics_listed_count,public_metrics_tweet_count,username,media_type
4795110508,2021-09-26 20:16:26,,,,1442281943895248898,False,1,0,0,0,Twitter for iPhone,"david is wearing a coors light shirt and some dude in dollar general walked up to him and pointed at his shirt, high fived him and yelled “hell yeah keeping the dream alive brother”",,,2016-01-13 09:48:54,she/her 🏳️‍🌈,laney,https://pbs.twimg.com/profile_images/1447594887646416904/WBUHSA6S_normal.jpg,308,357,0,4481,lamely_laney,
940331912,2021-09-26 20:08:05,,,,1442279843903725568,False,3,0,0,0,Twitter for Android,"explaining to my sister
why her rich sorority
sisters aren't proud
of her for ""saving
money by buying
the things from
Dollar General""",,,2012-11-10 20:33:55,,=,https://pbs.twimg.com/profile_images/1442278412303933442/AmtoN-xe_normal.jpg,158,52,0,1120,Joy_2_Li_World,
3582964217,2021-09-26 20:01:17,,,,1442278130492792834,False,0,0,0,0,"Cheap Bots, Done Quick!",Colton the calm purple monkey from Dollar General,,,2015-09-07 22:10:43,,toynamerbot,https://abs.twimg.com/sticky/default_profile_images/default_profile_normal.png,18,0,9,318438,toynamerbot,
1267850012425322496,2021-09-26 19:54:39,,,,1442276462149742592,False,0,0,0,0,Twitter for iPhone,Let’s cancel dollar general specifically if they in in a corn field in the middle of nowhere,,,2020-06-02 12:06:29,,Abby Williams,https://pbs.twimg.com/profile_images/1302469547044360194/mO809JcD_normal.jpg,5,243,0,158,AbbyWil88710213,
526979838,2021-09-26 19:43:37,,,"pic.twitter.com/UDcHFb6ZfS, pic.twitter.com/UDcHFb6ZfS, pic.twitter.com/UDcHFb6ZfS, pic.twitter.com/UDcHFb6ZfS, ",1442273685046501377,False,4,0,0,0,Twitter for Android,"Local Dollar General put a few cards out including 2020-21 Absolute Memorabilia Basketball cards. 1:4 packs contain game used cards. If you're buying online, just know its easy just to look at from the side and see if if has the extra game used card inserted or not. https://t.co/UDcHFb6ZfS",,,2012-03-16 21:35:38,,SportsAndHype,https://pbs.twimg.com/profile_images/1401006201249411076/nZ0kJPv7_normal.jpg,1262,25,17,81,_SportsAndHype,photo
321038471,2021-09-26 19:41:51,,,,1442273242799124480,False,3,0,0,0,Twitter for iPhone,I fucc wit target &amp; Walmart but i find everything i need in dollar general &amp; family dollar...,,,2011-06-20 18:51:09,,Neiman_Miller,https://pbs.twimg.com/profile_images/1450612219109072900/NJ_i-n3V_normal.jpg,843,899,3,94766,Reecefoe,
1346985212975190018,2021-09-26 19:30:56,,,,1442270493755596802,False,0,0,0,0,Twitter for Android,"Total at the other store I stopped at, Dollar General, 6.

Got me curious as to what happened in 1957? And how it relates to 1989.",,,2021-01-06 20:01:41,,Mike,https://pbs.twimg.com/profile_images/1346991359308124163/pbAvz5hD_normal.jpg,28,698,0,15520,PokeyJoe527,
3293453589,2021-09-26 19:11:24,,,,1442265577347817475,False,1,0,0,0,Twitter for iPhone,"Went to the dollar general and got frozen meals for lunch, cheez it’s and 2 pieces of pie",,,2015-05-21 20:02:57,Piña Coladaburg ,tommy talahassee🗿,https://pbs.twimg.com/profile_images/1450578402965016576/ZBIeoqdt_normal.jpg,425,267,11,124058,kingofjanitors,
580484805,2021-09-26 19:04:47,,,"smartqponclips.com/dollar-general…, ",1442263911210885120,False,0,0,0,0,Twitter Web App,Dollar General SUPER EARLY 10/10 - 10/16 Early Ad Scan is live  https://t.co/FFfkzKqL3T,,,2012-05-14 21:10:59,Barker NY,DAnna Drake,https://pbs.twimg.com/profile_images/2542442669/ghydem7t4htb4hu1exmy_normal.jpeg,122,224,2,2291,dlm4332,
1209040141311852545,2021-09-26 18:56:34,,,,1442261846711439362,False,2,0,0,0,Twitter for iPhone,My dollar tree turned into a dollar general 🥳,,,2019-12-23 04:16:55,"Colorado, USA",𝒦𝒶𝓉𝓇𝒾𝓃♡,https://pbs.twimg.com/profile_images/1420437147161485314/6la32uuR_normal.jpg,166,166,0,999,gypsymoonnnn,
88750354,2021-09-26 18:51:00,,,,1442260444186431489,False,0,0,0,0,Twitter for iPhone,Dollar General does not carry one soft drink that is caffeine free.,,,2009-11-09 15:20:25,"Atlanta, Ga.",John I. Pritchard,https://pbs.twimg.com/profile_images/1429559150380453892/jMIaBYsq_normal.jpg,723,3032,6,19020,jpritchard14,
100240413,2021-09-26 18:49:21,,"Retail, Valley, ",,1442260028073779202,False,0,0,0,0,CareerArc 2.0,"Click the link in our bio to see currently open #Retail jobs like ""SALES ASSOCIATE in VALLEY, NE"" at Dollar General in #Valley, NE.",,,2009-12-29 09:44:23,"Council Bluffs, IA",TMJ-IAC Retail Jobs,https://pbs.twimg.com/profile_images/700299266711891968/rZ4y2QrG_normal.jpg,191,109,21,897,tmj_IAC_retail,
59887569,2021-09-26 18:46:00,,"Retail, Newark, ",,1442259187875016707,False,0,0,0,0,CareerArc 2.0,"Don't be shy. Score a job like ""SALES ASSOCIATE in NEWARK, DE"" at Dollar General by asking for referrals. It's a great way to get a meeting with HR. Check out the link in our bio to apply. #Retail #Newark, DE",,,2009-07-24 17:02:54,Delaware,TMJ-DE Retail Jobs,https://pbs.twimg.com/profile_images/694657093282869248/UIQXnDMo_normal.jpg,165,114,19,761,tmj_de_retail,
1442082271310204933,2021-09-26 18:40:21,,"getsum, ",,1442257764261117952,False,0,0,0,0,Twitter for iPhone,I once lived an entire month living on nothing more than Colorada koolaid and dollar general corn dogs #getsum,,,2021-09-26 07:03:09,,Donny corn dog,https://pbs.twimg.com/profile_images/1442094145552670721/1t1O9sN3_normal.jpg,3,11,0,3,corn_donny,
37519805,2021-09-26 18:35:12,,"Fordyce, Retail, ",,1442256467092930560,False,0,0,0,0,CareerArc 2.0,"Dollar General is hiring in #Fordyce, AR! Click the link in our bio to apply: STORE MANAGER CANDIDATE - Fordyce, AR #Retail",,,2009-05-03 18:30:57,Worldwide,TMJ Retail Jobs,https://pbs.twimg.com/profile_images/689251555472609280/ditJ0Izi_normal.jpg,318,126,10,1007,tmj_retailjobs,
59968066,2021-09-26 18:34:48,,"Retail, Mayville, ",,1442256365603344389,False,0,0,0,0,CareerArc 2.0,"Looking to score a job at Dollar General? You're in luck. Click the link in our bio for the job description and information on how to apply: SALES ASSOCIATE in MAYVILLE, ND #Retail #Mayville, ND",,,2009-07-24 23:28:29,North Dakota,TMJ-ND Retail Jobs,https://pbs.twimg.com/profile_images/670669099354034176/eY5jrOxw_normal.jpg,186,122,59,967,tmj_nd_retail,
18058293,2021-09-26 18:27:41,,,"waff.com//2021/09/26/cr…, ",1442254576887861250,False,4,0,0,2,SocialNewsDesk,ARSON UPDATE: The Madison County Sheriff's Office has confirmed it is investigating a tenth fire in a county-wide arson investigation. https://t.co/bxR2sVU8bj,,,2008-12-11 14:54:11,"Huntsville, AL",WAFF 48,https://pbs.twimg.com/profile_images/1432716842116829199/Rlod_o_y_normal.jpg,138429,648,912,160562,waff48,
40199130,2021-09-26 18:15:33,,,"dlvr.it/S8NwYs, ",1442251522646044672,False,0,0,0,0,dlvr.it,Super Hot Deal! Get it for only $4.14! Compare: Dollar General ($11.09) | Target ($11.93) | Instacart ($13.87) | Rite Aid ($14.53) https://t.co/htK5pxvXxi,,,2009-05-15 03:52:17,Cyberspace,eDealinfo.com,https://pbs.twimg.com/profile_images/1146295135640141828/c_zUMz6e_normal.jpg,831,17,76,496438,eDealinfoUSA,
4171805903,2021-09-26 18:08:39,,,,1442249786552307716,False,1,0,1,0,Twitter for iPhone,Can someone drive me to the dollar general,,,2015-11-12 09:23:03,indiana usa,ᒍᗩᖇEᗪ’ᔕ ᗯEᗷ 🐇💜,https://pbs.twimg.com/profile_images/1445527240935190528/Gtnjh6-d_normal.jpg,595,728,8,79606,_kinesthetiac_,
307612647,2021-09-26 17:57:43,,,"swarmapp.com/c/j3yqlbbxegD, ",1442247033453260800,False,0,0,0,0,Foursquare,"I'm at Dollar General in Starke, FL https://t.co/crN4nlLvgV",,,2011-05-29 19:50:33,"Starke, FL",glen garber jr,https://pbs.twimg.com/profile_images/3525796964/b430742fa85d84da2f34ebe15d1ad8b7_normal.jpeg,502,1872,4,2254,Jrglen,
219678530,2021-09-26 17:53:59,,"Amsterdam, supervisor, ","bit.ly/3kGOhqE, ",1442246094423945216,False,0,0,0,0,CareerArc 2.0,"If you're looking for work in #Amsterdam, NY, check out this job: https://t.co/FQfTxSGWD6 #supervisor",,,2010-11-25 10:14:34,"Albany, NY",Albany SupplyChain,https://pbs.twimg.com/profile_images/713068105350537216/DcWWmBYf_normal.jpg,406,213,7,501,tmj_NYA_schn,
1429881428968415238,2021-09-26 17:53:58,,,,1442246092049944578,False,13,0,3,0,Twitter for iPhone,Every town in Ohio is issued a Dollar General or Subway.,,,2021-08-23 15:01:22,Republic Of Ohio,uia ⛳,https://pbs.twimg.com/profile_images/1449782162727870466/jyJGgdj-_normal.jpg,1008,1198,3,5267,kommancap,
14372091,2021-09-26 17:50:06,,,"dlvr.it/S8Nsvy, ",1442245119046864896,False,0,0,0,1,dlvr.it,Dollar General: Buy $50 Apple Gift Cards &amp; Get $10 DoorDash Gift Cards Free https://t.co/sCMDJmEiZ4 via @FrequentMiler,"FrequentMiler, ",,2008-04-12 21:18:43,,BoardingArea,https://pbs.twimg.com/profile_images/1042455033680281600/pYylyZLe_normal.jpg,52849,342,1286,237434,BoardingArea,
99710051,2021-09-26 17:48:48,,"Elwood, Retail, ",,1442244791647891467,False,0,0,0,0,CareerArc 2.0,"If you're looking for work in #Elwood, IN, check out this #Retail job via the link in our bio: LEAD SALES ASSOCIATE-PT in ELWOOD, IN at Dollar General",,,2009-12-27 08:41:53,"Kokomo, IN",TMJ-INK Retail Jobs,https://pbs.twimg.com/profile_images/700339376627159040/k5nYY1cZ_normal.jpg,169,112,35,1089,tmj_INK_retail,
355156662,2021-09-26 17:45:39,,,"frequentmiler.com/dollar-general…, ",1442243998911975426,False,2,0,0,0,WordPress.com,"This is a decent offer on Apple and DoorDash gift cards, but there are a few quirks for how the promo works which you need to be aware of. https://t.co/AliiH0UIFt",,,2011-08-14 18:48:38,,Frequent Miler,https://pbs.twimg.com/profile_images/1313450965132095489/TUHaV305_normal.jpg,57033,261,858,20661,FrequentMiler,
100240413,2021-09-26 17:42:06,,"Retail, Omaha, ",,1442243104883367943,False,0,0,0,0,CareerArc 2.0,"Join the Dollar General team! See our latest #Retail job openings, including ""ASST STORE MGR in OMAHA, NE"", via the link in our bio. #Omaha, NE",,,2009-12-29 09:44:23,"Council Bluffs, IA",TMJ-IAC Retail Jobs,https://pbs.twimg.com/profile_images/700299266711891968/rZ4y2QrG_normal.jpg,191,109,21,897,tmj_IAC_retail,
210527787,2021-09-26 17:39:18,,,,1442242400781488132,False,0,1,1,0,Twitter for iPhone,would it be dumb to go to dollar general just to buy a bunch of snacks because i’m on my period and i want chocolate,,,2010-10-31 13:11:42,probably in bed,friendly neighborhood ghoul,https://pbs.twimg.com/profile_images/1376219059847622665/DJhESqjl_normal.jpg,538,432,1,31078,hiimgretchen,
606870524,2021-09-26 17:34:37,,,"twitter.com/PeteThamel/sta…, ",1442241221515100163,False,2,0,0,0,Twitter for iPad,RUN THE ACTUAL OPTION. Lunsford had a weird Dollar General version that never looked fully cohesive. https://t.co/4L9DSbS7AD,,,2012-06-13 00:02:29,Texas,Tech Won't Leave Me,https://pbs.twimg.com/profile_images/1436009460133150724/jBwEmlat_normal.jpg,2613,945,54,55845,CUSAbbs,
1342032603570954241,2021-09-26 17:33:47,,,,1442241013184008195,False,0,0,0,0,"Cheap Bots, Done Quick!","find me a yard sign that says 'in this dollar general we believe in: upzoning, universal childcare, ubi, free public transit, and abolishing the filibuster'",,,2020-12-24 04:01:31,pictures are AI-generated,this voter costs democrats the election,https://pbs.twimg.com/profile_images/1435000951195250689/XAwekYfU_normal.jpg,617,40,0,14460,ThisVoter,
100922774,2021-09-26 17:33:14,,,,1442240873748652035,False,1,0,2,0,Twitter for iPhone,"When you see a grown man riding a bicycle through town, Dollar General Store bags hanging from the handle bars, do you automatically assume that he’s lost his driving privileges? Or is that just me?",,,2010-01-01 01:49:26,Kentucky ,C. R. I. S. S. Y.,https://pbs.twimg.com/profile_images/1452431207833260040/keSMEIgQ_normal.jpg,3718,4215,50,34334,Criss_Chi,
36213881,2021-09-26 17:32:34,,,"dlvr.it/S8NrVh, pic.twitter.com/xao5wQUpyF, ",1442240704164478978,False,1,0,0,0,dlvr.it,How One Retailer Is Stepping Up To Serve Markets Others Don’t (Or Won’t) https://t.co/yuteF43kx9 https://t.co/xao5wQUpyF,,,2009-04-28 19:39:02,"New York, NY",Celia Tombalakian,https://pbs.twimg.com/profile_images/817100938859134977/uk6Xb5QZ_normal.jpg,75,487,1,4156,ctombalakian,photo
917042507581673473,2021-09-26 17:31:31,,,,1442240441491996677,False,1,0,1,0,Twitter for iPhone,If you frequent dollar general you’re a horrible person,,,2017-10-08 11:02:26,"Mission, TX",AD,https://pbs.twimg.com/profile_images/1435661506620837893/UaonQ7Iv_normal.jpg,84,139,0,289,Poser_Skater,
580484805,2021-09-26 17:28:45,,,"smartqponclips.com/dollar-general…, ",1442239743396392964,False,0,0,0,0,Twitter Web App,Dollar General 10/3 - 10/9 Early Ad Scan is live on the site  https://t.co/ZckXtutIga,,,2012-05-14 21:10:59,Barker NY,DAnna Drake,https://pbs.twimg.com/profile_images/2542442669/ghydem7t4htb4hu1exmy_normal.jpeg,122,224,2,2291,dlm4332,
59972446,2021-09-26 17:27:34,,"Glouster, Retail, ",,1442239447760703488,False,0,0,0,0,CareerArc 2.0,"This job is now open at Dollar General in #Glouster, OH. Follow us and turn on mobile alerts to hear about jobs like these as soon as they're posted: SALES ASSOCIATE in GLOUSTER, OH #Retail",,,2009-07-24 23:50:23,Ohio,TMJ-OH Retail Jobs,https://pbs.twimg.com/profile_images/666976623967776768/9RYI2mCG_normal.jpg,229,115,118,1339,tmj_oh_retail,
59968066,2021-09-26 17:27:33,,"Retail, ",,1442239443058888704,False,0,0,0,0,CareerArc 2.0,"See our latest ND #Retail job opportunity and click the link in our bio to apply: ASST STORE MGR in GARRISON, ND at Dollar General",,,2009-07-24 23:28:29,North Dakota,TMJ-ND Retail Jobs,https://pbs.twimg.com/profile_images/670669099354034176/eY5jrOxw_normal.jpg,186,122,59,967,tmj_nd_retail,
1075284980236873728,2021-09-26 17:26:05,,,"dlvr.it/S8Nqps, ",1442239075314900993,False,0,0,0,0,dlvr.it,Dollar General: Buy $50 Apple Gift Card &amp; Get $10 DoorDash Gift Card Free (Ends 10/9/21) https://t.co/ywJA7zMsSk,,,2018-12-19 02:01:31,,GC Galore,https://pbs.twimg.com/profile_images/1089676237893554176/rY3yASQF_normal.jpg,228,0,5,8948,GCGaloredotcom,
1176160335042088960,2021-09-26 17:23:33,,"Economy, ","dlvr.it/S8NqgD, pic.twitter.com/FeqyIVOKfJ, ",1442238436602040323,False,0,0,0,0,dlvr.it,"Dollar General Foundation grant to help support student reading programs | Latest Headlines: LAKE CITY, S.C. – The Dollar General Literacy Foundation recently awarded Florence School District 3 a $2,000 grant to support initiatives… https://t.co/9m7gXcb93O #Economy Seoul, Korea https://t.co/FeqyIVOKfJ",,,2019-09-23 11:44:20,"Seoul, Korea",Global Asset Management Seoul Korea,https://pbs.twimg.com/profile_images/1176160426226311168/ZyzL6lGx_normal.jpg,150,9,1,14128,GAMSeoulKorea,photo
38236168,2021-09-26 17:15:50,,"Retail, Kearney, ",,1442236496598102017,False,0,0,0,0,CareerArc 2.0,"Want to land a job like ""LEAD SALES ASSOCIATE-FT in KEARNEY, NE"" at Dollar General? Applicant tracking systems look for specific keywords. Use the right keywords and get your resume in front of the hiring manager. #Retail #Kearney, NE",,,2009-05-06 13:57:36,"Grand Island, NE",TMJ-NEG Jobs,https://pbs.twimg.com/profile_images/689965933004222464/JHNz1eJ9_normal.jpg,371,273,5,771,tmj_neg_jobs,
1075284980236873728,2021-09-26 17:14:33,,,"dlvr.it/S8NplV, ",1442236170214117379,False,0,0,0,0,dlvr.it,Dollar General: Buy $50 Apple Gift Card &amp; Get $10 DoorDash Gift Card Free (Ends 10/9/21) https://t.co/tQEiw4vDjf,,,2018-12-19 02:01:31,,GC Galore,https://pbs.twimg.com/profile_images/1089676237893554176/rY3yASQF_normal.jpg,228,0,5,8948,GCGaloredotcom,
40960230,2021-09-26 17:09:20,,"Retail, Pineville, ",,1442234857795436549,False,0,0,0,0,CareerArc 2.0,"Looking to score a job at Dollar General? You're in luck. Click the link in our bio for the job description and information on how to apply: LEAD SALES ASSOCIATE-PT in PINEVILLE, LA #Retail #Pineville, LA",,,2009-05-18 16:29:49,"Alexandria, LA",TMJ-LAA Jobs,https://pbs.twimg.com/profile_images/691118823911501824/Tmy4TOQc_normal.jpg,364,278,7,893,tmj_laa_jobs,
1075284980236873728,2021-09-26 17:08:03,,,"dlvr.it/S8Np6V, ",1442234536188801027,False,0,0,0,0,dlvr.it,Dollar General: Buy $50 Apple Gift Card &amp; Get $10 DoorDash Bonus Code Free (Ends 10/9/21) https://t.co/92NB1DcJJU,,,2018-12-19 02:01:31,,GC Galore,https://pbs.twimg.com/profile_images/1089676237893554176/rY3yASQF_normal.jpg,228,0,5,8948,GCGaloredotcom,
19523179,2021-09-26 17:07:56,,"MyDollarStoreShoppingSpree, ",,1442234505864097793,False,2,0,1,2,Twitter for Android,#MyDollarStoreShoppingSpree better be at Family Dollar or Dollar General. Dollar Tree is garbage.,,,2009-01-26 01:40:04,Floriduh,🦇🕸️🎃Joshy S. Pumpkins🎃🕸️🦇,https://pbs.twimg.com/profile_images/1447793416784519168/AJjvyVeb_normal.jpg,12938,14185,199,248923,JoshMarino420,
28700693,2021-09-26 17:04:18,,"Retail, Candler, ",,1442233594085216265,False,0,0,0,0,CareerArc 2.0,"Can you recommend anyone for this #Retail job in #Candler, NC? Click the link in our bio to see it and more. LEAD SALES ASSOCIATE-PT in CANDLER, NC at Dollar General",,,2009-04-03 20:47:36,"Asheville, NC",TMJ-ASH Retail Jobs,https://pbs.twimg.com/profile_images/671238245435314176/jDs-96VR_normal.jpg,225,119,64,1037,tmj_ash_retail,
1229602460639145984,2021-09-26 16:58:22,,,,1442232097951846401,False,3,0,0,0,Twitter for iPhone,Didn’t realize crying in the dollar general parking lot was on my to do list today and yet here we fucking are boys,,,2020-02-17 22:04:30,she/her/hers,welp,https://pbs.twimg.com/profile_images/1445977335174422530/utArTJGg_normal.jpg,69,95,0,3005,need_snack,
1176160335042088960,2021-09-26 16:52:36,,,"zpr.io/G3peg9Kev8UV, ",1442230646424883204,False,1,0,0,0,Zapier.com,Dollar General Foundation grant to help support student reading programs | Latest Headlines https://t.co/m3P5OFlpth,,,2019-09-23 11:44:20,"Seoul, Korea",Global Asset Management Seoul Korea,https://pbs.twimg.com/profile_images/1176160426226311168/ZyzL6lGx_normal.jpg,150,9,1,14128,GAMSeoulKorea,
18058293,2021-09-26 16:44:58,,,"waff.com//2021/09/26/cr…, ",1442228727182725124,False,3,0,0,2,SocialNewsDesk,MADISON POLICE: MPD has confirmed two more fires were reported on Saturday night. https://t.co/bxR2sVCxjL,,,2008-12-11 14:54:11,"Huntsville, AL",WAFF 48,https://pbs.twimg.com/profile_images/1432716842116829199/Rlod_o_y_normal.jpg,138429,648,912,160562,waff48,
99710051,2021-09-26 16:42:34,,"HartfordCity, Retail, ",,1442228121151803393,False,0,0,0,0,CareerArc 2.0,"We're hiring in #HartfordCity, IN! Click the link in our bio to apply to this job and more: ASST STORE MGR in HARTFORD CITY, IN at Dollar General #Retail",,,2009-12-27 08:41:53,"Kokomo, IN",TMJ-INK Retail Jobs,https://pbs.twimg.com/profile_images/700339376627159040/k5nYY1cZ_normal.jpg,169,112,35,1089,tmj_INK_retail,
28421031,2021-09-26 16:28:51,,"Retail, Durham, ",,1442224670317506561,False,0,0,0,0,CareerArc 2.0,"Can you recommend anyone for this #Retail job in #Durham, NC? Click the link in our bio to see it and more. STORE MANAGER in DURHAM, NC at Dollar General",,,2009-04-02 17:10:46,"RDU, NC",TMJ-RDU Retail Jobs,https://pbs.twimg.com/profile_images/669254856780087296/r3QJAFpU_normal.jpg,221,118,84,1071,tmj_rdu_retail,
37519805,2021-09-26 16:19:11,,"Retail, NewCastle, ",,1442222239529648133,False,0,0,0,0,CareerArc 2.0,"This #Retail job might be a great fit for you. Click the link in our bio to see it and more. ASST STORE MGR in NEW CASTLE, PA at Dollar General #NewCastle, PA",,,2009-05-03 18:30:57,Worldwide,TMJ Retail Jobs,https://pbs.twimg.com/profile_images/689251555472609280/ditJ0Izi_normal.jpg,318,126,10,1007,tmj_retailjobs,
350123599,2021-09-26 16:03:04,,,,1442218180865404932,False,0,1,0,0,Twitter for iPhone,Michigan DHS will promote anything. Fuck I look like getting a COVID shot at Dollar General 😭✌🏾,,,2011-08-07 03:17:26,"Michigan, USA",DE$.🌹,https://pbs.twimg.com/profile_images/1448514999106875394/iS_s6vqM_normal.jpg,3741,2691,4,85734,diorRlded,
40960230,2021-09-26 16:02:55,,"Retail, Cottonport, ",,1442218143728816132,False,0,0,0,0,CareerArc 2.0,"Want to land a job like ""ASST STORE MGR in COTTONPORT, LA"" at Dollar General? Applicant tracking systems look for specific keywords. Use the right keywords and get your resume in front of the hiring manager. #Retail #Cottonport, LA",,,2009-05-18 16:29:49,"Alexandria, LA",TMJ-LAA Jobs,https://pbs.twimg.com/profile_images/691118823911501824/Tmy4TOQc_normal.jpg,364,278,7,893,tmj_laa_jobs,
28695320,2021-09-26 16:02:35,,"Retail, EastAlton, ",,1442218059696001025,False,0,0,0,0,CareerArc 2.0,"Join the Dollar General team! See our latest #Retail job openings, including ""ASST STORE MGR in EAST ALTON, IL"", via the link in our bio. #EastAlton, IL",,,2009-04-03 20:18:57,"Saint Louis, MO",TMJ-STL Retail Jobs,https://pbs.twimg.com/profile_images/668786712038903808/eswT5gxW_normal.jpg,212,117,92,1205,tmj_stl_retail,
1015299918494420992,2021-09-26 15:58:45,,,,1442217097338097669,False,0,0,1,0,Twitter for iPhone,"But Dollar General, how is your juice row empty. Not you don’t have the kind I want, no the entire Row is empty…",,,2018-07-06 14:22:18,A place of peace,Des,https://pbs.twimg.com/profile_images/1440512718901944326/Yk32AfA4_normal.jpg,143,714,0,1430,DesmondAMartin,
2780762129,2021-09-26 15:51:08,,,,1442215178838306816,False,0,0,0,0,Twitter for iPhone,"Death, Taxes, &amp;  new Dollar General construction",,,2014-09-22 21:25:31,"Huntsville, AL",Hostile Bama Fan🐘,https://pbs.twimg.com/profile_images/1452687058519080960/OY13Epm1_normal.jpg,361,181,0,15242,thebarneybarnes,
39726041,2021-09-26 15:42:51,,"SanAntonio, Automotive, ",,1442213095108083715,False,0,0,0,0,CareerArc 2.0,"This job is now open at Dollar General in #SanAntonio, TX. Follow us and turn on mobile alerts to hear about jobs like these as soon as they're posted: TRAILER REPAIR MECHANIC #Automotive",,,2009-05-13 06:34:41,Worldwide,TMJ-Auto. Jobs,https://pbs.twimg.com/profile_images/690393946732756992/RDuQcnMD_normal.jpg,143,86,9,771,tmj_autojobs,
1404838532934508546,2021-09-26 15:42:27,,,,1442212994323304448,False,1,0,0,0,Twitter Web App,"Big box stores are getting afaird of dollar tree, family dollar and dollar general. .aka mom and pop stores these 3 are on top . Stock to the shelves and watch the customer buy it stay on top!!!!",,,2021-06-15 12:29:52,,Common sense,https://abs.twimg.com/sticky/default_profile_images/default_profile_normal.png,1,45,0,54,Commons71088060,
4416813460,2021-09-26 15:42:03,,,,1442212894775541763,False,0,0,1,0,Twitter for iPhone,The dollar general by my house is literally empty because the delivery drivers don’t want to get vaccinated,,,2015-12-08 09:54:43,league | anime | kpop,𝚓𝚊𝚢. ☪︎,https://pbs.twimg.com/profile_images/1356880621059112961/PiJqhr9r_normal.jpg,377,250,5,24779,hyunmilli,
58637559,2021-09-26 15:13:24,,,,1442205682825109510,False,0,0,0,0,Twitter for Android,That moment when you go to Dollar General with your mom and her friend. You JUST need ONE thing and walk away with a purchase of $35.,,,2009-07-20 20:04:11,Kentucky,Elise Diane Svoboda,https://pbs.twimg.com/profile_images/1345188566884904965/cGHoyTo3_normal.jpg,206,1483,7,2126,elisesvoboda,
29826574,2021-09-26 15:10:49,,"Retail, Leitchfield, ",,1442205033764769800,False,0,0,0,0,CareerArc 2.0,"Click the link in our bio to see currently open #Retail jobs like ""ASST STORE MGR in LEITCHFIELD, KY"" at Dollar General in #Leitchfield, KY.",,,2009-04-08 17:30:41,Worldwide,TMJ-Other,https://pbs.twimg.com/profile_images/686397773931925506/odA6aSuJ_normal.jpg,648,299,8,1442,tmj_jobs_other,
35975598,2021-09-26 15:01:42,,"Retail, Gates, ",,1442202737383411715,False,0,0,0,0,CareerArc 2.0,"Don't be shy. Score a job like ""LEAD SALES ASSOCIATE-FT in GATES, NC"" at Dollar General by asking for referrals. It's a great way to get a meeting with HR. Check out the link in our bio to apply. #Retail #Gates, NC",,,2009-04-27 23:33:04,"Newport News, VA",TMJ-VAP Retail Jobs,https://pbs.twimg.com/profile_images/688697859055550464/u95k4QdZ_normal.jpg,203,124,52,893,tmj_vap_retail,
2177499732,2021-09-26 14:51:22,,,,1442200140752703488,False,2,0,0,0,Hootsuite Inc.,Person attempting to pass a counterfeit bill: 420 East Morgan at the Dollar General.,,,2013-11-06 01:28:38,"Kokomo, IN. Howard County",Kokomo Scanner,https://pbs.twimg.com/profile_images/1272421851789234176/q7pS247s_normal.jpg,16487,123,85,125233,KokomoScanner,
1034242870650302464,2021-09-26 14:46:53,,,,1442199012317306887,False,4,0,0,0,Twitter for Android,Not me stopping in the middle of dollar general to put a tweet in my drafts.,,,2018-08-27 20:54:50,"Goodlettville, TN",Oh My Goshua,https://pbs.twimg.com/profile_images/1337959754044420097/AaRZoAyr_normal.jpg,119,253,0,2239,BeatYourYeet_,
1039260079864729601,2021-09-26 14:44:26,,,"pic.twitter.com/NADfdTCAR5, ",1442198393497944066,False,1,0,0,0,Twitter for iPhone,"R: Did you know we're exactly one Ooh La La Ah Oui Oui away from Dollar General?

Husband: You have a very strange way of measuring things. I like it. https://t.co/NADfdTCAR5",,,2018-09-10 17:11:26,"New Mexico, USA",🌈🦙 Rachel Glickler 🦩🌟,https://pbs.twimg.com/profile_images/1419862802907365378/lGDAT3fk_normal.jpg,5665,4357,49,8751,RachelGlickler,animated_gif
447646948,2021-09-26 14:36:34,,,,1442196414050836484,False,2,0,1,0,Twitter for iPhone,"Walked into the dollar general down the street

Asked the cashier bra you got like school suppliers I need a couple pens

Oh yeah we do I just don’t know where they’re at

????",,,2011-12-26 22:51:24,United States,kevv goff,https://pbs.twimg.com/profile_images/1318419953268248577/Imo33htG_normal.jpg,980,780,1,23078,kevvgoff,
