author_id,created_at,entities_cashtags,entities_hashtags,entities_urls,tweet_id,possibly_sensitive,public_metrics_like_count,public_metrics_quote_count,public_metrics_reply_count,public_metrics_retweet_count,source,text,entities_mentions,in_reply_to_user_id,created_at_user,location,name,profile_image_url,public_metrics_followers_count,public_metrics_following_count,public_metrics_listed_count,public_metrics_tweet_count,username,media_type
130385473,2021-09-29 14:32:14,,"Retail, Cumberland, ",,1443282488235724801,False,0,0,1,0,CareerArc 2.0,"Want to land a job like ""LEAD SALES ASSOCIATE-FT in CUMBERLAND, MD"" at Dollar General? Applicant tracking systems look for specific keywords. Use the right keywords and get your resume in front of the hiring manager. #Retail #Cumberland, MD",,,2010-04-07 00:12:01,"Winchester, VA",TMJ-VAW Retail Jobs,https://pbs.twimg.com/profile_images/709937738275905536/NLk99D-n_normal.jpg,230,158,46,934,tmj_VAW_retail,
47766759,2021-09-29 14:31:49,,,"twitter.com/AP_Oddities/st…, ",1443282381469847552,False,7,0,0,0,Twitter for iPhone,"So, a Family Dollar/Dollar General? https://t.co/FxvEPAK4tf",,,2009-06-16 19:04:15,"Brooklyn, NY",Xay Yarbroux,https://pbs.twimg.com/profile_images/1439985174989705216/ukfz5Yy9_normal.jpg,16748,1735,69,327451,hoodopulence,
1320211085778145282,2021-09-29 14:30:55,,,"twitter.com/AP_Oddities/st…, ",1443282154050424835,False,1,0,0,0,Twitter for iPhone,y’all please U are not dollar general u are dollar tree…. Why are you betraying me like this https://t.co/nnjMIF4dPb,,,2020-10-24 23:50:36,21 | she/her,stacey🕺🏻,https://pbs.twimg.com/profile_images/1452322485647679491/MiWCLOBE_normal.jpg,40,68,0,1632,chosopower,
534960024,2021-09-29 14:29:16,,,"twitter.com/AP_Oddities/st…, ",1443281740651507714,False,0,0,0,0,Twitter for iPhone,This is not the dollar general. I go because everything is $1 !! https://t.co/JPtEDSIXTD,,,2012-03-23 21:15:50,North Carolina,Kaitlyn 🎃,https://pbs.twimg.com/profile_images/1445016445574918161/IruGoLpM_normal.jpg,824,257,13,116498,KLack33,
32276984,2021-09-29 14:28:58,,,"pic.twitter.com/O9VIzmChcq, pic.twitter.com/O9VIzmChcq, ",1443281663438512138,False,2,0,0,0,Twitter Web App,"Gov'nr pays $100 to get vax'd at Dollar General
I link to the news asking for stories of unvax'd dying, said peeps should read comments from people telling about vax'd passing &amp; now a writer with AP wants to talk? I don't think they see things the same way I do, just a guess https://t.co/O9VIzmChcq",,,2009-04-16 23:03:46,"Kansas now, Native Texan",✨ Bulma 🍷🇺🇸✨,https://pbs.twimg.com/profile_images/1404532663839559686/lSmDU5rV_normal.jpg,2543,2219,8,26563,Bulma__Brief,photo
55894535,2021-09-29 14:28:40,,,"twitter.com/AP_Oddities/st…, ",1443281589534855184,False,0,0,0,0,Twitter for iPhone,"So the name Dollar Tree gotta change then too, right?

We already got Dollar General &amp; Family Dollar https://t.co/JcOiTOnknQ",,,2009-07-11 14:31:51,ATL✈️NC,R i c k e y 😈,https://pbs.twimg.com/profile_images/1259301642622709761/FfGA2zog_normal.jpg,5849,4933,2,31963,Rick3y_Bobby,
4855576272,2021-09-29 14:28:01,,,"twitter.com/AP_Oddities/st…, ",1443281425894158337,False,4,0,1,0,Twitter Web App,So they're gonna be Dollar General? We already have that https://t.co/i2SR6u57p7,,,2016-02-03 15:21:59,"West Haven, CT",Beth Mushin,https://pbs.twimg.com/profile_images/1451543625054232579/HjaQwN5k_normal.jpg,2558,1970,0,80636,beth_mushin,
2374690225,2021-09-29 14:27:23,,,"pic.twitter.com/UmHvkpFvMM, ",1443281265302589442,False,1,0,1,0,Twitter Web App,"Does this look familiar? dLCV surveyed Dollar General stores across VA this year and identified many barriers. If you encounter access barriers at Dollar General, you can speak with a store associate or call 1-877-463-1553 to report the problem! https://t.co/UmHvkpFvMM",,,2014-03-05 21:39:19,"Richmond, Virginia",disAbility Law VA,https://pbs.twimg.com/profile_images/926185581092073473/Hzv_XQaC_normal.jpg,561,319,27,1553,disAbilityLawVA,photo
3247259579,2021-09-29 14:25:57,,,"twitter.com/AP_Oddities/st…, ",1443280905783627781,False,0,0,0,0,Twitter for Android,"must have merged with $5 below, dollar general, and family dollar https://t.co/23tZ4pTX8K",,,2015-05-12 00:36:56,"Guangzhou, China",Mean Worded Tweet,https://pbs.twimg.com/profile_images/1297054890024488962/MpH-43ho_normal.jpg,20,22,3,21820,StopOhAlso,
235858351,2021-09-29 14:24:34,,,"twitter.com/AP_Oddities/st…, ",1443280559527059470,False,3,0,1,0,Twitter for iPhone,Bitch what? This isn’t Dollar General! https://t.co/9wDypOxULi,,,2011-01-09 01:56:34,"Dallas, TX",Kayla Thee Stallion.,https://pbs.twimg.com/profile_images/1267980346668220423/2f3mnAdJ_normal.jpg,5906,987,27,193369,KBZO_,
1683753816,2021-09-29 14:23:21,,,"twitter.com/AP_Oddities/st…, ",1443280250058772484,False,0,0,0,0,Twitter Web App,why does dollar tree wanna be dollar general and family dollar so bad https://t.co/WrIujzClqo,,,2013-08-19 13:31:54,"21, they/she, va",spookyrah,https://pbs.twimg.com/profile_images/1450189778062872576/YyTD3rcn_normal.jpg,1060,364,17,44028,skelesarah,
16542798,2021-09-29 14:22:53,,,"wfmz.com/news/area/poco…, ",1443280133222289417,False,1,0,3,0,SocialNewsDesk,Police looking for man who robbed Dollar General in Mount Pocono https://t.co/2fLd8lT2gI,,,2008-10-01 07:50:38,"Allentown, PA",WFMZ-TV 69News,https://pbs.twimg.com/profile_images/1232736891109285890/Ew47mk0V_normal.jpg,130327,121,775,89223,69News,
1228131560861335553,2021-09-29 14:22:05,,,,1443279933233586185,False,0,0,1,0,Twitter for iPhone,So Dollar Tree will now be Dollar General...,,,2020-02-13 20:39:38,,#𝕍𝕒𝕔𝕔𝕚𝕟𝕒𝕥𝕖𝕕𝔸𝔽 🏳️‍🌈 ,https://pbs.twimg.com/profile_images/1452971327363629057/cXo3_r8W_normal.jpg,199,401,0,8735,Justdrewisme,
28421031,2021-09-29 14:21:51,,"Retail, Raleigh, ",,1443279872948793344,False,0,0,0,0,CareerArc 2.0,"Click the link in our bio to see currently open #Retail jobs like ""ASST STORE MGR in RALEIGH, NC"" at Dollar General in #Raleigh, NC.",,,2009-04-02 17:10:46,"RDU, NC",TMJ-RDU Retail Jobs,https://pbs.twimg.com/profile_images/669254856780087296/r3QJAFpU_normal.jpg,221,118,84,1071,tmj_rdu_retail,
37777220,2021-09-29 14:20:03,,,"twitter.com/AP_Oddities/st…, ",1443279420425392135,False,0,0,0,0,Twitter for iPhone,so what is dollar general doing LMFAOOOOOOOO https://t.co/xeLK486GhS,,,2009-05-04 18:24:22,htx,katana 🫀,https://pbs.twimg.com/profile_images/1445716955881619474/fAAze1Rg_normal.jpg,2558,989,9,223572,xarxan_,
51296635,2021-09-29 14:19:42,,,"twitter.com/AP_Oddities/st…, ",1443279334706487300,False,0,0,0,0,Twitter Web App,"We have 5 Below for this nonsense! Dollar Tree is $1 items, you goofballs!  Dollar General also has $2 &amp; $3 items!  Leave my Dollar Tree alone!!! https://t.co/KdQjsqVD3O",,,2009-06-26 20:59:52,"Charlotte, NC",Carol Wands (Rowcroft) -Trekie386-,https://pbs.twimg.com/profile_images/1404339661816934400/uk4sL1yN_normal.jpg,946,1387,0,6140,KailieLevesque,
1348127949439070208,2021-09-29 14:19:35,,"dollartree, ","twitter.com/AP_Oddities/st…, ",1443279303605637123,False,0,0,0,0,Twitter for iPhone,Noooooooo the best part about #dollartree is everything there is a dollar (except for the greeting cards which are 2 for $1). Theres a reason i go to dollar tree instead of dollar general 😤 https://t.co/oaCQdB7rCx,,,2021-01-09 23:42:22,"Los Angeles, CA",Miss Beverly Hill,https://pbs.twimg.com/profile_images/1453123259835297795/lSTKtPoq_normal.jpg,55,713,0,1649,fav_ho,
1384530445552005121,2021-09-29 14:18:44,,,"twitter.com/MorningBrew/st…, ",1443279090421800962,False,0,0,0,0,Twitter Web App,"Dollar General, Family Dollar, 5 Below... and now Dollar Tree? 
I'm old enough to remember when ATMs gave you 5 dollar bills https://t.co/mmYKrrtj5q",,,2021-04-20 11:32:44,The Asphalt Jungle,GOAT of GOATS,https://pbs.twimg.com/profile_images/1384530670123429888/_IqAitp__normal.jpg,33,38,0,2937,GOATofGOATS_MMA,
2815836672,2021-09-29 14:18:29,,,"twitter.com/AP_Oddities/st…, ",1443279025481396230,False,0,0,0,0,Twitter for iPhone,so they’re becoming family dollar and dollar general finally??? lmao https://t.co/YegZn8zWFw,,,2014-09-17 19:38:59,the normandy. ,abby 🎃🐀,https://pbs.twimg.com/profile_images/1452293506190413839/lGD37XpW_normal.jpg,1135,1854,32,93532,punyparker,
1116432491051724806,2021-09-29 14:18:23,,,"twitter.com/sylviamphofe/s…, ",1443279002412765196,False,1,0,1,0,Twitter for iPhone,Dollar General and Family Dollar need to take the word “DOLLAR” out they name cuz aint nun in there for a $1 😒 https://t.co/qM77zuIvRv,,,2019-04-11 16:07:02,In Pain.,"dunder mifflin, this is Cam",https://pbs.twimg.com/profile_images/1417345634143719435/f5vrkDE4_normal.jpg,1584,1415,0,16935,geauxtcam,
884569312161390595,2021-09-29 14:17:38,,,"twitter.com/AP_Oddities/st…, ",1443278811408261128,False,1,0,0,0,Twitter for iPhone,"As someone who relied on them during the lowest times of my life:

Why did you have to break my heart like this? Dollar General was a lie every time and now you too? https://t.co/6K59oGJ5aa",,,2017-07-10 20:25:33,"Iowa City, IA","Elise Barlow, MHA",https://pbs.twimg.com/profile_images/1047955702633906178/CMe_XGQS_normal.jpg,292,454,0,1548,ShallowBarlow,
18451147,2021-09-29 14:17:19,,,,1443278735009013768,False,0,0,0,0,TweetDeck,Dollar General has a hug opening here,,,2008-12-29 10:15:16,,Charles,https://pbs.twimg.com/profile_images/1435374128178028546/76fgKURa_normal.jpg,3588,1805,140,451287,repub9989,
1007020358053040132,2021-09-29 14:16:49,,,"twitter.com/AP_Oddities/st…, ",1443278609184182275,False,0,0,0,0,Twitter for iPhone,Dollar General the ones where everything a dollar anyway. https://t.co/Jpg5EhvMTH,,,2018-06-13 18:02:17,"Tampa, FL",Gado On The Beat 🇳🇬,https://pbs.twimg.com/profile_images/1451202333732261888/dNfd_V2p_normal.jpg,1389,1142,2,56899,DelgadoBeats,
1215007511004270592,2021-09-29 14:16:11,,,"twitter.com/sylviamphofe/s…, ",1443278449825755138,False,0,0,0,0,Twitter for iPhone,Turning into Dollar General. https://t.co/MyLscQGSIp,,,2020-01-08 15:29:09,,Cori Sigma,https://pbs.twimg.com/profile_images/1445310944356278277/rm-Bme-t_normal.jpg,725,0,9,144343,Cori_Sigma,
237406656,2021-09-29 14:15:07,,,"twitter.com/AP_Oddities/st…, ",1443278178533920774,False,0,0,1,0,Twitter for iPhone,Maaaannn we already have stores like this it’s called Family Dollar and Dollar General https://t.co/07MJ7a4kAs,,,2011-01-12 14:37:10,Forever @ Target,tis the season to be a scorpio,https://pbs.twimg.com/profile_images/1418992290199216133/lGEm-6wO_normal.jpg,939,835,3,96376,kilobyyte,
2337271759,2021-09-29 14:14:36,,,,1443278048795758598,False,0,0,0,0,Twitter for iPhone,Somebody daddy at dollar general getting they Mack on okkkkkk 😂😂,,,2014-02-10 16:11:17,hugh. ,Toni Macaroni,https://pbs.twimg.com/profile_images/1445007834630983686/K9lJFkFb_normal.jpg,1920,1053,6,80590,Pretty__Tone,
188857635,2021-09-29 14:13:48,,"SupplyChain, Jonesville, ",,1443277850094686210,False,0,0,0,0,CareerArc 2.0,"Don't be shy. Score a job like ""INBOUND/OUTBOUND MANAGER in JONESVILLE, SC"" at Dollar General Distribution Center by asking for referrals. It's a great way to get a meeting with HR. Check out the link in our bio to apply. #SupplyChain #Jonesville, SC",,,2010-09-09 15:20:19,"Greenville, SC",GreenvilleSC S-Chain,https://pbs.twimg.com/profile_images/713320006038106117/KAeXhujQ_normal.jpg,262,213,12,661,tmj_GRN_schn,
1327817565121503232,2021-09-29 14:13:47,,,"twitter.com/sylviamphofe/s…, ",1443277844931616768,False,0,0,0,0,Twitter Web App,"LMFAOO not the ""What in dollar general is this nonsense"" https://t.co/fet60WjJNF",,,2020-11-14 22:36:05,"Washington, DC Roblox",Tray🤍✨,https://pbs.twimg.com/profile_images/1445510139444793349/Z7FK2xpk_normal.jpg,311,725,0,2515,TrayPardise_,
22216060,2021-09-29 14:12:18,,,"twitter.com/AP_Oddities/st…, ",1443277469512052744,False,0,0,0,0,Twitter for iPhone,so another dollar general? fucking boo https://t.co/IA0NJQmoNq,,,2009-02-27 20:38:33,7th & Hardy,Kraft Punk,https://pbs.twimg.com/profile_images/1328764660980518915/l0LJfjpa_normal.jpg,1210,861,22,87026,KillOffCarl,
1074294100923465729,2021-09-29 14:12:09,,,,1443277435076816906,False,4,0,0,2,Twitter for Android,"Dollar Tree just lost a gazillion customers. TF we need them for if everything ain't ONE DOLLAR?!?!? I'll just drive right past them on my way to WalMart, Dollar General, or Family Dollar.",,,2018-12-16 08:24:07,,LaDivaScorpion,https://pbs.twimg.com/profile_images/1437924962132795402/b6gMSSaR_normal.jpg,825,1124,0,28744,FierceAssSistah,
1317154807,2021-09-29 14:11:15,,,,1443277205673549833,False,4,0,0,0,Twitter for Android,It is really the end times for America if Dollar Tree is turning into Dollar General.,,,2013-03-30 16:39:38,,Lexi,https://pbs.twimg.com/profile_images/1452983410784415755/EAFHU4me_normal.jpg,1000,216,9,1489,yuvatos,
1059080990,2021-09-29 14:09:34,,,"twitter.com/AP_Oddities/st…, ",1443276783890190339,False,49,0,2,8,Twitter for iPhone,"So we’re just gonna get another family dollar, dollar general, five below type store… https://t.co/AmdnxWbBwU",,,2013-01-03 18:51:00,South Jersey/Lenape land,A Spoopy Mélloween 👻🎃,https://pbs.twimg.com/profile_images/1432778353107419136/apLvXQOy_normal.jpg,1112,638,10,65081,Melljoee,
2217935757,2021-09-29 14:07:49,,,"twitter.com/AP_Oddities/st…, ",1443276344109019139,False,0,0,0,0,Twitter for iPhone,ABSOLUTELY NOT. TAKE THAT SHIT TO DOLLAR GENERAL!!! https://t.co/OSvwgB4P0L,,,2013-12-10 12:44:10,,mac 🎃,https://pbs.twimg.com/profile_images/1447023066727518209/gX9BJrvY_normal.jpg,578,317,2,37987,myIoveIanguage,
178367674,2021-09-29 14:07:20,,,"twitter.com/AP_Oddities/st…, ",1443276222126039042,False,0,0,1,0,Twitter Web App,"I get confused between Dollar Tree and Dollar General, but before they were in New York City, I went to one in Baltimore and I kept asking my cousin how much stuff cost, and she laughed and said everything is $1. Not at Dollar Tree anymore. https://t.co/Eyb3CMPbUS",,,2010-08-14 11:42:05,New York City,Jazz Johnson,https://pbs.twimg.com/profile_images/696191651157512192/FPj26Oz6_normal.png,1458,1446,53,56585,JazzJohnson10,
61376447,2021-09-29 14:06:29,,,"twitter.com/AP_Oddities/st…, ",1443276005179801601,False,3,0,1,0,Twitter Web App,What you're describing there is a Dollar General https://t.co/AsQA3RgD8e,,,2009-07-29 23:18:52,PA,Johnny,https://pbs.twimg.com/profile_images/1374237738283716608/C-zt3jkJ_normal.jpg,243,1722,1,8213,johnnyzcz,
28457303,2021-09-29 14:02:37,,"Retail, GroveCity, ",,1443275032201887744,False,0,0,0,0,CareerArc 2.0,"This #Retail job might be a great fit for you. Click the link in our bio to see it and more. STORE MANAGER CANDIDATE in Grove City, OH at Dollar General #GroveCity, OH",,,2009-04-02 20:21:37,"Columbus, OH",TMJ-CHH Retail Jobs,https://pbs.twimg.com/profile_images/668388788675055616/uVht0tOA_normal.jpg,266,127,85,1099,tmj_chh_retail,
1199370144184700928,2021-09-29 14:01:19,,,"bit.ly/3zTsUXt, ",1443274707650981894,False,1,0,0,1,TweetDeck,"Shoppers in the Verona, Penn Hills, Plum and Oakmont area now have a new option after the recent opening of a Dollar General store on Milltown Road in Verona.

https://t.co/wA5qggf169",,,2019-11-26 11:51:49,,Plum Advance Leader,https://pbs.twimg.com/profile_images/1204090628759527424/rOkXbTsO_normal.jpg,86,81,1,1112,PlumAdvancePGH,
127999744,2021-09-29 14:00:26,,"Retail, Chickamauga, ",,1443274485998620673,False,0,0,0,0,CareerArc 2.0,"Looking to score a job at Dollar General? You're in luck. Click the link in our bio for the job description and information on how to apply: LEAD SALES ASSOCIATE-PT in CHICKAMAUGA, GA #Retail #Chickamauga, GA",,,2010-03-30 16:41:35,"Chattanooga, TN",TMJ-TNC Retail Jobs,https://pbs.twimg.com/profile_images/700460351276462080/8uSjFFTW_normal.jpg,169,108,43,1075,tmj_TNC_retail,
959230810594398209,2021-09-29 14:00:04,,,"twitter.com/AP_Oddities/st…, ",1443274392490979334,False,0,0,0,0,Twitter for iPhone,It’s alot of people on here who don’t understand the difference between Dollar Tree and Dollar General…and that’s sad https://t.co/FdKTeXcjvx,,,2018-02-01 20:03:41,,“Gabbie get in the car!”,https://pbs.twimg.com/profile_images/1368345690347298816/nKXRwyxU_normal.jpg,291,328,0,47871,reneesday,
40960230,2021-09-29 13:59:25,,"Retail, Plaucheville, ",,1443274230561271809,False,0,0,0,0,CareerArc 2.0,"Nervous to apply for a job like ""SALES ASSOCIATE in PLAUCHEVILLE, LA"" at Dollar General? Apply even if you're not a 100% match. You might be underestimating your value. Click the link in our bio for more info. #Retail #Plaucheville, LA",,,2009-05-18 16:29:49,"Alexandria, LA",TMJ-LAA Jobs,https://pbs.twimg.com/profile_images/691118823911501824/Tmy4TOQc_normal.jpg,364,278,7,893,tmj_laa_jobs,
716686140603019264,2021-09-29 13:59:06,,,,1443274148336308228,False,20,0,1,2,Twitter for iPhone,One of our interns just got internship at Dollar General doing merchandising.. super proud of her!,,,2016-04-03 13:57:46,"Cashville, TN",CashvilleEtc,https://pbs.twimg.com/profile_images/1115360352466800641/UeBoNsNN_normal.png,5259,4972,0,32855,cashville_etc,
1199362756622897156,2021-09-29 13:57:31,,,"bit.ly/3kSvfOk, ",1443273749986521090,False,0,0,1,1,TweetDeck,"Shoppers in the Verona, Penn Hills, Plum and Oakmont area now have a new option after the recent opening of a Dollar General store on Milltown Road in Verona.

https://t.co/q6vyZNAHhF",,,2019-11-26 11:22:30,,Penn Hills Progress,https://pbs.twimg.com/profile_images/1204094189996253184/FFQVdkok_normal.jpg,168,25,2,1115,TribPennHills,
1419332222004473863,2021-09-29 13:54:37,,,"thestreet.com/investing/5-to…, ",1443273019116380164,False,0,0,0,0,Twitter Web App,"5 Top Stock Gainers for Wednesday: Dollar Tree, Boeing, Netflix https://t.co/0Yw5yUQbLN",,,2021-07-25 12:22:32,,Rob Lenihan,https://pbs.twimg.com/profile_images/1419332576561582082/fzkq1aY7_normal.jpg,16,109,0,547,RobLenihan2,
753410769354649600,2021-09-29 13:54:17,,,"twitter.com/AP_Oddities/st…, ",1443272934764818454,False,1,0,0,0,Twitter for iPhone,is this not what the dollar general is for https://t.co/rDZfmPbvWn,,,2016-07-13 22:08:19,"Knoxville, TN",bri,https://pbs.twimg.com/profile_images/1424425915635875845/R6_Fb2se_normal.jpg,198,159,1,557,bris_eay,
810978891330416640,2021-09-29 13:54:08,,,"twitter.com/AP_Oddities/st…, ",1443272898073014279,False,0,0,0,0,Twitter for Android,"Dollar General, Family Dollar and every other 99c store already does that, what happened to being different Dollar Tree ???? https://t.co/yKoDrTBUlU",,,2016-12-19 17:43:29,Where the Money Reside ,Shara🇯🇲,https://pbs.twimg.com/profile_images/1453010855432499200/pFcni41D_normal.jpg,102,109,0,15545,sharalee_nyja,
1280317600086589441,2021-09-29 13:53:49,,,,1443272818536427522,False,1,0,1,0,Twitter for iPhone,This is the second time the dollar general by my house give me shit for free by accident 😂,,,2020-07-06 21:48:06,"Elizabeth, NJ",G✨,https://pbs.twimg.com/profile_images/1412974858733035521/voHR6PiI_normal.jpg,96,72,0,224,gxcami,
8293932,2021-09-29 13:53:22,,,"twitter.com/AP_Oddities/st…, ",1443272708133953536,False,0,0,0,0,Twitter for Mac,Might as well shop at Dollar General. https://t.co/uvxBbmbrYM,,,2007-08-19 19:39:35,,victoriaflip. 빅토리아 옥 (she/her),https://pbs.twimg.com/profile_images/1438587639838433280/BCCuR4SO_normal.jpg,866,170,32,6638,vickysecret,
1108537592767614981,2021-09-29 13:53:08,,,"pic.twitter.com/JgdK58bMz6, ",1443272646032969734,False,14,0,4,0,Twitter for Android,I look like the Dollar General version of Tony Stark. https://t.co/JgdK58bMz6,,,2019-03-20 21:15:32,"Idaho, USA",Tahan Dragonsbane Mountainside Drifter,https://pbs.twimg.com/profile_images/1377844963333955584/TIZZ2l8v_normal.jpg,430,741,3,10123,TDragonsbane,photo
223324233,2021-09-29 13:53:02,,,"twitter.com/AP_Oddities/st…, ",1443272622138183683,False,0,0,0,1,Twitter for iPhone,So it’s dollar general 2.0 then https://t.co/9KmLVntuBj,,,2010-12-05 21:02:10,Airline to Mickens,I’m in your city tour to be cont…,https://pbs.twimg.com/profile_images/1437798922534236166/OoWZtAC6_normal.jpg,4988,4669,5,90445,Marquis__Young,
1971816530,2021-09-29 13:52:55,,,"twitter.com/chefrocky413/s…, ",1443272594162130960,False,1,0,1,0,Twitter Web App,No they wont. Dollar General isn't even cheap. And even if things go up to $2-3 its still cheaper than Walmart. Five Below has been selling $10 for a while now and no one complains. https://t.co/4kpJUFaPGe,,,2013-10-19 10:37:11,I am lost too...,I'm not your bae.🖋 ♎🌹,https://pbs.twimg.com/profile_images/1442615926512357384/B4f2RYGv_normal.jpg,5573,2033,36,62683,Dnt_TestMe,
2753583780,2021-09-29 13:52:20,,,"twitter.com/AP_Oddities/st…, ",1443272445696282631,False,0,0,0,0,Twitter for iPhone,might as well just get acquired by dollar general then https://t.co/69n0zxrpeF,,,2014-08-21 21:53:57,"Fort Wayne, IN",marvel hate account,https://pbs.twimg.com/profile_images/1450635383075532804/7IXt0W3l_normal.jpg,2493,2237,16,63944,motherofpluto,
834775825,2021-09-29 13:49:52,,,"twitter.com/AP_Oddities/st…, ",1443271826298310658,False,0,0,0,0,Twitter for iPhone,get the fuck out of here with this dollar general ass shit https://t.co/kZ1QS3pBgD,,,2012-09-20 00:38:48,,samantha,https://pbs.twimg.com/profile_images/1420123188130979846/05_zp9LH_normal.jpg,302,456,3,19530,samantha_macke_,
2426117255,2021-09-29 13:49:18,,,"twitter.com/TheStreet/stat…, ",1443271682207145987,False,0,0,0,0,Twitter for iPhone,we already got dollar general and five below. we dont need another discount store 🤷🏻‍♀️ https://t.co/MfNdLXYLsZ,,,2014-03-21 00:10:31,MIAMI ☀️,ari,https://pbs.twimg.com/profile_images/1416558282840358915/YCy8n-qw_normal.jpg,301,139,9,61904,_arixoxoxo,
1345156384090976256,2021-09-29 13:48:30,,,"twitter.com/AP_Oddities/st…, ",1443271482835152904,False,0,0,0,0,Twitter for Android,WHAT???? THATS WHY WE HAVE FAMILY DOLLAR AND DOLLAR GENERAL FOR STUFF ROUGHLY A 1$...DONT DO DIS PLZ https://t.co/NR8U1C9Tpg,,,2021-01-01 18:54:25,Andoria,Name cannot be blank,https://pbs.twimg.com/profile_images/1452694344759189513/MXfREpdI_normal.jpg,4,23,0,3637,fighting_jon,
1420211381840891907,2021-09-29 13:43:54,,,"twitter.com/AP_Oddities/st…, ",1443270325479825413,False,0,0,0,0,Twitter for iPhone,that’s what dollar general is for https://t.co/d1ttBva4Ev,,,2021-07-27 22:41:49,,mob psycho 100 III 🌟,https://pbs.twimg.com/profile_images/1450479677693300736/P9osN4Sr_normal.jpg,16,14,0,4778,1800CH3RRY,
1377052694624501766,2021-09-29 13:42:31,,,"twitter.com/AP_Oddities/st…, ",1443269976023048195,False,0,0,0,0,Twitter for iPhone,So like dollar general? The place that is significantly less cool than dollar tree? https://t.co/II9fz1ptfD,,,2021-03-30 20:18:48,up in here,A,https://pbs.twimg.com/profile_images/1378065201728270337/pXIiMbtI_normal.jpg,138,158,0,4173,coolgurly1998,
1357500390162399232,2021-09-29 13:42:17,,,"twitter.com/AP_Oddities/st…, ",1443269917487386630,False,1,0,0,0,Twitter for iPhone,"They’re just falling in line w/the 99 Cent Only Stores &amp; Dollar General, both of whom sell all sorts of $1+ items. Dollar Tree has been selling items that are more than $1 FOR YEARS. At least all the ones in Las Vegas &amp; Henderson, Nevada have been doing so. How is this news??🤨 https://t.co/eA6kyCnCuo",,,2021-02-04 20:25:29,The Bluegrass State,👂🏼like “Mike”🗣Mich Says #GetVaccinated💉😷,https://pbs.twimg.com/profile_images/1359377084250951680/KU5MhNt__normal.jpg,876,5001,1,2158,MichaelPLS,
798343693895954436,2021-09-29 13:39:04,,,"twitter.com/AP_Oddities/st…, ",1443269108494213121,False,0,0,0,0,Twitter for Android,isn't that already case or am I thinking of dollar general https://t.co/8d0Fyjp5fd,,,2016-11-14 20:55:43,USA | she/her | queer | adult,anti-kpop agenda⁷,https://pbs.twimg.com/profile_images/1452247676758732804/-JtrmCcV_normal.jpg,359,952,6,110122,rocktanbangwool,
906459072,2021-09-29 13:35:07,,,"twitter.com/AP_Oddities/st…, ",1443268112183283714,False,0,0,0,0,Twitter for iPhone,so then it’s not dollar tree it’s more like a dollar general now lmfao https://t.co/5gV3AHZCbE,,,2012-10-26 13:52:02,"Portland, OR",sarai,https://pbs.twimg.com/profile_images/1447653039452540928/wdfc0f1B_normal.jpg,204,64,3,6077,saraiatrian,
1161424157441220609,2021-09-29 13:34:48,,,"twitter.com/AP_Oddities/st…, ",1443268033896722433,False,3,0,1,0,Twitter for iPhone,"No?????? You may as well fuck off, that’s what family dollar &amp; dollar general is for https://t.co/0mLQziTYGt",,,2019-08-13 19:47:52,24 •,random black girl🤨ˣ,https://pbs.twimg.com/profile_images/1443089913306570754/fwTUT_NP_normal.jpg,785,492,13,104620,irissirens,
393792768,2021-09-29 13:34:46,,,"twitter.com/AP_Oddities/st…, ",1443268026284093441,False,7,0,0,0,Twitter for iPhone,"Welp Dollar Tree is no longer special. Those already exist, it’s called Dollar General and Family Dollar 😒 https://t.co/E2nGfdDRG1",,,2011-10-18 22:37:23,My Own World,Jbreezy 🐺♌️,https://pbs.twimg.com/profile_images/1390089905271889928/Eld-H1Sp_normal.jpg,6382,5780,6,28998,kvng_treway,
278265475,2021-09-29 13:31:57,,,,1443267314732961793,False,2,1,0,0,Twitter for iPhone,Was about to go to dollar general they closed due to having no staff 🤦🏾‍♀️,,,2011-04-06 19:15:41,I'm probably napping tbh ,It’s B 🌿,https://pbs.twimg.com/profile_images/1448510775501508610/Ab4ieq-4_normal.jpg,963,912,12,80952,HolaLoveeeXD,
3244497720,2021-09-29 13:31:36,,,"twitter.com/MorningBrew/st…, ",1443267229789868033,False,1,0,0,0,Twitter Web App,"Please no. This aint the Dollar General or Family Dollar. Dollar Tree isnt like those phonies. For the love of all that is holy, Leave my DOLLAR stuff alone. https://t.co/pNWzrBtOHF",,,2015-06-13 17:37:16,"Charlotte, NC",Sarah,https://pbs.twimg.com/profile_images/1451385395871199270/i5E3-3wO_normal.jpg,346,147,1,7812,Sarahray_10,
