author_id,created_at,entities_cashtags,entities_hashtags,entities_urls,tweet_id,possibly_sensitive,public_metrics_like_count,public_metrics_quote_count,public_metrics_reply_count,public_metrics_retweet_count,source,text,entities_mentions,in_reply_to_user_id,created_at_user,location,name,profile_image_url,public_metrics_followers_count,public_metrics_following_count,public_metrics_listed_count,public_metrics_tweet_count,username,media_type
88524302,2021-09-30 19:59:34,,,"bit.ly/2wXsapf, pic.twitter.com/cKH6ypxfM1, ",1443727252659781633,False,0,0,0,0,CouponsForYourFamily Nextscripts,"Dollar General Ad Previews 9/26, 10/3 &amp; Super Early 10/10 are live! -https://t.co/tw6NZF0Ia8 https://t.co/cKH6ypxfM1",,,2009-11-08 17:16:35,"Buffalo, New York",couponsforyourfamily,https://pbs.twimg.com/profile_images/1327098384155627522/iRzqKaLW_normal.png,7466,6937,84,58146,coupns4urfamily,photo
1390037674057244680,2021-09-30 19:56:35,,,,1443726500801433601,False,0,0,0,0,Twitter Web App,"i remember when i convinced my state to replace the nearby hospital with a dollar general

god i wish i hadnt done that otherwise i'd be alive",,,2021-05-05 16:17:01,FUCK IDK MAN,"Tom ""Zachary"" Keller (parody lol) 🟢",https://pbs.twimg.com/profile_images/1446978580097945601/5rRCgHaK_normal.jpg,59,545,0,312,XenophanesTom,
2768202274,2021-09-30 19:50:16,,,"pic.twitter.com/dHVBhB6EcU, ",1443724912347258888,False,4,0,0,0,Twitter for iPhone,"Apartment grill, Dollar General Charcoal, Reduced Price Pork Chops=MAGIC SHAWTY!! https://t.co/dHVBhB6EcU",,,2014-09-12 14:59:17,"Simpsonville, SC",BILLY HOE,https://pbs.twimg.com/profile_images/1450444876424884225/J4qFbCSn_normal.jpg,772,957,0,50672,RitchDaRuler,video
1219699930027253760,2021-09-30 19:49:54,,,,1443724817790869510,False,1,0,0,0,Twitter Web App,They all laughed when i said there was a Dollar General on Mars... they ain't laughing now,,,2020-01-21 14:15:05,Tennessee,Karla F,https://pbs.twimg.com/profile_images/1367159153374814208/9E5TPLja_normal.jpg,43,76,0,615,ChristianSideHo,
15084925,2021-09-30 19:46:51,,,"twitter.com/KThomasDC/stat…, ",1443724050480705538,False,5,0,0,0,Twitter for Android,"He hasn't been to a Dollar General in a while. I get the folksy, throwaway turn of phrase but that's as close to unserious as you can get. https://t.co/LWpXSsTOEC",,,2008-06-11 10:03:48,North Philly,Omar T. Woodard,https://pbs.twimg.com/profile_images/1369556247431806976/4wbaBiz5_normal.jpg,5659,3695,140,47946,OmarWoodard,
21024653,2021-09-30 19:45:14,,,"twitter.com/KThomasDC/stat…, ",1443723644635594755,False,1,0,0,0,Twitter for iPhone,Does Manchin really not understand that ~inflation~ has nothing to do with Dollar General raising some of its prices? jfc https://t.co/9IV0FvG6tk,,,2009-02-16 15:40:48,"New York, NY",Daniel Gilmore,https://pbs.twimg.com/profile_images/1422586202734178311/kAVpFIjp_normal.jpg,1285,1066,54,14192,gilmored85,
4805496449,2021-09-30 19:36:24,,,,1443721419574104067,False,6,0,0,0,Twitter for iPhone,This bitch at the dollar general just asked the lady if they sell Fiji water.. ma’am this is a dollar general,,,2016-01-14 10:58:31,"Gulf Shores, AL",Joshua,https://pbs.twimg.com/profile_images/1364347966476095492/kNvEdLnQ_normal.jpg,183,408,0,3663,__joshnelson,
751278026,2021-09-30 19:34:32,,,"thecouponingcouple.com/dollar-general…, ",1443720950533574663,False,0,0,0,1,TheCouponingCouple,Dollar General Ad (10/17/21 - 10/23/21): Dollar General Weekly Ad Preview - https://t.co/0pJgI2NJ6L,,,2012-08-11 09:35:38,,TheCouponingCouple,https://pbs.twimg.com/profile_images/2492116732/10865417-3d-rendered-cute-conceptual-white-couple-goes-shopping--isolated_normal.jpg,2238,1614,28,49052,thecouponingcou,
5520672,2021-09-30 19:34:31,,,"twitter.com/KThomasDC/stat…, ",1443720948855853061,False,0,0,0,0,Twitter for Android,"Spoken like someone who has clearly never been to a Dollar General.

(He's so sincere in his indignation, he mixed up stores. He meant Dollar Tree.) https://t.co/jF4RV3pjDw",,,2007-04-26 03:11:18,,natthedem,https://pbs.twimg.com/profile_images/1449139221478920192/xv0s-ZgR_normal.jpg,2248,723,166,106609,natthedem,
29821940,2021-09-30 19:22:47,,,"twitter.com/lifeisterrible…, ",1443717996300673025,False,2,0,0,0,Twitter for iPhone,Dollar general already selling Christmas shit. https://t.co/8difL4M4Or,,,2009-04-08 17:11:32,724,Jordan Modro,https://pbs.twimg.com/profile_images/1447376740553220103/9dbaj5jF_normal.jpg,1683,300,11,24298,jordanmodro,
839230313054224385,2021-09-30 19:21:10,,,"pic.twitter.com/0U03sQoALs, pic.twitter.com/0U03sQoALs, pic.twitter.com/0U03sQoALs, ",1443717588207427586,False,8,0,0,0,Twitter for iPhone,I may or may not have bought all the gum drops at the Dollar General last night. Gotta make those molecules! @LexMidSchool @LCSJackets https://t.co/0U03sQoALs,"LexMidSchool, LCSJackets, ",,2017-03-07 16:44:33,"Thomasville, NC",Joann Thomas,https://pbs.twimg.com/profile_images/1426333028742221829/9gGfnnyx_normal.jpg,174,209,0,1069,JoannThomas81,photo
1439415224084439040,2021-09-30 19:14:22,,,,1443715874247135234,False,0,0,0,0,Twitter for Android,Dollar General should just consume DollarTree,,,2021-09-18 22:25:25,,Priceages Magazine,https://pbs.twimg.com/profile_images/1453101040321146888/PmbwpuQe_normal.jpg,167,464,1,1367,Priceages,
265263311,2021-09-30 19:12:54,,,,1443715505613852674,False,1,0,0,0,Twitter for iPhone,"You see the weirdest shit at dollar general, this ngga had a fork behind his ear

😂😂😂😂😂😂😂",,,2011-03-13 04:03:17,,Δཞıɛl ɱąཞƖɛყ,https://pbs.twimg.com/profile_images/1453170256114077699/OapaHzen_normal.jpg,1072,341,0,49662,ArielMarley_,
1251510910390337536,2021-09-30 19:04:56,,,,1443713501852209152,False,3,0,1,0,Twitter for iPhone,"Dollar General 
&amp;
Five Below are your choices instead of Dollar Tree.",,,2020-04-18 10:00:37,@AJLOVESUSA - MOM,ᖇᗩᗪᗪƳ⚡️⚡️,https://pbs.twimg.com/profile_images/1368927130478927873/Ti-EsRbK_normal.jpg,2095,2639,4,142420,_RadicalReality,
595774484,2021-09-30 19:00:30,,,"twitter.com/_PapiAce/statu…, ",1443712388235251714,False,0,0,0,0,Twitter for iPhone,Damn mfs be horny at dollar general https://t.co/qTgvIpVX2C,,,2012-05-31 15:52:31,314,brook 🕸,https://pbs.twimg.com/profile_images/1420962977780486145/xevAACKQ_normal.jpg,1143,1012,2,21760,brooookly_n,
1270815439321329665,2021-09-30 19:00:00,,,"fox59.com/news/armed-thi…, ",1443712262624190466,False,0,0,0,1,ContentCal Studio,Armed thieves repeatedly rob east side Dollar General store https://t.co/ZgQtw9uAu5,,,2020-06-10 16:30:07,"Hawthorne, NV",Donald Pedersen,https://pbs.twimg.com/profile_images/1369050554979127298/ua5bhwON_normal.jpg,14312,15732,12,59271,DonaldP28785881,
275765160,2021-09-30 18:51:17,,,"nypost.com/2021/09/30/sen…, ",1443710069078728708,False,0,0,0,0,TweetDeck,"Manchin: ""I’ll give you perfect example in West Virginia. I just saw today Dollar General is no longer a dollar. It’s a dollar and a quarter or a dollar and 50 cents. That’s hard for West Virginia, a lot of people just shop there and it’s all that we have"" https://t.co/g4VXzVv0EQ",,,2011-04-01 19:34:29,USA,The Daily NewsBeat,https://pbs.twimg.com/profile_images/1428499148890853376/7A28mfCF_normal.jpg,745,3692,49,212819,NowMediaScott,
59968066,2021-09-30 18:45:48,,"Hankinson, Retail, ",,1443708687411933195,False,0,0,0,0,CareerArc 2.0,"If you're looking for work in #Hankinson, ND, check out this #Retail job via the link in our bio: LEAD SALES ASSOCIATE-FT in HANKINSON, ND at Dollar General",,,2009-07-24 23:28:29,North Dakota,TMJ-ND Retail Jobs,https://pbs.twimg.com/profile_images/670669099354034176/eY5jrOxw_normal.jpg,186,122,59,967,tmj_nd_retail,
21695798,2021-09-30 18:37:57,,"warehouse, SanAntonio, ",,1443706713236926493,False,0,0,0,0,CareerArc 2.0,"Want to land a job like ""GENERAL WAREHOUSE WORKER - PERISHABLE DISTRIBUTION CENTER in SAN ANTONIO, TX"" at Dollar General? Applicant tracking systems look for specific keywords. Use the right keywords and get your resume in front of the hiring manager. #warehouse #SanAntonio, TX",,,2009-02-23 16:26:23,"San Antonio, TX",TMJ - SAT Manuf Jobs,https://pbs.twimg.com/profile_images/673215741294829569/ECLU3M-l_normal.jpg,145,99,33,563,tmj_sat_manuf,
1124456845542817792,2021-09-30 18:34:39,,,,1443705881544253446,False,1,0,1,0,Twitter for iPhone,basically the dollar general shut down near my house so I can't do penny deals or coupon anymore :((,,,2019-05-03 19:32:58,used to be @ephedrinez,🩸 mari 🩸,https://pbs.twimg.com/profile_images/1436891080587419649/uYgjkRjH_normal.jpg,73,104,0,6250,kittymaidzz,
1340484427219148802,2021-09-30 18:27:55,,,,1443704188421218305,False,1,0,0,0,Twitter Web App,I just found out they sell craft knifes at the dollar general so i'm going to try and get one tomorrow,,,2020-12-19 21:29:36,,Adrian,https://pbs.twimg.com/profile_images/1340486634282872834/Ay9R8nC__normal.jpg,10,38,0,60,alex27736059,
606887871,2021-09-30 18:26:47,,,,1443703899559501828,False,0,0,0,0,Twitter for iPhone,anybody trynna get me some from dollar general .?,,,2012-06-12 21:58:40,706,baddestt 🥵,https://pbs.twimg.com/profile_images/1452759302297509898/5kq7lYTC_normal.jpg,872,627,2,8535,KenequaL,
38236168,2021-09-30 18:26:13,,"Osceola, Retail, ",,1443703759058595884,False,0,0,0,0,CareerArc 2.0,"See our latest #Osceola, NE #Retail job opportunity and click the link in our bio to apply: ASST STORE MGR in OSCEOLA, NE at Dollar General",,,2009-05-06 13:57:36,"Grand Island, NE",TMJ-NEG Jobs,https://pbs.twimg.com/profile_images/689965933004222464/JHNz1eJ9_normal.jpg,371,273,5,771,tmj_neg_jobs,
40960230,2021-09-30 18:24:23,,"VillePlatte, Retail, ",,1443703297072787461,False,0,0,0,0,CareerArc 2.0,"If you're looking for work in #VillePlatte, LA, check out this #Retail job via the link in our bio: LEAD SALES ASSOCIATE-PT in VILLE PLATTE, LA at Dollar General",,,2009-05-18 16:29:49,"Alexandria, LA",TMJ-LAA Jobs,https://pbs.twimg.com/profile_images/691118823911501824/Tmy4TOQc_normal.jpg,364,278,7,893,tmj_laa_jobs,
124667938,2021-09-30 18:23:35,,,"pic.twitter.com/86jr9dEGwc, ",1443703096258015235,False,1,0,0,1,Twitter Web App,"A fire at the Dollar General on Tiffin Avenue in Findlay is being put out by the fire department. The entire building was engulfed in flames, but first responders put it out swiftly. YIKES! https://t.co/86jr9dEGwc",,,2010-03-20 00:52:26,Jenera OH near Plaguesville!,Dwight Miller,https://pbs.twimg.com/profile_images/1444491776497172480/MnJlNbj-_normal.jpg,326,1310,1,68349,navvet96,photo
990602071996076037,2021-09-30 18:21:39,,,"pic.twitter.com/eJzbSrcas1, ",1443702609135685639,False,5,0,0,0,Twitter for iPhone,i founds more squishmallows at dollar general!! :o https://t.co/eJzbSrcas1,,,2018-04-29 10:41:53,she/her,zai ღ,https://pbs.twimg.com/profile_images/1451910947975712780/rFdQdExs_normal.jpg,115,55,1,596,tinyytoddlr,photo
159008609,2021-09-30 18:18:49,,,,1443701897727143959,False,0,0,0,0,Twitter for iPhone,Ay Family Dollar and Dollar General been slanging stuff over a dollar for a minute now...y'all gonna be alright. Should've used that stimmy on fake Cool Water and Glade plugins,,,2010-06-24 02:06:39,United States,Crafty,https://pbs.twimg.com/profile_images/1426215321560485898/YaxXB40T_normal.jpg,956,865,18,20884,DJ_Craftmatic,
41705076,2021-09-30 18:16:52,,"Randolph, Retail, ",,1443701404879646742,False,0,0,0,0,CareerArc 2.0,"Interested in a job in #Randolph, VT? This could be a great fit. Click the link in our bio to apply: SALES ASSOCIATE in RANDOLPH, VT at Dollar General #Retail",,,2009-05-21 19:51:22,Vermont,TMJ-VT-USA Jobs,https://pbs.twimg.com/profile_images/691269583576047619/YVnfovHr_normal.jpg,437,287,12,829,tmj_vt_usa_jobs,
1203102257337778177,2021-09-30 18:04:19,,,,1443698248003293187,False,3,0,0,0,Twitter for iPhone,in what war did dollar general get her rank,,,2019-12-06 19:03:43,any pronouns | pfp : VIVINOS,raine,https://pbs.twimg.com/profile_images/1441226636880273411/x5C13U5V_normal.jpg,232,392,25,50674,rainemewn,
73411102,2021-09-30 18:03:38,,,,1443698073880997894,False,0,0,0,0,Twitter for iPhone,So have the girls at Dollar General cut stocking hours?? Asking for a friend…,,,2009-09-11 11:35:45,"ÜT: 33.464681,-84.173362",Sta-Sof-Fro & Vaseline Baby,https://pbs.twimg.com/profile_images/699810268428308480/6KEFCA9t_normal.jpg,194,530,3,17257,RBS2,
75962495,2021-09-30 18:01:22,,,,1443697504042819584,False,0,0,0,0,Twitter for iPhone,"Dollar General raising prices (I love Dollar Tree/General!). No more $1 products. Thanks, Joe!",,,2009-09-21 01:08:41,Out Of This World,Chase J. Passeri,https://pbs.twimg.com/profile_images/1328742554456772610/4D67Q8rt_normal.jpg,879,967,5,31535,KingOfContent18,
1049471833836261382,2021-09-30 18:00:41,,,"twitter.com/joelockhart/st…, ",1443697334957838337,False,0,0,0,0,Twitter for iPhone,"Dollar store is not the same as the Dollar General, or Family Dollar! Manchin gets this wrong, he doesn’t know what he is talking about! https://t.co/Zaua2Mn6vL",,,2018-10-08 21:29:18,"Saratoga Springs, NY",drtuck,https://abs.twimg.com/sticky/default_profile_images/default_profile_normal.png,209,330,0,87164,drtuck1,
1188307505488760832,2021-09-30 17:59:29,,,,1443697032473063432,False,1,0,0,0,Twitter for Android,Why does it smell like dookie by the dollar general on the west side I can barely breathe,,,2019-10-27 00:12:51,"Quahog, RI",baby brother,https://pbs.twimg.com/profile_images/1449791468751753218/rTIB8x3g_normal.jpg,109,323,0,2032,taylor221bee,
1147587714390384640,2021-09-30 17:56:59,,,,1443696402710806535,False,0,0,0,0,Twitter for iPhone,"I have a question:

If The Dollar Tree is going to start selling things that are more than a dollar, does that NOT make them the same as Dollar General and Family Dollar?

And if they’re the same, tf would anyone CHOOSE to go to dollar tree for??",,,2019-07-06 15:26:47,"Atlanta, GA",Cosmic Kewchie ♍️🔮🧚🏽‍♀️,https://pbs.twimg.com/profile_images/1439763045820084229/2ADRj7Wj_normal.jpg,123,111,0,13485,ShesBJade,
1257338991898173445,2021-09-30 17:55:21,,,,1443695991916580866,False,0,0,0,0,Twitter for iPhone,Fuck a dollar general,,,2020-05-04 11:59:30,,scraggly vespuchi,https://pbs.twimg.com/profile_images/1430406818900099073/Y6UoXzjR_normal.jpg,8,32,0,391,dannyde63189924,
99429705,2021-09-30 17:53:08,,"Retail, PleasantPlains, ",,1443695433897832450,False,0,0,0,0,CareerArc 2.0,"This #Retail job might be a great fit for you. Click the link in our bio to see it and more. ASST STORE MGR in PLEASANT PLAINS, IL at Dollar General #PleasantPlains, IL",,,2009-12-25 23:59:44,"Springfield, IL",TMJ-ILS Retail Jobs,https://pbs.twimg.com/profile_images/700279163547090944/51Ap0qjw_normal.jpg,166,112,30,954,tmj_ILS_retail,
28707699,2021-09-30 17:51:56,,"Montville, Retail, ",,1443695131186524172,False,0,0,0,0,CareerArc 2.0,"Want to work at Dollar General? We're hiring in #Montville, CT! Click the link in our bio for details on this job and more: LEAD SALES ASSOCIATE-FT in UNCASVILLE, CT #Retail",,,2009-04-03 21:25:19,"Greater New Britain, CT",TMJ-CTG Retail Jobs,https://pbs.twimg.com/profile_images/686014899948920832/41H5YUCG_normal.jpg,193,121,52,1159,tmj_ctg_retail,
1433217835183054852,2021-09-30 17:50:09,,,,1443694681288761349,False,0,0,0,0,Twitter for iPhone,this is why dollar general will always be better than dollar tree,,,2021-09-01 19:59:13,Creator of Blank Ratio,ً,https://pbs.twimg.com/profile_images/1444121199500464131/EJipFYZP_normal.jpg,434,305,0,14222,DreisBackk,
1205230425595097092,2021-09-30 17:45:46,,,,1443693580464312325,False,7,0,0,0,Twitter for iPhone,i don’t wanna walk to dollar general today but if i don’t get a dr pepper i might die,,,2019-12-12 15:58:45,23 ♊︎ ⊙ ♓︎ ☾ ♐︎ ↑,𝖆𝖑𝖔𝖊 ⚘ 50% off OF,https://pbs.twimg.com/profile_images/1449535946156920834/SWongQ8t_normal.jpg,2147,1096,12,56002,aloexmarshall,
38164199,2021-09-30 17:42:24,,"Retail, Greensboro, ",,1443692732115918848,False,0,0,0,0,CareerArc 2.0,"Can you recommend anyone for this #Retail job in #Greensboro, NC? Click the link in our bio to see it and more. LEAD SALES ASSOCIATE-FT in GREENSBORO, NC at Dollar General",,,2009-05-06 08:09:51,"Triad Area, NC",TMJ-NCT Jobs,https://pbs.twimg.com/profile_images/689910521705836544/Mpgb9qlE_normal.jpg,366,290,31,1179,tmj_nct_jobs,
1000289352885440513,2021-09-30 17:39:27,,,,1443691991540420618,False,20,0,4,1,Twitter for iPhone,I CALLED MY LOCAL DOLLAR GENERAL AND THEY USED SHE/HER IM SO HAPPY,,,2018-05-26 04:15:41,pfp by: @sho_thatsit,Alyssa Aisaka,https://pbs.twimg.com/profile_images/1442897351266299907/SJKZ29Q1_normal.jpg,475,677,5,9290,WoomyAisaka,
59968066,2021-09-30 17:38:32,,"Retail, Cavalier, ",,1443691761025515520,False,0,0,0,0,CareerArc 2.0,"Don't submit then quit. Apply for jobs like ""LEAD SALES ASSOCIATE-PT in CAVALIER, ND"" at Dollar General, then look for people you might know at the company. You might be able to reach out to HR directly. Ready to apply? Check out the link in our bio. #Retail #Cavalier, ND",,,2009-07-24 23:28:29,North Dakota,TMJ-ND Retail Jobs,https://pbs.twimg.com/profile_images/670669099354034176/eY5jrOxw_normal.jpg,186,122,59,967,tmj_nd_retail,
1342032603570954241,2021-09-30 17:36:59,,,,1443691369181102080,False,0,0,0,0,"Cheap Bots, Done Quick!","in this wyoming dollar general, infrastructure means roads and bridges; not cap and trade.",,,2020-12-24 04:01:31,pictures are AI-generated,this voter costs democrats the election,https://pbs.twimg.com/profile_images/1435000951195250689/XAwekYfU_normal.jpg,617,40,0,14460,ThisVoter,
59972446,2021-09-30 17:35:52,,"Piqua, Retail, ",,1443691088569528367,False,0,0,0,0,CareerArc 2.0,"Want to work at Dollar General? We're hiring in #Piqua, OH! Click the link in our bio for details on this job and more: LEAD SALES ASSOCIATE-PT in PIQUA, OH #Retail",,,2009-07-24 23:50:23,Ohio,TMJ-OH Retail Jobs,https://pbs.twimg.com/profile_images/666976623967776768/9RYI2mCG_normal.jpg,229,115,118,1339,tmj_oh_retail,
237398965,2021-09-30 17:33:24,,,"wataugaonline.com/traffic-alerts/, ",1443690467892342787,False,3,0,0,0,Twitter Web App,Traffic Alert Thursday September 30 5:32pm - Wreck - area of Boone Mountain/421 near Dollar General in Vilas. Expect delays in that area.  https://t.co/mJm16Btmsw,,,2011-01-12 14:15:39,"The High Country, NC",WataugaOnline,https://pbs.twimg.com/profile_images/1066413333186785282/jde6KHMa_normal.png,10735,199,127,45163,WataugaOnline,
860546821,2021-09-30 17:31:45,,,,1443690052878487553,False,5,0,0,0,Twitter for iPhone,bro i hate it when people are like “why do homeless people have phones?” motherfucker do you realize how much someone needs a phone now they’re fucking twenty dollars at a dollar general,,,2012-10-03 20:00:06,memphis ,too scared tanner,https://pbs.twimg.com/profile_images/1444792443438764034/Xszb1jqV_normal.jpg,360,623,4,37555,tannerobbins,
598599048,2021-09-30 17:26:44,,,,1443688790703419394,False,0,1,1,0,Twitter for Android,I was walking in the dollar general minding my business and I noticed a guy running with a buggy full of bud light and looking behind him.. I walk in the store and sure as shit he stole it.,,,2012-06-03 13:44:49, ,.Kita J. 🤯,https://pbs.twimg.com/profile_images/1434020200442212354/3AlhoTOA_normal.jpg,1831,958,10,171198,tha_prttygrl,
8756502,2021-09-30 17:09:09,,,"roanoke.com/news/local/cri…, ",1443684366031392771,True,0,0,0,0,SocialNewsDesk,Terri Carroll Martin was injured on Sept. 21 as she crossed a Dollar General Store parking lot. https://t.co/E5oMjXF1fe,,,2007-09-08 21:42:18,"Roanoke, Virginia",The Roanoke Times,https://pbs.twimg.com/profile_images/3092056372/1221010927d022d8a7adfa461af3c0db_normal.jpeg,63885,705,925,102562,roanoketimes,
1211567333384130560,2021-09-30 17:08:25,,,,1443684178726375425,False,2,0,0,0,Twitter for iPhone,dollar tree is gonna become a five below and then get bought out by either dollar general or five below themselves,,,2019-12-30 03:39:04,e! network,"yes, all men.",https://pbs.twimg.com/profile_images/1425600989910929410/lTdSK-zR_normal.jpg,107,139,1,10343,daddys_spam,
1182286997714538497,2021-09-30 17:06:37,,,,1443683724894384135,False,0,0,0,0,Twitter for iPhone,Dollar General keeps taking my money. Found the cutest lamps for $15!! Can’t wait to set them up when I get home 🤗,,,2019-10-10 09:29:29,,Cariño,https://pbs.twimg.com/profile_images/1424794618957377537/MOkiQDfS_normal.jpg,82,102,0,1888,carin0_,
1317591531776299010,2021-09-30 17:06:05,,,"pic.twitter.com/b52pGoPW0K, ",1443683594384388097,False,0,0,0,0,Twitter for iPhone,"went and picked up food from Dollar General, probably shouldn’t have carried my bags over my shoulder 😂 https://t.co/b52pGoPW0K",,,2020-10-17 18:22:10,"Wuldnt u like 2 no, wether boi",Kelty the Courier,https://pbs.twimg.com/profile_images/1452790911360978944/pSfUtrDI_normal.jpg,15,76,0,1601,KeltytheCourier,photo
28559740,2021-09-30 16:55:14,,"Retail, Tucson, ",,1443680861421903872,False,0,0,0,0,CareerArc 2.0,"Nervous to apply for a job like ""SALES ASSOCIATE in TUCSON, AZ"" at Dollar General? Apply even if you're not a 100% match. You might be underestimating your value. Click the link in our bio for more info. #Retail #Tucson, AZ",,,2009-04-03 09:17:48,"Tucson, AZ",TMJ-TUC Retail Jobs,https://pbs.twimg.com/profile_images/670100164674232320/4kQBCNkk_normal.jpg,195,125,57,987,tmj_tuc_retail,
99710051,2021-09-30 16:54:43,,"Retail, Thorntown, ",,1443680734061883406,False,0,0,0,0,CareerArc 2.0,"This #Retail job might be a great fit for you. Click the link in our bio to see it and more. SALES ASSOCIATE in THORNTOWN, IN at Dollar General #Thorntown, IN",,,2009-12-27 08:41:53,"Kokomo, IN",TMJ-INK Retail Jobs,https://pbs.twimg.com/profile_images/700339376627159040/k5nYY1cZ_normal.jpg,169,112,35,1089,tmj_INK_retail,
2216944538,2021-09-30 16:54:35,,,,1443680697529552896,False,8,0,0,0,Twitter for iPhone,"Guys, the other day I was in the dollar general parking lot and I stay ignoring people but I’m also ALERT af in parking lots. This man sees me and asked“you smoke weed?” I ignored and got leo out and he goes “never mind” 

I was like damnnn he’s down bad 😂",,,2013-11-26 20:10:07,"crackson, La ",4B (bad bitch with the blue bob),https://pbs.twimg.com/profile_images/1444744231063638018/HrnYaFJl_normal.jpg,608,504,1,44138,vidadeliz,
866384072318308354,2021-09-30 16:52:25,,,,1443680154287579142,False,0,0,0,0,Twitter for iPhone,Dollar General be fuckin lying.,,,2017-05-21 16:03:54,"Georgia, USA",Welcome To LocoLand🖤,https://pbs.twimg.com/profile_images/1400395988335042565/NepiuJJ3_normal.jpg,627,578,0,30301,TheTyExperience,
2216944538,2021-09-30 16:51:35,,,"twitter.com/blaccbrry_/sta…, ",1443679941682413572,False,1,0,0,0,Twitter for iPhone,Me after going into dollar general and spending $44 https://t.co/qWpkLErlEQ,,,2013-11-26 20:10:07,"crackson, La ",4B (bad bitch with the blue bob),https://pbs.twimg.com/profile_images/1444744231063638018/HrnYaFJl_normal.jpg,608,504,1,44138,vidadeliz,
1179564013379817472,2021-09-30 16:49:09,,,,1443679330941509633,False,3,0,1,0,Twitter for iPhone,Idk Dollar General gives me trailer park vibes.,,,2019-10-02 21:09:18,"Houston, TX",blue haired feminist,https://pbs.twimg.com/profile_images/1432455150791188488/zv8hWuIw_normal.jpg,6982,954,19,52139,blaccbrry_,
130385473,2021-09-30 16:48:23,,"Hedgesville, Retail, ",,1443679136409550849,False,0,0,0,0,CareerArc 2.0,"See our latest #Hedgesville, WV #Retail job opportunity and click the link in our bio to apply: STORE MANAGER CANDIDATE in Hedgesville, WV at Dollar General",,,2010-04-07 00:12:01,"Winchester, VA",TMJ-VAW Retail Jobs,https://pbs.twimg.com/profile_images/709937738275905536/NLk99D-n_normal.jpg,230,158,46,934,tmj_VAW_retail,
969353913244807168,2021-09-30 16:45:36,,,"twitter.com/ImSpeaking13/s…, ",1443678437961502722,False,0,0,0,0,Twitter for Android,American can not live on a  Dollar general  salary you would be lucky to receive $7.50 minimum and then they will cut your hrs to 2 days a week https://t.co/w8MSM1simh,,,2018-03-01 18:29:17,"Atlanta, GA",Vesaversa,https://pbs.twimg.com/profile_images/1429991159405940739/XwbuN_gS_normal.jpg,16311,12837,4,74338,Vesaversa,
1075157840459907073,2021-09-30 16:44:44,,,,1443678218121273348,False,0,0,0,0,Twitter for iPhone,"Tbh morning at dollar tree was ever just a dollar , now when dollar GENERAL raise their prices I’ll be scared",,,2018-12-18 17:36:19,,🍀 lucky,https://pbs.twimg.com/profile_images/1436036584307150854/Hy5CiOHm_normal.jpg,223,321,0,6770,flicmybic__,
162261770,2021-09-30 16:43:52,,,"twitter.com/nflnetwork/sta…, ",1443678001791737859,False,20,0,5,2,Twitter for iPhone,The @Jaguars really are the Dollar General version of the @Panthers  🙄🙄😒😒 https://t.co/mHF1UxO5tR,"Jaguars, Panthers, ",,2010-07-03 00:15:05,"Charlotte, NC",IamMontyFetti 🖤💙✊🏾,https://pbs.twimg.com/profile_images/1347612425688932353/bqfP0Azy_normal.jpg,1184,511,14,43499,4MR_Monty,
287501790,2021-09-30 16:40:28,,,"pic.twitter.com/ttmWC3kjj6, ",1443677146317213700,False,1,0,1,0,Twitter for iPhone,"Just remember dollar tree we already have a five below, dollar general, and family dollar we don’t need another one. You were the ultimate actual dollar store. Time to change your name. https://t.co/ttmWC3kjj6",,,2011-04-24 23:40:50,,Washington's Woman❤️,https://pbs.twimg.com/profile_images/1319746371373748228/qFihqYWc_normal.jpg,1154,1527,27,54860,StarlitSkyGW,photo
998775520354586624,2021-09-30 16:35:37,,,,1443675923950325761,False,2,0,2,0,Twitter for iPhone,Dollar tree wants to be a Dollar General now 😐,,,2018-05-22 00:00:15,.....✨,Charysma🦋,https://pbs.twimg.com/profile_images/1452829761210880003/P9KzhS9T_normal.jpg,2539,1684,1,5940,LovergirlCZ,
