author_id,created_at,entities_cashtags,entities_hashtags,entities_urls,tweet_id,possibly_sensitive,public_metrics_like_count,public_metrics_quote_count,public_metrics_reply_count,public_metrics_retweet_count,source,text,entities_mentions,in_reply_to_user_id,created_at_user,location,name,profile_image_url,public_metrics_followers_count,public_metrics_following_count,public_metrics_listed_count,public_metrics_tweet_count,username,media_type
78596293,2021-09-23 11:14:27,,,"pic.twitter.com/8mEk4aQHXi, twitter.com/HeelDoors/stat…, ",1441058384900411393,False,1,0,1,0,Twitter for iPhone,Cody looks like a Dollar General superhero action figure. https://t.co/8mEk4aQHXi https://t.co/sGOe3znEVx,,,2009-09-30 09:08:10,Not Outside,D.E.O. 📷,https://pbs.twimg.com/profile_images/1447360121655398405/_zmqqLDP_normal.jpg,908,1032,40,125858,ImJustDEO,photo
1292578023603089411,2021-09-23 11:10:26,,,,1441057376874819593,False,2,0,0,0,Twitter for iPhone,I do be going to dollar general for one specific thing and get distracted by the Lego end caps,,,2020-08-09 17:46:42,"Lego City, USA",bricksburg resident evil,https://pbs.twimg.com/profile_images/1443896212558581801/NHK-Ywh7_normal.jpg,14,59,0,1174,brick_rez,
99710051,2021-09-23 11:08:23,,"Retail, Frankton, ",,1441056859310284811,False,0,0,0,0,CareerArc 2.0,"Want to land a job like ""ASST STORE MGR in FRANKTON, IN"" at Dollar General? Applicant tracking systems look for specific keywords. Use the right keywords and get your resume in front of the hiring manager. #Retail #Frankton, IN",,,2009-12-27 08:41:53,"Kokomo, IN",TMJ-INK Retail Jobs,https://pbs.twimg.com/profile_images/700339376627159040/k5nYY1cZ_normal.jpg,169,112,35,1089,tmj_INK_retail,
1034242870650302464,2021-09-23 11:00:27,,,,1441054861295034370,False,4,0,1,0,Twitter for Android,Dollar general shoppers are called D-Generates.,,,2018-08-27 20:54:50,"Goodlettville, TN",Oh My Goshua,https://pbs.twimg.com/profile_images/1337959754044420097/AaRZoAyr_normal.jpg,119,253,0,2239,BeatYourYeet_,
26801410,2021-09-23 10:57:38,,,,1441054154680516617,False,5,0,1,0,Twitter for iPhone,Dollar General now has a Chief Medical Officer.,,,2009-03-26 13:39:25,"New York, NY",Jason Shuman,https://pbs.twimg.com/profile_images/1409572584673456131/AT4LOxpP_normal.jpg,7337,2505,234,9789,JasonrShuman,
59887569,2021-09-23 10:56:59,,"Retail, Wilmington, ",,1441053990066610187,False,0,0,0,0,CareerArc 2.0,"Looking to score a job at Dollar General? You're in luck. Click the link in our bio for the job description and information on how to apply: LEAD SALES ASSOCIATE-FT in WILMINGTON, DE #Retail #Wilmington, DE",,,2009-07-24 17:02:54,Delaware,TMJ-DE Retail Jobs,https://pbs.twimg.com/profile_images/694657093282869248/UIQXnDMo_normal.jpg,165,114,19,761,tmj_de_retail,
38164199,2021-09-23 10:56:10,,"Greensboro, Retail, ",,1441053783996387331,False,0,0,0,0,CareerArc 2.0,"Dollar General is hiring in #Greensboro, NC! Click the link in our bio to apply: ASST STORE MGR in GREENSBORO, NC #Retail",,,2009-05-06 08:09:51,"Triad Area, NC",TMJ-NCT Jobs,https://pbs.twimg.com/profile_images/689910521705836544/Mpgb9qlE_normal.jpg,366,290,31,1179,tmj_nct_jobs,
956625548,2021-09-23 10:54:09,,,,1441053275915100162,False,0,0,0,0,Twitter for iPhone,My favorite thing about going to a Dollar General is you’re never the highest person there,,,2012-11-18 21:45:19,"Kansas City, MO",rp🌊,https://pbs.twimg.com/profile_images/1044719892363128832/efqYy6Mn_normal.jpg,534,536,8,32999,RotelBeckhamJr,
751620563689467904,2021-09-23 10:47:51,,,,1441051693337174016,False,49,0,2,5,Twitter for iPhone,"I just spoke with a man in his late 70s. He said that he is taking his sweetheart to Hawaii for their 50th wedding anniversary. He said he hopes that they get to go. I thought aww that’s so nice, six months ago I went to Dollar General.",,,2016-07-08 23:34:41,Old and Lost River ,👙IHateEveryone🖕,https://pbs.twimg.com/profile_images/1451602309650210822/P0Wcctra_normal.jpg,16439,4826,82,81199,_IHateEvery0ne,
59972446,2021-09-23 10:44:39,,"Retail, FortLoramie, ",,1441050887225438210,False,0,0,0,0,CareerArc 2.0,"Nervous to apply for a job like ""LEAD SALES ASSOCIATE-FT in FORT LORAMIE, OH"" at Dollar General? Apply even if you're not a 100% match. You might be underestimating your value. Click the link in our bio for more info. #Retail #FortLoramie, OH",,,2009-07-24 23:50:23,Ohio,TMJ-OH Retail Jobs,https://pbs.twimg.com/profile_images/666976623967776768/9RYI2mCG_normal.jpg,229,115,118,1339,tmj_oh_retail,
59968066,2021-09-23 10:42:25,,"Retail, ",,1441050325536821249,False,0,0,0,0,CareerArc 2.0,"Interested in a job in ND? This could be a great fit. Click the link in our bio to apply: ASST STORE MGR in BELFIELD, ND at Dollar General #Retail",,,2009-07-24 23:28:29,North Dakota,TMJ-ND Retail Jobs,https://pbs.twimg.com/profile_images/670669099354034176/eY5jrOxw_normal.jpg,186,122,59,967,tmj_nd_retail,
56463517,2021-09-23 10:33:35,,"roc, ",,1441048101658136585,False,2,0,2,1,Twitter for iPhone,Dollar general on Monroe. Shoplifter fled the store. #roc,,,2009-07-13 15:13:42,Rochester NY,MonroeCountyFireWire,https://pbs.twimg.com/profile_images/1444270843840839691/X8C5e-s6_normal.jpg,44894,283,336,240999,mcfw,
1350244292770541568,2021-09-23 10:32:09,,"46YearsYoung, ","pic.twitter.com/rJNGUd6w5G, pic.twitter.com/rJNGUd6w5G, ",1441047741816352768,False,9,0,3,0,Twitter for iPhone,"When you are TDY and it’s your CSM’s birthday, the Dollar General can come to the rescue. #46YearsYoung https://t.co/rJNGUd6w5G",,,2021-01-15 19:53:54,,Caleb Lewis,https://pbs.twimg.com/profile_images/1401683772203012101/TlEhhDHy_normal.jpg,143,84,2,269,EODArmyGuy,photo
2290220899,2021-09-23 10:19:08,,,,1441044463745388545,False,1,0,1,0,Twitter for Android,god fuck. it's dollar general... I need the job... but I don't want to be sick...,,,2014-01-13 16:15:55,Pennsylvania. ,One Dry Cat✊✊🏻✊🏼✊🏽✊🏾✊🏿,https://pbs.twimg.com/profile_images/1448868267779559424/C0CZ_7-2_normal.jpg,2227,3360,13,253909,CatspressoLood,
99710051,2021-09-23 10:02:06,,"Muncie, Retail, ",,1441040180303917067,False,0,0,0,0,CareerArc 2.0,"Dollar General is hiring in #Muncie, IN! Click the link in our bio to apply: SALES ASSOCIATE in MUNCIE, IN #Retail",,,2009-12-27 08:41:53,"Kokomo, IN",TMJ-INK Retail Jobs,https://pbs.twimg.com/profile_images/700339376627159040/k5nYY1cZ_normal.jpg,169,112,35,1089,tmj_INK_retail,
3409150413,2021-09-23 09:50:11,,,,1441037178730131472,False,1,0,0,0,Twitter for iPhone,vaguely concerned about the young couple listening to whiskey lullaby very loudly in the dollar general parking lot this morning,,,2015-08-08 17:12:47,bham,crunchy 🕸,https://pbs.twimg.com/profile_images/1396866013413642248/qcy1yb3X_normal.jpg,300,203,9,71732,whvteverforever,
605527943,2021-09-23 08:58:55,,,"bit.ly/3lOUhgt, pic.twitter.com/fh4BbJAJDP, ",1441024276300173313,False,0,0,0,0,EveryoneSocial,How One Retailer Is Stepping Up To Serve Markets Others Don’t (Or Won’t) https://t.co/d7kA2gOlA0 https://t.co/fh4BbJAJDP,,,2012-06-11 11:57:09,,Scott Alford,https://abs.twimg.com/sticky/default_profile_images/default_profile_normal.png,15,53,0,1400,Scott_A_Alford,photo
47417737,2021-09-23 07:24:00,,"Retail, Valparaiso, ",,1441000392662261760,False,0,0,0,1,CareerArc 2.0,"Don't be shy. Score a job like ""LEAD SALES ASSOCIATE-FT in VALPARAISO, IN"" at Dollar General by asking for referrals. It's a great way to get a meeting with HR. Check out the link in our bio to apply. #Retail #Valparaiso, IN",,,2009-06-15 15:21:14,"Chicago, IL","Retail Jobs in Chicago, IL",https://pbs.twimg.com/profile_images/692729104152408064/PY28Qfe3_normal.jpg,135,99,0,869,CA_CHI_Retail2,
4696841353,2021-09-23 05:25:03,,,"dlvr.it/S86fQQ, pic.twitter.com/FeUpUylggp, ",1440970458610823168,False,0,0,0,0,dlvr.it,How One Retailer Is Stepping Up To Serve Markets Others Don’t (Or Won’t) https://t.co/BklzPcItet https://t.co/FeUpUylggp,,,2016-01-02 10:06:47,,BobNkosi,https://pbs.twimg.com/profile_images/955502283873284096/UCZXaNW0_normal.jpg,194,3498,0,8646,Cresslaan,photo
859907936117813248,2021-09-23 02:58:49,,,,1440933657225666574,False,0,0,0,0,Twitter for iPhone,"this lady at dollar general earlier gone ask me “who better Drake or Michael Jackson?”, I said “well they are in 2 different lanes you can’t compare them.” This bitch told me boy why tf you ain’t say Michael Jackson his gone eat dead or alive. Like girl wtf! You asked me!!!",,,2017-05-03 19:10:03,"Tallahassee, FL",you say what now?,https://pbs.twimg.com/profile_images/1397945545092599810/khlq-Gsn_normal.jpg,760,871,0,10585,mainelement_,
8985342,2021-09-23 02:42:38,,,"forbes.com/sites/dollar-g…, ",1440929582140563458,False,0,0,0,0,Twitter Web App,The Retail Standout That’s Giving A Boost To Reading And Literacy via @forbes https://t.co/BPLfndeSGi,"Forbes, ",,2007-09-19 20:15:46,Location Independent,Sharon Hurley Hall,https://pbs.twimg.com/profile_images/595580441412800514/3BozNTdI_normal.jpg,3987,1144,594,33813,SHurleyHall,
130442628,2021-09-23 02:30:06,,,"retaildive.com/news/dollar-ge…, ",1440926428388864001,False,0,0,0,0,Sailing Blogs,Dollar General debuts private label skincare line - Retail Dive https://t.co/WHrW2wGxr0,,,2010-04-07 05:07:45,,Diving News,https://pbs.twimg.com/profile_images/804026153/diving-and-activities_diving-and-activities_top_265_1_normal.jpg,9920,343,146,74391,diving_news,
726863331202572289,2021-09-23 01:05:47,,,,1440905209966993410,False,5,0,1,0,Twitter Web App,"Planning to buy some snacks at Dollar General before that direct

Whoopie doo",,,2016-05-01 15:58:17,,🧇🐊ᗯᗩᖴᖴ| Commissions Open🐊🧇,https://pbs.twimg.com/profile_images/1449579399272181760/AFNinYbd_normal.jpg,5331,1708,84,147492,WaffulSyrup,
1702562684,2021-09-23 00:22:38,,"Arson, ",,1440894350481924096,False,0,1,0,0,Twitter for Android,"So a local just rolled up and snapped video of guys at Dollar General up to no good! Called the cops! 

Thanks to an alert Natalia Teen who snapped me the video! 

Police en route. Men on foot around town as we speak up to no good. Stay alert tonight Natalia! 

#Arson",,,2013-08-26 13:59:36,THE 78059,SouthTejasChevyGuru,https://pbs.twimg.com/profile_images/1416868571221831684/WKOE3_vS_normal.jpg,3910,5000,35,119388,SouthTejas1984,
1702562684,2021-09-23 00:05:12,,,,1440889964758241280,False,0,0,0,0,Twitter for Android,"Idiots are by Dollar General NOW!!! 

Back-packers. Locals just rolled up on them",,,2013-08-26 13:59:36,THE 78059,SouthTejasChevyGuru,https://pbs.twimg.com/profile_images/1416868571221831684/WKOE3_vS_normal.jpg,3910,5000,35,119388,SouthTejas1984,
1155715464057823233,2021-09-22 23:56:33,,,"pic.twitter.com/taJernp34b, ",1440887787457294336,True,1,0,0,0,Twitter for iPhone,"Dollar general press on’s, thank me later https://t.co/taJernp34b",,,2019-07-29 01:43:33,"Oklahoma, USA",cal pal;),https://pbs.twimg.com/profile_images/1441457401698275330/b7B3SebJ_normal.jpg,217,117,0,564,cjaynes01,photo
1070629528983220225,2021-09-22 23:43:37,,,,1440884530504773633,False,1,0,0,0,"Cheap Bots, Done Quick!",James Davidson will create a new team with the 44 Ford being sponsored by Dollar General and Combos,,,2018-12-06 05:42:25,,NASCAR Silly Season Rumor Bot (Rarely Real),https://pbs.twimg.com/profile_images/1405922766772129794/WC6uFxaf_normal.jpg,1144,37,5,114679,5395bot1,
15136631,2021-09-22 23:43:07,,,"twitter.com/RepMTG/status/…, ",1440884407938600963,False,1,0,0,0,Tweetbot for iΟS,"You’re a sitting US Congressional Rep. Dress like it. 

You look like you scored that rag at the Dollar General clearance. But trash doesn’t know any better… https://t.co/53G2BYKKZo",,,2008-06-16 13:54:06,"N Fulton, GA",((( ZOMBIE Badger ))) ✡️ 🏳️‍🌈 🧟‍♂️,https://pbs.twimg.com/profile_images/1445459637440892932/88IYL2wG_normal.jpg,711,747,27,76871,flying_badger,
1553014219,2021-09-22 23:33:02,,,"pic.twitter.com/txY6JAHvDX, ",1440881867620864004,False,1,0,0,0,Twitter for iPhone,🚨LCFD🚨units are responding to a dumpster fire at the Dollar General in Paris. Please avoid the area if possible. https://t.co/txY6JAHvDX,,,2013-06-28 08:32:46,"Oxford, MS",Lafayette County Fire Dept.,https://pbs.twimg.com/profile_images/1444426638910017539/iqRErLFt_normal.jpg,2240,223,30,3471,LafayetteCo_FD,animated_gif
154733396,2021-09-22 23:26:39,,,"twitter.com/letstalkshoes2…, ",1440880261747691520,False,0,0,0,0,Twitter for iPhone,He should be promoted to Dollar General. https://t.co/bFFhjYSuhf,,,2010-06-11 22:06:19,"Village of Clarkston, MI",Spartans Gonna Eat,https://pbs.twimg.com/profile_images/1337814939457773569/YtMuvVzc_normal.jpg,871,810,10,32806,spar1091,
1643511540,2021-09-22 23:18:32,,,"people.com/pets/dog-steal…, ",1440878219477929990,False,0,0,0,0,Twitter Web App,A Dog Who Kept Sneaking into a Dollar General for a Unicorn Toy Gets His Plush and a New Start https://t.co/OINcwklSCU,,,2013-08-03 15:54:59,"Beaverton, Oregon",Cherise Arthur (Author of Sierra and Star),https://pbs.twimg.com/profile_images/1345192257943605249/GpkvV1cb_normal.jpg,63,294,1,4586,carthur799,
1295576151004332034,2021-09-22 23:03:24,,"tagotee, tagoteecom, pod, tagoteestore, tagoteefashion, tagoteeposter, tagoteemodel, tagoteeshirt, poster, hawaiian, Personalized, Dollar, ","tagotee.com/product/person…, cloudyteeshirt.com/product/person…, pic.twitter.com/EiSYpWuch9, ",1440874411519741953,False,0,0,1,0,Twitter Web App,"""Personalized Dollar General Zip Hoodie ✔✔✔

💖💖💖 Get it here: https://t.co/TBM2OMFpTe

👉👉👉 Or buy here: https://t.co/T7QBN4iRzZ

#tagotee #tagoteecom #pod #tagoteestore #tagoteefashion #tagoteeposter #tagoteemodel #tagoteeshirt #poster #hawaiian #Personalized #Dollar https://t.co/EiSYpWuch9",,,2020-08-18 00:20:04,United States,Tagotee Store,https://pbs.twimg.com/profile_images/1295576268994306050/gg3qJcYn_normal.jpg,18,7,1,19160,StoreTagotee,photo
709782014526881792,2021-09-22 22:18:24,,,,1440863085368016896,False,3,0,1,0,Twitter for Android,"Paytee told me I needed a new hobby today, it stung a little.  There is nothing wrong with being obsessed with Dollar General and Dr. Mario.",,,2016-03-15 12:43:14,"West Virginia, USA",Amy Campbell,https://pbs.twimg.com/profile_images/1260422507682828288/p9bXE2Sg_normal.jpg,196,186,1,841,softballa_mama,
1297384896067862529,2021-09-22 22:13:09,,,,1440861767077302272,False,1,0,0,0,Twitter for iPhone,went to the dollar general by my house and got a blanket for work!,,,2020-08-23 00:07:28,req 👎 yoob em,queerbiter ❤️‍🔥,https://pbs.twimg.com/profile_images/1440065362658148355/D_8NWoC2_normal.jpg,347,323,11,34171,tinyoongilover,
1546478239,2021-09-22 22:09:50,,,,1440860931097911302,False,2,0,0,0,Twitter for iPhone,"conversation between two employees at the dollar general
employee #1: ok but what is the point of this suuuuper tiny can of tomato paste?
employee #2: i don’t know….suuuper tiny soup or somethin",,,2013-06-25 15:10:23,,Beth,https://pbs.twimg.com/profile_images/1381865340540362755/OmQVTlQW_normal.jpg,217,159,3,7463,bethanie_leann,
232752853,2021-09-22 21:56:58,,,"twitter.com/im_koreyy/stat…, ",1440857694559162370,False,0,0,0,0,Twitter for iPhone,Me at Dollar General and Raising Canes https://t.co/tTmw7qKWWN,,,2011-01-01 00:34:32,"Mississippi, USA",L a n✨,https://pbs.twimg.com/profile_images/1409223496236929024/p7ohzHON_normal.jpg,202,548,0,5549,nalybba,
25714759,2021-09-22 21:50:57,,,"pic.twitter.com/PnyJxBzeNy, ",1440856177844232196,False,0,0,0,0,Twitter for Android,"This was the result of a need to go to Dollar General for air fresheners. $150 later, I get a text from my boss ...who reminded me that we have a Meijer store here.  I am in need of an entire intervention. 💸😂😂😂 https://t.co/PnyJxBzeNy",,,2009-03-21 15:20:26,"Evansville, IN",TylerFoxx96®™,https://pbs.twimg.com/profile_images/1421603187555856385/O-9OSIRy_normal.jpg,1151,2891,8,3210,TylerFoxx96,photo
4591016128,2021-09-22 21:40:02,,,"twitter.com/EffinLeftMama/…, ",1440853432659709954,False,2,1,4,0,Twitter for iPhone,"You must have got that clearance aisle, dollar general version of the constitution. Mine shows your statement to be incredibly misguided and altogether incorrect https://t.co/uBIGNb3Uhb",,,2015-12-24 11:28:13,"O'Fallon, MO",Nick Schroer,https://pbs.twimg.com/profile_images/1448317206010474498/uOpYh_8m_normal.jpg,3358,1289,78,9971,NickBSchroer,
381226189,2021-09-22 21:38:36,,,,1440853069844021254,False,1,0,1,0,Twitter for iPhone,My mom is so funny. She’s virtual shopping on YouTube on the new fall decor @ dollar general🌚🌚🌚🌚,,,2011-09-27 19:39:17,,aryana,https://pbs.twimg.com/profile_images/1452683856956506121/sfm7IIqc_normal.jpg,875,470,2,15840,aryanaf13,
1439939974745501702,2021-09-22 21:31:19,,"pokemon, pokemoncards, pokemontcg, pokemoncollector, pokemoncommunity, pokemoncollection, ","pic.twitter.com/Hyvx9zUNZc, ",1440851239479222272,False,0,0,0,0,Twitter for Android,Spotted at Dollar General. Some old fashioned dollar store packs. #pokemon #pokemoncards #pokemontcg #pokemoncollector #pokemoncommunity #pokemoncollection https://t.co/Hyvx9zUNZc,,,2021-09-20 09:10:27,,Pokemon Pack Family,https://pbs.twimg.com/profile_images/1439940387360104449/yRGCDGxc_normal.jpg,207,114,0,142,PokemonPackFam,photo
3174666784,2021-09-22 21:24:34,,,,1440849537258590217,False,1,0,0,0,Twitter for iPhone,Spirit Halloweens and Dollar General’s will just appear in the most random places,,,2015-04-16 21:28:56,Where am I?,Brian.,https://pbs.twimg.com/profile_images/1402169969002139650/UYfpZ42M_normal.jpg,370,4657,11,42695,mbpenninger,
119404374,2021-09-22 21:03:07,,,"sharonherald.com/news/hermitage…, ",1440844140296605697,False,0,0,0,0,BLOX CMS,"HERMITAGE — As Dollar General prepares to break ground for its fourth general-merchandise store in Hermitage, the city’s commissioners looked into whether they could limit chain stores from over-saturating the city. https://t.co/kMQ3k2xYTD",,,2010-03-03 10:00:04,"Sharon, Pa.",The Herald,https://pbs.twimg.com/profile_images/1286317583076134912/lV0WXmeX_normal.jpg,2758,124,65,12099,SharonHeraldPa,
1231975927120158720,2021-09-22 20:38:47,,"Kraken, ","pic.twitter.com/xZL4WQHBxR, ",1440838019443879946,False,0,0,0,0,Twitter for Android,"I found the #Kraken
It's at Dollar General next to#swagger

@ProjectLincoln https://t.co/xZL4WQHBxR","ProjectLincoln, ",,2020-02-24 11:15:42,,Cali Rant,https://pbs.twimg.com/profile_images/1231976409989406720/MeSZ7rIW_normal.jpg,5,43,0,406,CaliRant,photo
1194998882855469057,2021-09-22 20:36:36,,,"wgxa.tv/news/local/sho…, ",1440837469381922819,False,0,0,0,0,Twitter Web App,Police: Neighbors fight at Dollar General leads to one man being shot  https://t.co/7XVPHTcgoi,,,2019-11-14 10:22:00,,Erin Wise WGXA,https://pbs.twimg.com/profile_images/1352865492822863872/Sv0mDPSF_normal.jpg,326,421,10,3999,ErinWiseWGXA,
1090483589177901061,2021-09-22 20:35:12,,,,1440837116091461638,False,0,0,0,0,Twitter for iPhone,I can’t believe I left the keys of the dollar general in the bathroom and the door locked💀,,,2019-01-30 00:35:22,"Tennessee, USA",Raquel:)),https://pbs.twimg.com/profile_images/1433318046232371201/6f5siyEu_normal.jpg,536,490,1,10333,raaqquuueeellll,
1355600240,2021-09-22 20:35:10,,,,1440837105609961474,False,1,0,0,0,Twitter Web App,"My sister messaged me today that they're putting in a store called Popshelf where the old Michael's used to be. I got really excited until I went online and learned they are owned by Dollar General, so now I'll be boycotting on principle.",,,2013-04-15 19:36:29,,Vaxxed 🎃 Masked,https://pbs.twimg.com/profile_images/1445803475732811781/E7C2YweI_normal.jpg,1325,1286,1,10348,JenniferJacksun,
1362051600559136771,2021-09-22 20:19:08,,,"twitch.tv/gel_sauce, ",1440833071629045761,False,0,0,0,0,Streamlabs Twitter,Dollar General brand Ghost Hunters https://t.co/fhWnOjDHdj,,,2021-02-17 09:49:50,"Panama City, FL",Nick Gelsosomo,https://pbs.twimg.com/profile_images/1362052114709581826/18kci1EC_normal.jpg,28,38,0,77,Gel_Sauce,
432126976,2021-09-22 20:06:17,,,,1440829838537809928,False,4,0,0,0,Twitter for iPhone,One thing about South Bay dollar general… that playlist gone be fire 🔥,,,2011-12-08 21:23:18,Florida ,Javi 🐆,https://pbs.twimg.com/profile_images/1358081478316486663/d7m7fXjK_normal.jpg,426,452,3,53417,JaviAran_,
46173379,2021-09-22 19:53:26,,,,1440826603630514186,False,0,0,1,0,Twitter for iPhone,"Lately, the Dollar General on Yandell Rd don’t have anything on the shelves 🤦🏽‍♂️",,,2009-06-10 13:40:53,"Canton,MS",Dontavious Watkins,https://pbs.twimg.com/profile_images/1405274284835016704/a-o1rx7l_normal.jpg,484,684,1,16033,TayeSolo,
36500286,2021-09-22 19:48:34,,,"twitter.com/954Cobi/status…, ",1440825380324052996,False,0,0,0,0,Twitter for iPhone,The fact that they still sell these shits at my dollar general man oh man. 😂😂😂💀💀 https://t.co/053wH4Y1ps,,,2009-04-29 18:15:51,Pluto,♡🇭🇹,https://pbs.twimg.com/profile_images/1264266213045276672/k6FG1SRI_normal.jpg,418,456,0,7926,iYessShorty_,
125121155,2021-09-22 19:46:27,,,,1440824846326255619,False,0,0,1,0,Twitter for Android,This dollar general in Independence is amazing and friendly and even though they have a truck they are unloading u can still get around. The one down the street needs to take lessons.,,,2010-03-21 15:23:59,"Independence, Mo",Michelle Sledd,https://pbs.twimg.com/profile_images/1105332593212432384/nGCUZKBJ_normal.png,748,182,20,21077,Chelle___76,
2614646730,2021-09-22 19:46:14,,,,1440824792244916231,False,5,0,0,1,Twitter for iPhone,"living on your own you learn alot, like grocery shopping a cart full of shit at target costs about 200+ and at dollar general its about 70$ 😅😂",,,2014-07-09 22:57:20,,Ashy,https://pbs.twimg.com/profile_images/1419711463116128263/ssRlv8Wd_normal.jpg,167,192,3,4299,Ashleymjones5,
3582964217,2021-09-22 19:22:32,,,,1440818828737335300,False,0,0,0,0,"Cheap Bots, Done Quick!",Buckeye the creepy blue chicken from Dollar General,,,2015-09-07 22:10:43,,toynamerbot,https://abs.twimg.com/sticky/default_profile_images/default_profile_normal.png,18,0,9,318438,toynamerbot,
1214770150169305088,2021-09-22 19:21:28,,,,1440818561149145090,False,15,0,2,0,Twitter Web App,"in the tradition of ""hot girl shit"" i would like to make ""average guy shit"" a thing

walking to the dollar general in flip flops to get pop tarts, real average guy shit",,,2020-01-07 23:46:04,,Jean-Théophile Litwick 👻 🏴🎃,https://pbs.twimg.com/profile_images/1214770414540541952/6cE0Jft7_normal.jpg,484,381,3,34497,SegaCD8,
29826574,2021-09-22 19:11:46,,"Retail, Benton, ",,1440816120336769026,False,0,0,0,0,CareerArc 2.0,"This #Retail job might be a great fit for you. Click the link in our bio to see it and more. LEAD SALES ASSOCIATE-PT in BENTON, AR at Dollar General #Benton, AR",,,2009-04-08 17:30:41,Worldwide,TMJ-Other,https://pbs.twimg.com/profile_images/686397773931925506/odA6aSuJ_normal.jpg,648,299,8,1442,tmj_jobs_other,
992459647289298945,2021-09-22 19:09:05,,,"al.com/news/birmingha…, ",1440815444055580673,False,0,0,0,0,Twitter for Android,Tarrant police officer delivers groceries to woman caught stealing eggs at Dollar General https://t.co/6FrAuwQewj,,,2018-05-04 13:43:13,,Glenda Demoss (Author of Uncovering Unforgiveness),https://pbs.twimg.com/profile_images/1447241474257657860/FYYbUdVq_normal.jpg,661,839,4,7412,GlendaDemoss3,
213164926,2021-09-22 19:05:52,,"supervisor, Alachua, ",,1440814635452489729,False,0,0,0,0,CareerArc 2.0,"Join the Dollar General team! See our latest DC Management job openings, including ""WAREHOUSE SUPERVISOR II in ALACHUA FL"", via the link in our bio. #supervisor #Alachua, FL",,,2010-11-07 23:18:37,Worldwide,Worldwide SupplyChn,https://pbs.twimg.com/profile_images/713913875599634432/njtPp_ew_normal.jpg,275,216,6,897,tmj_ALL_schn,
99429705,2021-09-22 18:51:00,,"Retail, Decatur, ",,1440810891151245320,False,0,0,0,0,CareerArc 2.0,"Want to land a job like ""SALES ASSOCIATE in DECATUR, IL"" at Dollar General? Applicant tracking systems look for specific keywords. Use the right keywords and get your resume in front of the hiring manager. #Retail #Decatur, IL",,,2009-12-25 23:59:44,"Springfield, IL",TMJ-ILS Retail Jobs,https://pbs.twimg.com/profile_images/700279163547090944/51Ap0qjw_normal.jpg,166,112,30,954,tmj_ILS_retail,
247072509,2021-09-22 18:30:23,,,,1440805705670270976,False,2,0,1,0,Twitter Web App,"Can’t get what my indigenous lit teacher said out my head:

(@ shitty strip malls) We committed genocide for this? We committed genocide for the Dollar General, Ross, Big Lots to exist?",,,2011-02-03 20:21:55,atl hoe,Giovanni Tortorici,https://pbs.twimg.com/profile_images/1332167220412157956/EBQ79bFA_normal.jpg,116,309,0,760,candlstickmakr,
1262258304413286400,2021-09-22 18:28:38,,,"twitter.com/AgirlKy/status…, ",1440805265352192005,False,1,0,1,0,Twitter for iPhone,Are you talking about Dollar General or the high gas prices ?? https://t.co/IKQRrH0xXc,,,2020-05-18 01:47:06,Corrupt Illinois..,JC.,https://pbs.twimg.com/profile_images/1268833085396865026/hUZOfLMC_normal.jpg,5313,5402,0,24819,poorcope,
445181895,2021-09-22 18:26:07,,,"pic.twitter.com/zjUk1pfrfL, pic.twitter.com/zjUk1pfrfL, pic.twitter.com/zjUk1pfrfL, pic.twitter.com/zjUk1pfrfL, ",1440804632792469504,False,16,2,0,1,Twitter for Android,please dont smoke delta 8 my cousin smoked it and crashed in to the dollar general https://t.co/zjUk1pfrfL,,,2011-12-23 22:28:32,"Nellis Air Force Base, NV",CACTINV CEO👎,https://pbs.twimg.com/profile_images/1449585273273077772/J47xH021_normal.jpg,507,580,1,31842,cacti4free,photo
431164493,2021-09-22 18:20:22,,,,1440803181752045579,False,1,0,1,0,Twitter for iPhone,Just saw this lady loading her bag up n dollar general with shit.,,,2011-12-07 19:22:09,In your ❤️💙,We Get It N ENT.,https://pbs.twimg.com/profile_images/1425863997463609347/dTeryLaD_normal.jpg,671,1047,3,37107,DjMacalious,
