author_id,created_at,entities_cashtags,entities_hashtags,entities_urls,tweet_id,possibly_sensitive,public_metrics_like_count,public_metrics_quote_count,public_metrics_reply_count,public_metrics_retweet_count,source,text,entities_mentions,in_reply_to_user_id,created_at_user,location,name,profile_image_url,public_metrics_followers_count,public_metrics_following_count,public_metrics_listed_count,public_metrics_tweet_count,username,media_type
69620713,2020-08-04 22:07:53,,,"trib.al/nfz1hTA, pic.twitter.com/f1N5I6g995, ",1290831862206783488,False,43,3,8,15,SocialFlow,"Bill Gates says Microsoft, which is in talks to acquire the U.S. business of Chinese-owned video app TikTok, is careful about promises to keep data safe and wouldn’t do anything viewed as “hostile” as it navigates U.S. and Chinese concerns https://t.co/pUR3vf93BP @emilychangtv https://t.co/f1N5I6g995","emilychangtv, ",,2009-08-28 11:52:42,New York,Bloomberg Markets,https://pbs.twimg.com/profile_images/991798238519971840/0dG9AoKr_normal.jpg,1063544,286,14319,156022,markets,video
69620713,2020-08-03 01:53:07,,,"trib.al/ea2IGSd, ",1290163769444712453,False,25,0,2,15,SocialFlow,"Microsoft and ByteDance, with weeks to work out a deal for the software giant to buy TikTok’s U.S. operations, have yet to agree on terms like price https://t.co/kxJ2TKJlUR",,,2009-08-28 11:52:42,New York,Bloomberg Markets,https://pbs.twimg.com/profile_images/991798238519971840/0dG9AoKr_normal.jpg,1063544,286,14319,156022,markets,
69620713,2020-08-03 00:57:04,,,"trib.al/I5Usxtr, ",1290149662930788352,False,28,2,2,7,SocialFlow,Microsoft is continuing talks to buy TikTok’s operations in the U.S. following a discussion between CEO Satya Nadella and President Donald Trump https://t.co/yoL1o5D3UG,,,2009-08-28 11:52:42,New York,Bloomberg Markets,https://pbs.twimg.com/profile_images/991798238519971840/0dG9AoKr_normal.jpg,1063544,286,14319,156022,markets,
69620713,2020-08-02 20:13:43,,,"bloomberg.com/news/articles/…, pic.twitter.com/5PjeBbJbPY, ",1290078358055694336,False,131,28,8,67,Twitter Web App,"JUST IN: Microsoft is continuing talks to buy TikTok’s operations in the U.S. following a discussion between CEO Satya Nadella and President Donald Trump.

Talks are expected to be completed no later than Sept. 15. https://t.co/GTYvuaEQIS https://t.co/5PjeBbJbPY",,,2009-08-28 11:52:42,New York,Bloomberg Markets,https://pbs.twimg.com/profile_images/991798238519971840/0dG9AoKr_normal.jpg,1063544,286,14319,156022,markets,photo
69620713,2020-07-23 00:25:39,,,"trib.al/Hb3spIo, pic.twitter.com/ytSQXJivaX, ",1286155492532912128,False,17,0,0,18,SocialFlow,"-China, South Korea and Hong Kong stocks ⬇️
-Pfizer shares rise on U.S. order for vaccine candidate
-Gold ⬇️
-Microsoft stocks dropped and Tesla surged after the companies released earnings
https://t.co/HbWleSXr63 https://t.co/ytSQXJivaX",,,2009-08-28 11:52:42,New York,Bloomberg Markets,https://pbs.twimg.com/profile_images/991798238519971840/0dG9AoKr_normal.jpg,1063544,286,14319,156022,markets,photo
69620713,2020-07-22 07:00:35,,"5things, ","bloom.bg/3jwRy9g, pic.twitter.com/R3Say9oVDq, ",1285892493846941697,False,24,3,1,22,TweetDeck,"#5things
-U.S. orders China to close its consulate in Houston
-Time runs short for stimulus deal
-Tesla, Microsoft earnings 
-Markets drop
-Coming up...
https://t.co/qDbqBmoXKA https://t.co/R3Say9oVDq",,,2009-08-28 11:52:42,New York,Bloomberg Markets,https://pbs.twimg.com/profile_images/991798238519971840/0dG9AoKr_normal.jpg,1063544,286,14319,156022,markets,photo
69620713,2020-07-20 23:07:47,,,"trib.al/jetHQbN, ",1285411119474061312,False,23,1,4,5,SocialFlow,Microsoft president raised Apple issues to house antitrust group https://t.co/DUXdTV8KEg,,,2009-08-28 11:52:42,New York,Bloomberg Markets,https://pbs.twimg.com/profile_images/991798238519971840/0dG9AoKr_normal.jpg,1063544,286,14319,156022,markets,
69620713,2020-06-12 09:35:40,,,"bloom.bg/37lAf5F, ",1271436003614568450,False,19,2,8,6,TweetDeck,Trump retweeted a post from his former director of national intelligence that called for barring Microsoft from federal contracts https://t.co/43Am6Wj1WC,,,2009-08-28 11:52:42,New York,Bloomberg Markets,https://pbs.twimg.com/profile_images/991798238519971840/0dG9AoKr_normal.jpg,1063544,286,14319,156022,markets,
69620713,2020-03-25 12:30:16,,,"trib.al/gnlQAee, ",1242851301790269440,False,9,1,0,2,SocialFlow,"New streaming offerings from Microsoft, Google and Nvidia struggle to reach a billion iPhone and iPad users https://t.co/fYYvIvjNGq",,,2009-08-28 11:52:42,New York,Bloomberg Markets,https://pbs.twimg.com/profile_images/991798238519971840/0dG9AoKr_normal.jpg,1063544,286,14319,156022,markets,
69620713,2020-03-24 14:00:20,,,"trib.al/93MTWXQ, ",1242511583579947009,False,22,3,2,8,SocialFlow,"The United Arab Emirates lifted restrictions on some programs that allow voice calls over the Internet, including Microsoft Skype for Business and Google Hangout, to help people work from home and avoid spreading the coronavirus https://t.co/Ks2S6Ov3wF",,,2009-08-28 11:52:42,New York,Bloomberg Markets,https://pbs.twimg.com/profile_images/991798238519971840/0dG9AoKr_normal.jpg,1063544,286,14319,156022,markets,
69620713,2020-03-23 14:30:10,,,"trib.al/mSfufW3, ",1242156701031292930,False,30,3,1,22,SocialFlow,"Apple Inc.’s market value fell below $1 trillion as trading opened Monday, leaving Microsoft Corp. as the only U.S. stock above the 13-digit threshold https://t.co/uYYap6AwO0",,,2009-08-28 11:52:42,New York,Bloomberg Markets,https://pbs.twimg.com/profile_images/991798238519971840/0dG9AoKr_normal.jpg,1063544,286,14319,156022,markets,
69620713,2020-03-16 22:56:07,,,"trib.al/zAAyCve, ",1239747313867739137,False,32,2,5,15,SocialFlow,"Facebook, Microsoft and Google team up against virus misinformation https://t.co/TAy3lOEDyY",,,2009-08-28 11:52:42,New York,Bloomberg Markets,https://pbs.twimg.com/profile_images/991798238519971840/0dG9AoKr_normal.jpg,1063544,286,14319,156022,markets,
69620713,2020-03-12 15:00:20,,,"trib.al/cflPWAI, ",1238178025151369216,False,15,2,0,14,SocialFlow,Trillion-dollar valuations for Apple Inc. and Microsoft Corp. could be at risk as U.S. stocks continue to crater on concerns over the economic fallout of the spreading coronavirus pandemic https://t.co/oMtDwUUtHS,,,2009-08-28 11:52:42,New York,Bloomberg Markets,https://pbs.twimg.com/profile_images/991798238519971840/0dG9AoKr_normal.jpg,1063544,286,14319,156022,markets,
69620713,2020-02-19 01:26:04,,,"trib.al/QacMqTT, ",1230015678448578560,False,6,0,1,0,SocialFlow,Microsoft takes aim at election credibility with Wisconsin software test https://t.co/nFGnpZT9QA,,,2009-08-28 11:52:42,New York,Bloomberg Markets,https://pbs.twimg.com/profile_images/991798238519971840/0dG9AoKr_normal.jpg,1063544,286,14319,156022,markets,
69620713,2020-01-15 15:15:05,,,"trib.al/QuCZJUN, ",1217540729750327298,False,0,0,0,0,SocialFlow,"The company has taken a lead among big tech companies in helping to keep Seattle residents in their homes, but the scale of the problem is much bigger than its commitments https://t.co/mq8kiJ211p",,,2009-08-28 11:52:42,New York,Bloomberg Markets,https://pbs.twimg.com/profile_images/991798238519971840/0dG9AoKr_normal.jpg,1063544,286,14319,156022,markets,
69620713,2020-01-14 03:01:10,,,"trib.al/dgj4csN, ",1216993643996811265,False,8,2,0,6,SocialFlow,Amazon to seek order blocking Microsoft from work on Pentagon cloud contract https://t.co/tQ0TrYmfWE,,,2009-08-28 11:52:42,New York,Bloomberg Markets,https://pbs.twimg.com/profile_images/991798238519971840/0dG9AoKr_normal.jpg,1063544,286,14319,156022,markets,
69620713,2019-12-13 02:32:03,,,"bloom.bg/2sjcbjt, ",1205389908459827202,False,5,1,2,2,SocialFlow,"Microsoft shows off its new game console, the Xbox Series X, for the first time and confirms it will go on sale in the 2020 holiday period https://t.co/SPGOs6tUdp",,,2009-08-28 11:52:42,New York,Bloomberg Markets,https://pbs.twimg.com/profile_images/991798238519971840/0dG9AoKr_normal.jpg,1063544,286,14319,156022,markets,
69620713,2019-12-03 16:00:17,,,"bloom.bg/33IonHu, ",1201969427807383552,False,2,0,1,5,SocialFlow,"In a major reversal, the company is selling its new $250,000 Outpost rack servers to security-conscious enterprise customers https://t.co/BztbhKA4j9",,,2009-08-28 11:52:42,New York,Bloomberg Markets,https://pbs.twimg.com/profile_images/991798238519971840/0dG9AoKr_normal.jpg,1063544,286,14319,156022,markets,
69620713,2019-11-19 21:15:07,,,"bloom.bg/37lA9KG, ",1196975226854215681,False,8,0,1,3,SocialFlow,Google is taking over a chunk of Vodafone’s data operations to help the mobile phone company identify cost savings using artificial intelligence https://t.co/09hWpQVbex,,,2009-08-28 11:52:42,New York,Bloomberg Markets,https://pbs.twimg.com/profile_images/991798238519971840/0dG9AoKr_normal.jpg,1063544,286,14319,156022,markets,
69620713,2019-11-18 12:30:17,,,"bloomberg.com/news/articles/…, ",1196480761748164611,False,7,2,1,1,SocialFlow,Steve Ballmer is battling with James Dolan over a $1 billion arena the former Microsoft chief wants to build for his Los Angeles Clippers -- right down the street from Dolan’s concert hall https://t.co/8BvFLHTifU,,,2009-08-28 11:52:42,New York,Bloomberg Markets,https://pbs.twimg.com/profile_images/991798238519971840/0dG9AoKr_normal.jpg,1063544,286,14319,156022,markets,
69620713,2019-11-04 06:19:36,,,"bloom.bg/2PG6pSy, ",1191314046915678208,False,48,11,3,23,TweetDeck,Microsoft Japan says a four-day work week boosted productivity 40% https://t.co/AQJFuC476p,,,2009-08-28 11:52:42,New York,Bloomberg Markets,https://pbs.twimg.com/profile_images/991798238519971840/0dG9AoKr_normal.jpg,1063544,286,14319,156022,markets,
69620713,2019-10-29 07:04:30,,,"bloom.bg/36dZUfB, ",1189135916247457792,False,9,1,0,5,SocialFlow,Amazon is likely to move quickly in challenging a $10 billion contract award to Microsoft https://t.co/T66LXYwEZX,,,2009-08-28 11:52:42,New York,Bloomberg Markets,https://pbs.twimg.com/profile_images/991798238519971840/0dG9AoKr_normal.jpg,1063544,286,14319,156022,markets,
69620713,2019-10-28 14:30:19,,,"bloom.bg/32Ww6Ce, ",1188885721869934593,False,20,0,1,13,SocialFlow,"Microsoft Corp. shares jumped to an all-time high on Monday, after the company secured a $10 billion Pentagon contract for cloud-computing services https://t.co/v03OG9EMZW",,,2009-08-28 11:52:42,New York,Bloomberg Markets,https://pbs.twimg.com/profile_images/991798238519971840/0dG9AoKr_normal.jpg,1063544,286,14319,156022,markets,
69620713,2019-10-28 12:15:05,,,"bloom.bg/2WmUOc9, ",1188851691787083776,False,11,0,0,3,SocialFlow,"Microsoft Corp. shares surged after the company scored a major victory in securing a milestone, $10 billion Pentagon contract for cloud computing services. But the contract will likely come at a cost, legal and internal https://t.co/hS14N812ao",,,2009-08-28 11:52:42,New York,Bloomberg Markets,https://pbs.twimg.com/profile_images/991798238519971840/0dG9AoKr_normal.jpg,1063544,286,14319,156022,markets,
69620713,2019-10-24 13:30:10,,,"bloom.bg/2pemzrg, ",1187421034343026693,False,10,1,0,6,SocialFlow,"Microsoft Corp. rose in pre-market trading as first-quarter results topped estimates and boosted analyst confidence, with Jefferies noting the software giant should be able “to weather any storm"" https://t.co/Eu8WhxlahP",,,2009-08-28 11:52:42,New York,Bloomberg Markets,https://pbs.twimg.com/profile_images/991798238519971840/0dG9AoKr_normal.jpg,1063544,286,14319,156022,markets,
69620713,2019-10-24 08:54:19,,,"bloom.bg/33WX5NT, pic.twitter.com/WCf1oL1KQ1, ",1187351612995657729,False,13,1,0,11,TweetDeck,"Microsoft rose in pre-market trading as first-quarter results topped estimates, with Jefferies noting the software giant should be able “to weather any storm” https://t.co/pDHASDP05p https://t.co/WCf1oL1KQ1",,,2009-08-28 11:52:42,New York,Bloomberg Markets,https://pbs.twimg.com/profile_images/991798238519971840/0dG9AoKr_normal.jpg,1063544,286,14319,156022,markets,photo
69620713,2019-10-02 23:23:02,,,"bloom.bg/2n5IX5j, ",1179597702264479745,False,7,1,0,5,SocialFlow,Microsoft wants more chip engineers as custom silicon ambitions grow  https://t.co/0fwee2T1CQ,,,2009-08-28 11:52:42,New York,Bloomberg Markets,https://pbs.twimg.com/profile_images/991798238519971840/0dG9AoKr_normal.jpg,1063544,286,14319,156022,markets,
