author_id,created_at,entities_cashtags,entities_hashtags,entities_urls,tweet_id,possibly_sensitive,public_metrics_like_count,public_metrics_quote_count,public_metrics_reply_count,public_metrics_retweet_count,source,text,entities_mentions,in_reply_to_user_id,created_at_user,location,name,profile_image_url,public_metrics_followers_count,public_metrics_following_count,public_metrics_listed_count,public_metrics_tweet_count,username,media_type
69620713,2021-09-28 01:09:09,,,"trib.al/yIuymXK, ",1442717996242309120,False,26,2,3,7,SocialFlow,Microsoft CEO Satya Nadella says the company’s bid to acquire the U.S. assets of ByteDance’s TikTok was the “strangest thing” he’s ever worked on https://t.co/aOkvJLYJhm,,,2009-08-28 11:52:42,New York,Bloomberg Markets,https://pbs.twimg.com/profile_images/991798238519971840/0dG9AoKr_normal.jpg,1063544,286,14319,156022,markets,
69620713,2021-09-17 03:01:04,,,"trib.al/7xBxPX9, ",1438759894627373056,False,17,1,1,2,SocialFlow,Amazon and Microsoft are being tapped by India to transform its agricultural industry as Modi seeks overdue farm reforms https://t.co/7n9SiEHYmq,,,2009-08-28 11:52:42,New York,Bloomberg Markets,https://pbs.twimg.com/profile_images/991798238519971840/0dG9AoKr_normal.jpg,1063544,286,14319,156022,markets,
69620713,2021-09-09 07:02:03,,,"trib.al/ybPBjhB, ",1435921437299298310,False,6,0,0,3,SocialFlow,Hospitality startup Oyo entered a multiyear alliance with Microsoft to develop new travel technologies https://t.co/F27bItBs7F,,,2009-08-28 11:52:42,New York,Bloomberg Markets,https://pbs.twimg.com/profile_images/991798238519971840/0dG9AoKr_normal.jpg,1063544,286,14319,156022,markets,
69620713,2021-08-27 00:24:06,,,"trib.al/nML6PGy, ",1431110246865510403,False,11,2,0,10,SocialFlow,"A vulnerability in Microsoft’s cloud database system left data at thousands of clients exposed to potential cyberattacks for about two years, according to the Israeli cybersecurity firm that discovered the bug https://t.co/PQ4emFctz6",,,2009-08-28 11:52:42,New York,Bloomberg Markets,https://pbs.twimg.com/profile_images/991798238519971840/0dG9AoKr_normal.jpg,1063544,286,14319,156022,markets,
69620713,2021-08-26 00:28:05,,,"trib.al/va15O28, ",1430748861925056522,False,4,1,0,1,SocialFlow,Microsoft promotes product chief Panos Panay to its senior leadership team https://t.co/Cz8HhyrewY,,,2009-08-28 11:52:42,New York,Bloomberg Markets,https://pbs.twimg.com/profile_images/991798238519971840/0dG9AoKr_normal.jpg,1063544,286,14319,156022,markets,
69620713,2021-08-17 16:38:14,,,"trib.al/YzAaN06, ",1427731517028110348,False,18,3,0,12,SocialFlow,Microsoft invests in data recovery startup Rubrik and combines on software to keep customers from have to pay in ransomware attacks https://t.co/fiecXMqFJ5,,,2009-08-28 11:52:42,New York,Bloomberg Markets,https://pbs.twimg.com/profile_images/991798238519971840/0dG9AoKr_normal.jpg,1063544,286,14319,156022,markets,
69620713,2021-08-03 14:36:06,,,"trib.al/ePj3yWZ, ",1422627351956004866,False,25,1,1,7,SocialFlow,Microsoft said it will require employees to show proof of Covid-19 vaccinations before they can enter any U.S. office and won’t fully reopen work sites until October https://t.co/UYGtwGEssh,,,2009-08-28 11:52:42,New York,Bloomberg Markets,https://pbs.twimg.com/profile_images/991798238519971840/0dG9AoKr_normal.jpg,1063544,286,14319,156022,markets,
69620713,2021-07-30 14:34:15,,,"trib.al/zOilPDr, ",1421177336637034500,False,12,1,2,5,SocialFlow,"Individual investors are piling into the likes of Apple and Microsoft, showing a new appetite for megacap stocks after a rush of earnings sent some of the biggest tech names slumping https://t.co/lEwpxB5LlO",,,2009-08-28 11:52:42,New York,Bloomberg Markets,https://pbs.twimg.com/profile_images/991798238519971840/0dG9AoKr_normal.jpg,1063544,286,14319,156022,markets,
69620713,2021-07-20 04:57:38,,,"trib.al/uPO3JYO, ",1417408343988133958,False,11,1,3,4,SocialFlow,"China rejected accusations by the U.S., U.K. and their allies that actors linked to Beijing were behind the Microsoft Exchange hack https://t.co/aQCmTP30CC",,,2009-08-28 11:52:42,New York,Bloomberg Markets,https://pbs.twimg.com/profile_images/991798238519971840/0dG9AoKr_normal.jpg,1063544,286,14319,156022,markets,
69620713,2021-07-19 22:12:44,,,"trib.al/0Ndgbb6, ",1417306448200089605,False,24,2,5,8,SocialFlow,"The U.S., U.K. and their allies formally attribute Microsoft Exchange hack to actors affiliated with the Chinese government and accuse Beijing of a broad array of “malicious cyber activities” https://t.co/z0gVmSdbEi",,,2009-08-28 11:52:42,New York,Bloomberg Markets,https://pbs.twimg.com/profile_images/991798238519971840/0dG9AoKr_normal.jpg,1063544,286,14319,156022,markets,
69620713,2021-07-19 20:13:46,,,"trib.al/qmXVIac, ",1417276511644758021,False,15,2,3,4,SocialFlow,"-The U.S., U.K. and allies accuse China of the Microsoft Exchange hack
-Stocks tumble as the delta variant spooks investors
-Major Chinese cities face power blackouts

Here are some of the things to know at the start of your day https://t.co/2ocPuBS4AW",,,2009-08-28 11:52:42,New York,Bloomberg Markets,https://pbs.twimg.com/profile_images/991798238519971840/0dG9AoKr_normal.jpg,1063544,286,14319,156022,markets,
69620713,2021-07-15 15:29:06,,,"trib.al/kmlaqNf, ",1415755318542446593,False,13,2,1,9,SocialFlow,"At least 100 activists, journalists and government dissidents across 10 countries were targeted with spyware produced by an Israeli company called Candiru, cybersecurity researchers said https://t.co/wEKjjwgQ0O",,,2009-08-28 11:52:42,New York,Bloomberg Markets,https://pbs.twimg.com/profile_images/991798238519971840/0dG9AoKr_normal.jpg,1063544,286,14319,156022,markets,
69620713,2021-07-07 03:14:07,,,"trib.al/TjTMEJ7, ",1412671250909044736,False,15,2,0,0,SocialFlow,Andy Jassy can celebrate at least one win in his first week as Amazon CEO: the Pentagon said it would scrap the $10 billion cloud contract it awarded to Microsoft https://t.co/uO3MprCrnY,,,2009-08-28 11:52:42,New York,Bloomberg Markets,https://pbs.twimg.com/profile_images/991798238519971840/0dG9AoKr_normal.jpg,1063544,286,14319,156022,markets,
69620713,2021-07-06 14:59:05,,,"trib.al/fdYvEcm, ",1412486275056259075,False,17,2,7,10,SocialFlow,"The Pentagon has scrapped the $10 billion JEDI cloud-computing contract originally awarded to Microsoft in 2019, indicating it plans to divide the work between Microsoft and Amazon https://t.co/Cko8NC7GMr",,,2009-08-28 11:52:42,New York,Bloomberg Markets,https://pbs.twimg.com/profile_images/991798238519971840/0dG9AoKr_normal.jpg,1063544,286,14319,156022,markets,
69620713,2021-07-01 05:12:05,,,"trib.al/kLAYsUT, pic.twitter.com/NDq92mklRe, ",1410526614870495236,False,17,1,0,4,SocialFlow,Microsoft lost millions of dollars’ worth of Xbox gift cards in an online scheme. Turns out it was an inside job https://t.co/OShW40Vtxx https://t.co/NDq92mklRe,,,2009-08-28 11:52:42,New York,Bloomberg Markets,https://pbs.twimg.com/profile_images/991798238519971840/0dG9AoKr_normal.jpg,1063544,286,14319,156022,markets,video
69620713,2021-06-29 21:42:30,,,"trib.al/0eliXNS, ",1410051081749602304,False,14,0,2,5,SocialFlow,"Microsoft and Google's five-year truce has expired and isn't likely to be renewed after a year of public and private tussling over ad tech, content and cloud. Are the companies giving ammunition to regulators and lawmakers targeting tech? https://t.co/HG4fVmpWIb",,,2009-08-28 11:52:42,New York,Bloomberg Markets,https://pbs.twimg.com/profile_images/991798238519971840/0dG9AoKr_normal.jpg,1063544,286,14319,156022,markets,
69620713,2021-06-23 18:20:39,,,"trib.al/i1zVLFK, ",1407825960423112705,False,18,0,1,4,SocialFlow,"Even as Microsoft hovers around a $2 trillion valuation, it may avoid being included in the House’s antitrust bills aimed at big tech companies https://t.co/7RrzXHemwn",,,2009-08-28 11:52:42,New York,Bloomberg Markets,https://pbs.twimg.com/profile_images/991798238519971840/0dG9AoKr_normal.jpg,1063544,286,14319,156022,markets,
69620713,2021-06-22 21:27:54,,,"trib.al/ttEqHVQ, ",1407510695839666178,False,45,1,3,15,SocialFlow,"-Stocks rise after Fed Chair Jerome Powell reassures on inflation
-Microsoft reaches a $2 trillion valuation
-Justin Trudeau rips into China

Here are some of the things to know at the start of Asia's trading day https://t.co/50CxSVcD6y",,,2009-08-28 11:52:42,New York,Bloomberg Markets,https://pbs.twimg.com/profile_images/991798238519971840/0dG9AoKr_normal.jpg,1063544,286,14319,156022,markets,
69620713,2021-06-22 16:46:47,,,"trib.al/FIuvDik, ",1407439950723829766,False,68,4,1,15,SocialFlow,Microsoft becomes just the second U.S. public company to reach a $2 trillion market value https://t.co/Wq8vuqxJAl,,,2009-08-28 11:52:42,New York,Bloomberg Markets,https://pbs.twimg.com/profile_images/991798238519971840/0dG9AoKr_normal.jpg,1063544,286,14319,156022,markets,
69620713,2021-06-22 00:37:12,,,"trib.al/yWhC5WI, ",1407195943422902297,False,12,0,4,2,SocialFlow,"Microsoft reported progress in hiring and promoting Black leaders and slower gains among Latinx leaders, a year after promising to double the number of managers and executives from both groups by 2025 https://t.co/MUTOG83x0T",,,2009-08-28 11:52:42,New York,Bloomberg Markets,https://pbs.twimg.com/profile_images/991798238519971840/0dG9AoKr_normal.jpg,1063544,286,14319,156022,markets,
69620713,2021-06-13 18:05:17,,,"trib.al/W0xcn7D, ",1404198215046545408,False,16,1,1,4,SocialFlow,"Big announcements from Microsoft, Ubisoft and Square Enix marked the start of the E3 video game trade show https://t.co/lizR07JQ02",,,2009-08-28 11:52:42,New York,Bloomberg Markets,https://pbs.twimg.com/profile_images/991798238519971840/0dG9AoKr_normal.jpg,1063544,286,14319,156022,markets,
69620713,2021-06-13 16:44:16,,,"trib.al/oe0eLP7, ",1404177825251332098,False,20,1,2,3,SocialFlow,"Microsoft’s much-anticipated Halo Infinite will be out this holiday season, the company says at E3 https://t.co/jiGuOfCIp9",,,2009-08-28 11:52:42,New York,Bloomberg Markets,https://pbs.twimg.com/profile_images/991798238519971840/0dG9AoKr_normal.jpg,1063544,286,14319,156022,markets,
69620713,2021-06-02 12:59:05,,,"trib.al/THgNKjs, ",1400134888330760195,False,16,1,2,5,SocialFlow,Microsoft will unveil a new version of its flagship Windows software on June 24 https://t.co/a03Wq36hxa,,,2009-08-28 11:52:42,New York,Bloomberg Markets,https://pbs.twimg.com/profile_images/991798238519971840/0dG9AoKr_normal.jpg,1063544,286,14319,156022,markets,
69620713,2021-05-28 04:55:06,,,"trib.al/461R7Em, ",1398201150646652937,False,35,2,4,13,SocialFlow,"Russian hackers behind the SolarWinds campaign escalate attacks on U.S. federal agencies, think tanks and NGOs, Microsoft says. https://t.co/xfcU4bh6it",,,2009-08-28 11:52:42,New York,Bloomberg Markets,https://pbs.twimg.com/profile_images/991798238519971840/0dG9AoKr_normal.jpg,1063544,286,14319,156022,markets,
69620713,2021-05-18 18:55:05,,,"trib.al/ePvnTm2, ",1394788659669393408,False,4,0,0,2,SocialFlow,Google unfurled an expansive range of consumer products and gee-whiz research at the kickoff of its marquee annual conference https://t.co/ECtjQ1GIyf,,,2009-08-28 11:52:42,New York,Bloomberg Markets,https://pbs.twimg.com/profile_images/991798238519971840/0dG9AoKr_normal.jpg,1063544,286,14319,156022,markets,
69620713,2021-05-16 23:04:13,"MSFT, ",,"trib.al/5zZQV58, ",1394126581170245633,False,59,14,13,13,SocialFlow,"Microsoft’s directors started a probe into Bill Gates’s alleged involvement with a female employee that was deemed inappropriate and decided that the co-founder had to step down from the board last year, Dow Jones reports https://t.co/OtwZKuyBMp $MSFT",,,2009-08-28 11:52:42,New York,Bloomberg Markets,https://pbs.twimg.com/profile_images/991798238519971840/0dG9AoKr_normal.jpg,1063544,286,14319,156022,markets,
69620713,2021-05-14 07:13:00,,,"trib.al/QsTYQ2y, ",1393162424400896002,False,12,3,2,3,SocialFlow,The Mac vs. PC rivals saw their feud simmer down in recent years. Now it’s back and could be a sign of more battles to come. https://t.co/z4vRwdU7Yp,,,2009-08-28 11:52:42,New York,Bloomberg Markets,https://pbs.twimg.com/profile_images/991798238519971840/0dG9AoKr_normal.jpg,1063544,286,14319,156022,markets,
69620713,2021-04-28 17:42:19,,,"trib.al/vpzMClo, ",1387522590730821634,False,34,2,3,6,SocialFlow,Microsoft President Brad Smith said Google has hurt the concept of the open web and impaired content creators’ ability to make money https://t.co/B7Wc06Amfu,,,2009-08-28 11:52:42,New York,Bloomberg Markets,https://pbs.twimg.com/profile_images/991798238519971840/0dG9AoKr_normal.jpg,1063544,286,14319,156022,markets,
69620713,2021-04-20 18:19:19,,,"trib.al/78ncmpG, ",1384632799014137858,False,61,2,3,19,SocialFlow,Microsoft has ended talks to acquire Discord https://t.co/J0wOG3vNpT,,,2009-08-28 11:52:42,New York,Bloomberg Markets,https://pbs.twimg.com/profile_images/991798238519971840/0dG9AoKr_normal.jpg,1063544,286,14319,156022,markets,
69620713,2021-04-13 22:16:05,,,"trib.al/Sbe8RJ5, ",1382155670489808901,False,8,0,1,5,SocialFlow,"Evercore is having a big M&amp;A week with Grab, Microsoft deals https://t.co/VKS62oI6fC",,,2009-08-28 11:52:42,New York,Bloomberg Markets,https://pbs.twimg.com/profile_images/991798238519971840/0dG9AoKr_normal.jpg,1063544,286,14319,156022,markets,
69620713,2021-04-13 21:59:01,,,"trib.al/nIKsgHT, ",1382151374423613440,False,4,0,3,2,SocialFlow,Evercore was lead adviser on a pair of back-to-back technology deals this week worth up to $60 billion that helped it jump a spot in the league tables https://t.co/cqWCMVI4bs,,,2009-08-28 11:52:42,New York,Bloomberg Markets,https://pbs.twimg.com/profile_images/991798238519971840/0dG9AoKr_normal.jpg,1063544,286,14319,156022,markets,
69620713,2021-04-11 23:33:04,,,"trib.al/3LgQVZf, ",1381450265472217091,False,29,2,3,14,SocialFlow,Microsoft makes a big bet on health-care AI technology with Nuance https://t.co/cQR2LcI0Oy,,,2009-08-28 11:52:42,New York,Bloomberg Markets,https://pbs.twimg.com/profile_images/991798238519971840/0dG9AoKr_normal.jpg,1063544,286,14319,156022,markets,
69620713,2021-04-08 16:55:47,,,"trib.al/WGJAz1n, ",1380263122234179588,False,20,1,4,5,SocialFlow,Retail day traders are tilting away from tiny meme stocks in favor of old blue chips like GM and Microsoft https://t.co/EIbq8FXYHB,,,2009-08-28 11:52:42,New York,Bloomberg Markets,https://pbs.twimg.com/profile_images/991798238519971840/0dG9AoKr_normal.jpg,1063544,286,14319,156022,markets,
69620713,2021-03-31 23:36:05,,,"trib.al/dek7nCg, ",1377464760422309897,False,8,0,0,3,SocialFlow,The world is wondering about this video game-centric chat app. Here's what you need to know https://t.co/5CsRqfhsXM,,,2009-08-28 11:52:42,New York,Bloomberg Markets,https://pbs.twimg.com/profile_images/991798238519971840/0dG9AoKr_normal.jpg,1063544,286,14319,156022,markets,
69620713,2021-03-31 15:52:07,,,"trib.al/kyHxaSC, ",1377347999731486724,False,71,4,1,20,SocialFlow,Microsoft’s $22 billion-dollar deal to build customized versions of its HoloLens goggles for the U.S. Army is moving forward https://t.co/OWxhMFKEtJ,,,2009-08-28 11:52:42,New York,Bloomberg Markets,https://pbs.twimg.com/profile_images/991798238519971840/0dG9AoKr_normal.jpg,1063544,286,14319,156022,markets,
69620713,2021-03-31 05:13:58,,,"trib.al/AzTHXjI, ",1377187405120249861,False,13,0,0,6,SocialFlow,The world is wondering about this video game-centric chat app. Here's what you need to know https://t.co/mSCVE2t6A4,,,2009-08-28 11:52:42,New York,Bloomberg Markets,https://pbs.twimg.com/profile_images/991798238519971840/0dG9AoKr_normal.jpg,1063544,286,14319,156022,markets,
69620713,2021-03-23 00:02:52,,,"trib.al/p3qRaT3, ",1374210007378591751,False,75,19,4,36,SocialFlow,"Microsoft is in talks to acquire Discord, a video-game chat community, for more than $10 billion, according to people familiar with the matter https://t.co/EtPOXVGlr0",,,2009-08-28 11:52:42,New York,Bloomberg Markets,https://pbs.twimg.com/profile_images/991798238519971840/0dG9AoKr_normal.jpg,1063544,286,14319,156022,markets,
69620713,2021-03-22 22:41:03,,,"trib.al/xic05xl, ",1374189420023320576,False,105,38,6,46,SocialFlow,"JUST IN: Microsoft is in talks to acquire Discord, a video-game chat community, for more than $10 billion, according to people familiar with the matter https://t.co/i5bvNhFC1A",,,2009-08-28 11:52:42,New York,Bloomberg Markets,https://pbs.twimg.com/profile_images/991798238519971840/0dG9AoKr_normal.jpg,1063544,286,14319,156022,markets,
69620713,2021-03-12 07:51:22,,,"trib.al/8EUPhNU, ",1370356746380849162,False,10,0,1,12,SocialFlow,Late last month attackers began infiltrating Microsoft email systems en masse—almost as if they knew their window of opportunity was about to shut https://t.co/xLpBTMH7kn,,,2009-08-28 11:52:42,New York,Bloomberg Markets,https://pbs.twimg.com/profile_images/991798238519971840/0dG9AoKr_normal.jpg,1063544,286,14319,156022,markets,
69620713,2021-03-12 05:31:04,,,"trib.al/kg98dXQ, ",1370321435252654081,False,10,2,0,7,SocialFlow,"Microsoft finds a ""new family of ransomware"" being used against servers that hadn’t patched vulnerabilities after last week’s major breach https://t.co/r33uGstTsN",,,2009-08-28 11:52:42,New York,Bloomberg Markets,https://pbs.twimg.com/profile_images/991798238519971840/0dG9AoKr_normal.jpg,1063544,286,14319,156022,markets,
69620713,2021-03-08 01:54:24,,,"trib.al/dQDQSQA, ",1368817357720875009,False,12,0,0,9,SocialFlow,"Missile and drone attack sends crude above $70, Britain takes its first step out of lockdown and there's been a vast email server hack  https://t.co/HDhTkotfBN",,,2009-08-28 11:52:42,New York,Bloomberg Markets,https://pbs.twimg.com/profile_images/991798238519971840/0dG9AoKr_normal.jpg,1063544,286,14319,156022,markets,
69620713,2021-03-07 22:02:29,,,"trib.al/MAfznCb, ",1368758997126418433,False,20,3,6,10,SocialFlow,"A global cybersecurity crisis is underway after a Chinese hack targeted Microsoft's business email software, infecting at least 60,000 victims so far https://t.co/VXFVtnKbHm",,,2009-08-28 11:52:42,New York,Bloomberg Markets,https://pbs.twimg.com/profile_images/991798238519971840/0dG9AoKr_normal.jpg,1063544,286,14319,156022,markets,
69620713,2021-03-07 20:36:38,,,"trib.al/NLiM8nf, pic.twitter.com/cdYEwTyjid, ",1368737389737283588,False,78,2,4,27,SocialFlow,"-Saudi oil site attack sends crude over $70
-Microsoft attack becomes a global crisis
-Asia stocks set to start the week strong

Here's what people in markets are talking about today
https://t.co/UaJOIvmy3o https://t.co/cdYEwTyjid",,,2009-08-28 11:52:42,New York,Bloomberg Markets,https://pbs.twimg.com/profile_images/991798238519971840/0dG9AoKr_normal.jpg,1063544,286,14319,156022,markets,photo
69620713,2021-03-03 01:39:03,,,"trib.al/a2DRtoc, ",1367001557758324736,False,19,3,0,3,SocialFlow,"Microsoft is unveiling tools to make VR and AR easier to develop and available on more types of devices, aiming to bring in more users by letting them socialize and work in virtual spaces https://t.co/xmjGsEEnyu",,,2009-08-28 11:52:42,New York,Bloomberg Markets,https://pbs.twimg.com/profile_images/991798238519971840/0dG9AoKr_normal.jpg,1063544,286,14319,156022,markets,
69620713,2021-03-02 23:06:36,,,"trib.al/nmGGJGV, ",1366963192753192965,False,23,0,3,13,SocialFlow,Microsoft is urging customers to download software patches after state-sponsored hackers based in China broke into Microsoft Exchange Server https://t.co/kNwQT0jpIB,,,2009-08-28 11:52:42,New York,Bloomberg Markets,https://pbs.twimg.com/profile_images/991798238519971840/0dG9AoKr_normal.jpg,1063544,286,14319,156022,markets,
69620713,2021-01-19 09:21:12,,,"trib.al/L1x63bk, ",1351535181337923585,False,37,0,1,23,SocialFlow,General Motors and Microsoft are leading a $2 billion investment round in self-driving car startup Cruise in a deal that will bring the software giant’s cloud and edge-computing capabilities to the venture https://t.co/PUvPQKtxLV,,,2009-08-28 11:52:42,New York,Bloomberg Markets,https://pbs.twimg.com/profile_images/991798238519971840/0dG9AoKr_normal.jpg,1063544,286,14319,156022,markets,
69620713,2021-01-11 14:42:54,,,"trib.al/3tvBOMy, ",1348717037447733250,False,18,1,1,8,SocialFlow,Microsoft and Facebook said they'll pause political contributions after last week's deadly pro-Trump riot https://t.co/oJFdabiEhv,,,2009-08-28 11:52:42,New York,Bloomberg Markets,https://pbs.twimg.com/profile_images/991798238519971840/0dG9AoKr_normal.jpg,1063544,286,14319,156022,markets,
69620713,2020-12-22 03:46:39,,,"trib.al/fytCZkL, ",1341304130724372480,False,21,0,0,5,SocialFlow,Google and Microsoft join an investment round of more than $100 million in Indian-language TikTok rival https://t.co/F5eLnauf6o,,,2009-08-28 11:52:42,New York,Bloomberg Markets,https://pbs.twimg.com/profile_images/991798238519971840/0dG9AoKr_normal.jpg,1063544,286,14319,156022,markets,
69620713,2020-10-28 01:26:51,,,"trib.al/XfdVwjA, pic.twitter.com/3r7QtCUhVC, ",1321322516292489221,False,54,1,1,31,SocialFlow,"-Japan and Hong Kong stocks ⬇️
-U.S. futures ⬇️
-European futures decline 1.5%
-Microsoft shares ⬇️ as a forecast for revenue in some divisions falls short of the highest analysts’ projections
-Oil  ⬇️ to $38.67
https://t.co/D6iAxen0Ek https://t.co/3r7QtCUhVC",,,2009-08-28 11:52:42,New York,Bloomberg Markets,https://pbs.twimg.com/profile_images/991798238519971840/0dG9AoKr_normal.jpg,1063544,286,14319,156022,markets,photo
69620713,2020-09-28 11:23:51,,,"bloom.bg/3cKlUST, ",1310601118230220800,False,42,0,1,15,TweetDeck,Microsoft sees telecom companies investing in 5G as its next big Azure cloud customers https://t.co/CRO1RxssjZ,,,2009-08-28 11:52:42,New York,Bloomberg Markets,https://pbs.twimg.com/profile_images/991798238519971840/0dG9AoKr_normal.jpg,1063544,286,14319,156022,markets,
69620713,2020-09-15 20:30:05,,,"trib.al/WhOO4xa, ",1306027543150178310,False,45,1,3,14,SocialFlow,"William Gates Sr., the father of Microsoft's co-founder who helped advise his massive philanthropic efforts, has died at the age of 94 https://t.co/4TQeSpTlmn",,,2009-08-28 11:52:42,New York,Bloomberg Markets,https://pbs.twimg.com/profile_images/991798238519971840/0dG9AoKr_normal.jpg,1063544,286,14319,156022,markets,
69620713,2020-09-13 20:12:21,,,"trib.al/vZQj4yH, ",1305298305543557122,False,130,28,2,93,SocialFlow,"UPDATE: Oracle has been selected as the winning bidder for TikTok’s U.S. operations, WSJ reports. Microsoft says its bid was rejected. https://t.co/4iSukqItEx",,,2009-08-28 11:52:42,New York,Bloomberg Markets,https://pbs.twimg.com/profile_images/991798238519971840/0dG9AoKr_normal.jpg,1063544,286,14319,156022,markets,
69620713,2020-09-13 19:43:09,,,"trib.al/ZQZHs2p, pic.twitter.com/UlseWf8N1B, ",1305290955730358273,False,37,3,2,16,SocialFlow,BREAKING: Microsoft says ByteDance rejected its bid for TikTok's U.S. operations https://t.co/qqV77efi8Z https://t.co/UlseWf8N1B,,,2009-08-28 11:52:42,New York,Bloomberg Markets,https://pbs.twimg.com/profile_images/991798238519971840/0dG9AoKr_normal.jpg,1063544,286,14319,156022,markets,photo
69620713,2020-09-13 19:29:34,,,"trib.al/Lm17TTe, ",1305287536231751681,False,102,9,3,47,SocialFlow,"JUST IN: Software maker Oracle is gaining the upper hand over its main rival, Microsoft, in the pursuit of TikTok's U.S. operations, sources say https://t.co/qOscBo6QPG",,,2009-08-28 11:52:42,New York,Bloomberg Markets,https://pbs.twimg.com/profile_images/991798238519971840/0dG9AoKr_normal.jpg,1063544,286,14319,156022,markets,
69620713,2020-08-27 12:02:42,,,"bloom.bg/3gGi3a0, ",1299014485164929024,False,47,6,4,32,TweetDeck,Walmart is partnering with Microsoft in a joint bid to acquire TikTok. Walmart shares rose as high as 4% on the news. https://t.co/zphTXspl6C,,,2009-08-28 11:52:42,New York,Bloomberg Markets,https://pbs.twimg.com/profile_images/991798238519971840/0dG9AoKr_normal.jpg,1063544,286,14319,156022,markets,
69620713,2020-08-20 06:26:37,,,"trib.al/llISAOs, ",1296393194079428608,False,18,0,0,7,SocialFlow,Microsoft is helping Brazil's oil giant weather the pandemic with cloud computing and AI https://t.co/EH9J8a76UX,,,2009-08-28 11:52:42,New York,Bloomberg Markets,https://pbs.twimg.com/profile_images/991798238519971840/0dG9AoKr_normal.jpg,1063544,286,14319,156022,markets,
69620713,2020-08-16 19:30:05,,,"trib.al/2k955HR, ",1295140806060277761,False,13,1,0,3,SocialFlow,Microsoft has avoided the techlash. Buying TikTok’s U.S. operations could change that https://t.co/UkWbepEirM,,,2009-08-28 11:52:42,New York,Bloomberg Markets,https://pbs.twimg.com/profile_images/991798238519971840/0dG9AoKr_normal.jpg,1063544,286,14319,156022,markets,
69620713,2020-08-06 14:40:11,,,"trib.al/gssikqb, ",1291443971617624064,False,17,0,0,9,SocialFlow,"TikTok and Microsoft are exploring a deal to buy all of TikTok’s global operations, including the video-app’s service in India and Europe, the Financial Times reported https://t.co/zLkB3Z99KE",,,2009-08-28 11:52:42,New York,Bloomberg Markets,https://pbs.twimg.com/profile_images/991798238519971840/0dG9AoKr_normal.jpg,1063544,286,14319,156022,markets,
69620713,2020-08-04 22:55:07,,,"trib.al/1jnfzSw, pic.twitter.com/XJFYfikOoB, ",1290843751863263233,False,53,4,11,18,SocialFlow,"Microsoft co-founder Bill Gates urges the U.S. to take a more global approach in dealing with the coronavirus pandemic, saying while the nation leads in research, “we’ve only taken care of ourselves” in producing and procuring a vaccine https://t.co/3ecTcjKWvE https://t.co/XJFYfikOoB",,,2009-08-28 11:52:42,New York,Bloomberg Markets,https://pbs.twimg.com/profile_images/991798238519971840/0dG9AoKr_normal.jpg,1063544,286,14319,156022,markets,video
