author_id,created_at,entities_cashtags,entities_hashtags,entities_urls,tweet_id,possibly_sensitive,public_metrics_like_count,public_metrics_quote_count,public_metrics_reply_count,public_metrics_retweet_count,source,text,entities_mentions,in_reply_to_user_id,created_at_user,location,name,profile_image_url,public_metrics_followers_count,public_metrics_following_count,public_metrics_listed_count,public_metrics_tweet_count,username,media_type
942052344,2021-09-30 14:58:35,,"remotejobs, telecommutejobs, workfromhomejobs, ","dlvr.it/S8gjb3, ",1443651505349791767,False,0,0,0,0,dlvr.it,Customer Service Representative (Seasonal / Work From Home): Job Ad Are you looking to work for one of the most exciting brands in the outdoor industry? VF Corporation is looking for exceptional customer… https://t.co/F7HyHlaTiq #remotejobs #telecommutejobs #workfromhomejobs,,,2012-11-11 14:39:39,"Remote, Anywhere",Jobmote,https://pbs.twimg.com/profile_images/1229964526830915584/QoSJ1WMO_normal.jpg,5866,4883,414,50343,jobmote,
18201801,2021-09-30 12:14:59,,,"bit.ly/3lpoSRm, ",1443610334384754690,False,11,1,0,0,HubSpot,"VF Corporation's new HQ in Denver, designed by Rapt Studio, highlights active lifestyles with an in-office climbing wall, double-height lobby, fitness center, coffee bar and a café with terrace on the fourth floor. https://t.co/JNuxg9FPpi",,,2008-12-17 17:23:07,,Interior Design,https://pbs.twimg.com/profile_images/951929389826093056/WvcR9n9u_normal.jpg,1328488,390,5843,39538,InteriorDesign,
1407011874537938944,2021-09-30 07:23:19,,,"skyfluencer.com/hey-wait-eagle…, pic.twitter.com/Y4YLzFWhl0, ",1443536932751953922,False,0,0,0,0,Blog2Social APP,"We reported this summer that Eagle Creek, one of the best backpack manufacturers out there, is being taken from the life by parent company VF Corporation.  A popular brand by everyone but the decision makers at VF, a lot of people were really amazed.

https://t.co/RbibSkxDXS https://t.co/Y4YLzFWhl0",,,2021-06-21 12:25:57,Zug ,Skyfluencer,https://pbs.twimg.com/profile_images/1407012477435580421/H3LgnSuX_normal.jpg,0,0,0,494,Skyfluencer1,photo
20089995,2021-09-25 15:55:01,,,"bit.ly/2W3YqUZ, pic.twitter.com/S7PSIzV4n2, ",1441853770841968640,False,1,0,0,1,Sprout Social,"VF Corporation re­located their new headquarters to Denver, where it shares a 10-story downtown high-rise with a few of its previously dispersed brands: The North Face, JanSport, Altra, and more. 

Take a tour of the space, designed by @RaptStudio: https://t.co/n3uk1uDuxr https://t.co/S7PSIzV4n2","RaptStudio, ",,2009-02-04 15:34:17,"Chicago, IL",IIDA,https://pbs.twimg.com/profile_images/1410604571559297039/vAl53eYs_normal.jpg,34614,948,699,7894,IIDA_HQ,photo
18201801,2021-09-25 13:13:59,,,"bit.ly/3EmjcQV, ",1441813245443117057,False,4,0,0,1,HubSpot,"VF Corporation's new HQ in Denver, designed by Rapt Studio, highlights active lifestyles with an in-office climbing wall, double-height lobby, fitness center, coffee bar and a café with terrace on the fourth floor. https://t.co/rR2ytMm6ab",,,2008-12-17 17:23:07,,Interior Design,https://pbs.twimg.com/profile_images/951929389826093056/WvcR9n9u_normal.jpg,1328488,390,5843,39538,InteriorDesign,
2265477344,2021-09-25 04:34:16,,,"bgmea.com.bd/page/BGMEA_Pre…, ",1441682451420508162,False,8,0,0,0,Twitter Web App,BGMEA President Faruque Hassan requested VF Corporation to strengthen partnership with its Bangladeshi suppliers to build their capabilities especially in manufacturing apparel and footwear products which have high demand in the market. https://t.co/CK3Mn1zUJd,,,2013-12-28 01:38:14,"Dhaka, Bangladesh",BGMEA,https://pbs.twimg.com/profile_images/416821987244138496/eJRPWVfM_normal.jpeg,3491,483,20,751,brandbgmea,
707057743157444608,2021-09-24 12:34:41,"VFC, ","VF, Options, Options, maxpain, OptionsTrading, OptionsFlow, optionstrade, optiontrading, stocks, stock, StockMarket, Investment, investing, invest, investor, investors, UOA, ","apple.co/2XZuTYw, pic.twitter.com/P6avkZwlS9, pic.twitter.com/P6avkZwlS9, pic.twitter.com/P6avkZwlS9, pic.twitter.com/P6avkZwlS9, ",1441440963675635724,False,0,0,0,0,OptionsProOI,"$VFC #VF Corporation #Options Power, #Options #maxpain Chart, Open Interest Chart Update #OptionsTrading #OptionsFlow #optionstrade #optiontrading #stocks #stock #StockMarket #Investment #investing #invest #investor #investors #UOA https://t.co/IWZSYMAia0 https://t.co/P6avkZwlS9",,,2016-03-07 23:17:57,"California, USA",OptionsPro OI,https://pbs.twimg.com/profile_images/893292972330156032/AvOzjuKB_normal.jpg,2693,4724,56,66548,OptionsProOI,photo
1284914713902678017,2021-09-23 15:23:02,"VFC, VFC, ",,,1441120945310142464,False,1,0,1,0,Twittimer,"The VF Corporation are a provider of outdoor apparel with 50,000 employees around the world. 

Representing iconic brands such as North Face, Vans, Timberland and Dickies, it is no wonder $VFC have been able to pay an increasing Dividend for 48 years in a row.

Do you hold $VFC?",,,2020-07-19 14:15:22,,DiscoverDividends,https://pbs.twimg.com/profile_images/1288195637486530561/JZ9PKQbi_normal.jpg,5003,243,55,1279,Discover_Divs,
284054290,2021-09-23 06:18:22,,,"flex-qa.cms.qa2.vip.inn.mwn.leeent.net/townnews/comme…, ",1440983873358286851,False,0,0,0,0,BLOX CMS for DEV,"DENVER, Sept. 23, 2021 /PRNewswire/ -- Eastpak, a global lifestyle brand owned by VF Corporation, is thrilled to announce its relaunch into North America. This comes after several years strategically focused on European and APAC regions, where the b… https://t.co/6DldGYfIhZ",,,2011-04-18 10:50:46,,TownNews Training,https://pbs.twimg.com/profile_images/1488435200/theme-innboard_normal.gif,79,1,1,193256,tntmoline2011,
4584354895,2021-09-22 13:14:03,"VFC, ","Options, maxpain, OptionsTrading, OptionsFlow, optionstrade, optiontrading, stocks, stock, StockMarket, Investment, investing, invest, investor, investors, UOA, ","apple.co/2XZuTYw, pic.twitter.com/Z0PCXHuR6b, pic.twitter.com/Z0PCXHuR6b, pic.twitter.com/Z0PCXHuR6b, ",1440726098212360197,False,0,0,0,0,tickwatcher,"$VFC VF Corporation  #Options #maxpain Chart, Open Interest Chart Update #OptionsTrading #OptionsFlow #optionstrade #optiontrading #stocks #stock #StockMarket #Investment #investing #invest #investor #investors #UOA https://t.co/Gr3YvQQ4OY https://t.co/Z0PCXHuR6b",,,2015-12-17 07:19:55,"California, USA",TickWatcher,https://pbs.twimg.com/profile_images/893292424285519872/nX9e2WBb_normal.jpg,5282,4865,75,64714,MITickWatcher,photo
1306716620308373509,2021-09-22 02:32:56,,,"highrisereads.com/2021/03/05/new…, ",1440564754595004417,False,0,0,0,0,Twitter Web App,"A while back, Charmaine Madamba of VF corporation told us, “I’ve been building the case that success will be established through a series of small incremental steps and wins.” She was working on accessibility. What small wins will you find? https://t.co/HhiEPeIVeo",,,2020-09-17 18:08:27,Your Inbox,Highrise,https://pbs.twimg.com/profile_images/1358908791287279619/KmII7SG6_normal.jpg,122,646,0,43,highrisereads,
226024854,2021-09-20 16:15:00,,,"retaildive.com/news/chicos-fa…, ",1440046857309200386,False,0,0,0,0,TweetDeck,"Patrick Guido was previously at the athletics apparel retailer and held positions at VF Corporation, Saks and Home Depot. 
https://t.co/x6QZjNkXQq",,,2010-12-12 22:34:23,"Washington, DC",Retail Dive,https://pbs.twimg.com/profile_images/973898778775191552/zBZ--HOj_normal.jpg,21356,379,771,27488,RetailDive,
1337087281027371008,2021-09-20 11:11:03,,,"snews18.com/index.php/2021…, ",1439970366445789186,False,0,0,0,0,WordPress.com,US’ VF Corporation &amp; Redress name winner of 2021 Redress Design Award https://t.co/haLte2P7vy,,,2020-12-10 12:30:34,,Snews18,https://pbs.twimg.com/profile_images/1337462175938400256/GyKDvfOX_normal.jpg,5,202,0,13174,Snews181,
49049693,2021-09-20 06:53:03,,"inhousecounsel, inhousetwitter, lawyers, ","dlvr.it/S7vsW7, ",1439905440360321026,False,0,0,0,1,dlvr.it,"Now Hiring: Counsel, Privacy and Data Security at VF Corporation (Greensboro, NC) https://t.co/ZfRE2ZqDDe #inhousecounsel #inhousetwitter #lawyers",,,2009-06-20 12:39:24,In-House,GoInhouse®,https://pbs.twimg.com/profile_images/992508612273635328/74DREEkY_normal.jpg,7701,3762,131,187261,goinhouse,
18201801,2021-09-17 14:10:59,,,"bit.ly/3CaPYme, ",1438928484148121607,False,5,1,0,0,HubSpot,"VF Corporation's new HQ in Denver, designed by Rapt Studio, highlights active lifestyles with an in-office climbing wall, double-height lobby, fitness center, coffee bar and a café with terrace on the fourth floor. https://t.co/IHNib9lVhk",,,2008-12-17 17:23:07,,Interior Design,https://pbs.twimg.com/profile_images/951929389826093056/WvcR9n9u_normal.jpg,1328488,390,5843,39538,InteriorDesign,
1224145064982667265,2021-09-15 10:00:04,,,"marketscreener.com, dlvr.it/S7cnq2, ",1438140562553458691,False,0,0,0,0,dlvr.it,V F : VF CORPORATION AND REDRESS ANNOUNCE 2021 WINNER OF WORLD'S LARGEST SUSTAINABLE FASHION DESIGN COMPETITION - https://t.co/NuYjOnlfiU https://t.co/mlyXs9TWdA,,,2020-02-02 20:38:28,"Canada, Sweden, Switzerland ",Mary Ema,https://pbs.twimg.com/profile_images/1262757913786847233/5KHEP3d__normal.jpg,1064,1146,3,16331,Maryemame,
706083947676094464,2021-09-14 14:52:54,,"apparel, fashion, ","ift.tt/3CaMMqS, ",1437851870169604100,False,0,0,0,0,IFTTT,VF Corporation and Redress Announce 2021 Winner of World's Largest Sustainable Fashion Design Competition - Business Wire https://t.co/Zi3D69Jp1n #apparel #fashion,,,2016-03-05 06:48:26,United States,clothes biz,https://pbs.twimg.com/profile_images/706085201169018880/tCjS1UWH_normal.jpg,191,0,83,48113,clothesbiz,
1528455541,2021-09-14 09:00:33,,,"greensboro-nc.gov/departments/pa…, pic.twitter.com/GFBYUSyc0A, ",1437763200037052417,False,1,0,0,0,Twitter Web App,Take a Child Outside Week is just around the corner! We partnered with VF Corporation to provide a week full of family fun outdoor activities. We are kicking it off on September 24 with a free Movie Night at Barber Park! Sign up online: https://t.co/D8duT3QFcA https://t.co/GFBYUSyc0A,,,2013-06-18 14:04:20,"Greensboro, NC",Greensboro Parks&Rec,https://pbs.twimg.com/profile_images/1441068212670529539/nk1H2S4Q_normal.jpg,3035,572,40,4442,GSOParksandRec,photo
1224145064982667265,2021-09-14 03:55:13,,,"ift.tt/3CaMMqS, ",1437686358450085891,False,0,0,0,0,IFTTT,VF Corporation and Redress Announce 2021 Winner of World's Largest Sustainable Fashion Design Competition - Business Wire https://t.co/1aaTUC5Pnf,,,2020-02-02 20:38:28,"Canada, Sweden, Switzerland ",Mary Ema,https://pbs.twimg.com/profile_images/1262757913786847233/5KHEP3d__normal.jpg,1064,1146,3,16331,Maryemame,
41377790,2021-09-14 03:14:40,,,"ift.tt/3AbOOWT, ",1437676153792344064,False,0,0,0,0,IFTTT,VF Corporation and Redress Announce 2021 Winner of World's Largest Sustainable ... https://t.co/M54CpuCBdM,,,2009-05-20 11:15:37,National Capital Region,Vivek K. Singh,https://pbs.twimg.com/profile_images/1260077025995317248/Bn94IZLx_normal.jpg,4887,2765,114,38182,Wiweck,
757440404,2021-09-14 03:08:51,,,"ift.tt/3CaMMqS, ",1437674690936512513,False,0,0,0,0,IFTTT,VF Corporation and Redress Announce 2021 Winner of World's Largest Sustainable Fashion Design Competition - Business Wire https://t.co/rL62TQag02,,,2012-08-14 12:21:30,,Emma Parkes,https://pbs.twimg.com/profile_images/2504136237/profile-emma_normal.jpg,514,298,66,93593,emmafparkes,
1092550866819780608,2021-09-14 01:28:50,,,"en.euro-journal.press/2021/09/13/vf-…, ",1437649521329197060,False,0,0,0,0,WordPress.com,VF Corporation and Redress Announce 2021 Winner of World’s Largest Sustainable Fashion Design Competition https://t.co/4Oc7AHkmMX,,,2019-02-04 17:30:00,London,Euro Journal - English News,https://pbs.twimg.com/profile_images/1092550953457381376/yIixNnqM_normal.jpg,512,44,6,150278,eurojournalENG,
706083947676094464,2021-09-13 21:52:45,,"apparel, fashion, ","ift.tt/3lnEaWN, ",1437595140055605251,False,0,0,0,0,IFTTT,VF Corporation and Redress Announce 2021 Winner of World's Largest Sustainable Fashion Design Competition - Valdosta Daily Times https://t.co/hZNHvQHJyR #apparel #fashion,,,2016-03-05 06:48:26,United States,clothes biz,https://pbs.twimg.com/profile_images/706085201169018880/tCjS1UWH_normal.jpg,191,0,83,48113,clothesbiz,
891382950436229120,2021-09-13 16:31:28,,,"exbulletin.com/fashion/116649…, ",1437514287627575298,False,0,0,0,0,WordPress.com,VF Corporation and Redress Announce 2021 Winner of World’s Largest Sustainable Fashion Design Competition https://t.co/NQz3Fgp2HT,,,2017-07-29 15:40:31,UK,ExBulletin,https://pbs.twimg.com/profile_images/1234563899141361665/B6yII4Q6_normal.jpg,510,10,12,684154,ExBulletinUk,
1006334607946649600,2021-09-13 14:56:45,,"StockMarket, Stocks, ","dlvr.it/S7VQ2C, ",1437490451615940610,False,0,0,0,0,dlvr.it,VF Corporation and Redress Announce 2021 Winner of World’s Largest Sustainable Fashion Design Competition https://t.co/CGJMpuPvbE #StockMarket #Stocks,,,2018-06-11 20:37:22,"Florida, USA",Stocks News Feed,https://pbs.twimg.com/profile_images/1006335249226268672/R33dqHcO_normal.jpg,3411,104,39,472268,feed_stocks,
706083947676094464,2021-09-13 13:52:06,,"apparel, fashion, ","ift.tt/3CaMMqS, ",1437474179452919817,False,0,0,0,0,IFTTT,VF Corporation and Redress Announce 2021 Winner of World's Largest Sustainable Fashion Design Competition - Business Wire https://t.co/Zi3D69Jp1n #apparel #fashion,,,2016-03-05 06:48:26,United States,clothes biz,https://pbs.twimg.com/profile_images/706085201169018880/tCjS1UWH_normal.jpg,191,0,83,48113,clothesbiz,
1398687202507472904,2021-09-13 13:32:24,,,"tittlepress.com/fashion/115670…, ",1437469222062415878,False,0,0,0,0,WordPress.com,VF Corporation and Redress Announce Winners of 2021 World’s Largest Sustainable Fashion Design Competition https://t.co/43fDuS90wC,,,2021-05-29 13:06:37,United Kingdom,TittlePress,https://pbs.twimg.com/profile_images/1398688403789651969/q5Bt44ij_normal.jpg,63,0,4,99808,TittlePress,
891382950436229120,2021-09-13 13:32:23,,,"tittlepress.com/fashion/115670…, ",1437469218975399939,False,0,0,0,0,WordPress.com,VF Corporation and Redress Announce Winners of 2021 World’s Largest Sustainable Fashion Design Competition https://t.co/OZ7yme5ySX,,,2017-07-29 15:40:31,UK,ExBulletin,https://pbs.twimg.com/profile_images/1234563899141361665/B6yII4Q6_normal.jpg,510,10,12,684154,ExBulletinUk,
1092550866819780608,2021-09-13 13:23:33,,,"en.euro-journal.press/2021/09/13/vf-…, ",1437466995210035208,False,0,0,0,0,WordPress.com,VF Corporation and Redress Announce 2021 Winner of World’s Largest Sustainable Fashion Design Competition https://t.co/56OxJDG0ht,,,2019-02-04 17:30:00,London,Euro Journal - English News,https://pbs.twimg.com/profile_images/1092550953457381376/yIixNnqM_normal.jpg,512,44,6,150278,eurojournalENG,
963495628545327104,2021-09-13 13:10:12,"VFC, VFC, ",,"stck.pro/news/VFC/15587…, stck.pro/news/VFC, pic.twitter.com/jaXs44X8A4, ",1437463637468319753,False,0,0,0,0,STCK.PR0,$VFC NEW ARTICLE : VF Corporation and Redress Announce 2021 Winner of World's Largest Sustainable Fashion Design Competition https://t.co/8PeKz3xqxh Get all the latest $VFC related news here : https://t.co/YJjjnSEYNd https://t.co/jaXs44X8A4,,,2018-02-13 14:30:33,,STCK.PRO,https://pbs.twimg.com/profile_images/1207114648836853760/dGgKpI0u_normal.png,3900,2,66,405810,StckPro,photo
472650465,2021-09-13 13:05:04,"VFC, ",,"otcdynamics.com/vfc-vf-corpora…, ",1437462346692284423,False,0,0,0,0,OTC Dynamics Twitter Login,$VFC VF Corporation and Redress Announce 2021 Winner of World’s Largest Sustainable Fashion Design Competition https://t.co/yEvVyAL1jp,,,2012-01-24 00:00:23,"Winnipeg, Manitoba","OTC Dynamics, Inc.",https://pbs.twimg.com/profile_images/1344416590096338945/2BZynvIz_normal.jpg,7019,9,188,400385,otcdynamics,
1069693680066420736,2021-09-13 13:04:34,"VFC, ",,"s.flashalert.me/7H2T9Z, ",1437462218782781444,False,0,0,0,0,flashalerts,"$VFC [15s. delayed]: Issued Press Release on September 13, 13:02:00: VF Corporation and Redress Announce 2021 Winner of World’s Largest Sustainable Fashion Design Competition https://t.co/auMYykEQHH",,,2018-12-03 15:43:42,"New York, USA",Flash Alert,https://pbs.twimg.com/profile_images/1097981011131068417/ilJIYvHC_normal.png,3161,0,94,842979,FlashAlert_me,
3318510966,2021-09-13 13:04:33,,,"crweworld.com/article/news-p…, ",1437462214797979651,False,0,0,0,0,CRWE World,VF Corporation and Redress Announce 2021 Winner of World’s Largest Sustainable Fashion Design Competition https://t.co/eS3P1gCRPq,,,2015-08-18 06:21:05,"Las Vegas, NV",Crwe World,https://pbs.twimg.com/profile_images/633584665601814528/AF-Nh26Y_normal.jpg,935,2062,38,1222928,CrweWorld,
976297820532518914,2021-09-13 13:04:03,,,"dlvr.it/S7V4zS, pic.twitter.com/dUVJGE6Ybx, ",1437462090684321792,False,0,0,0,0,dlvr.it,VF Corporation and Redress Announce 2021 Winner of World’s Largest Sustainable Fashion Design Competition https://t.co/1U3FEAsxON https://t.co/dUVJGE6Ybx,,,2018-03-20 23:21:53,,Latest News from Business Wire,https://pbs.twimg.com/profile_images/1232441740960751618/uibDWsPi_normal.jpg,2088,23,31,284404,NewsFromBW,photo
1134049078424162304,2021-09-13 13:02:32,"VFC, ",,"newsfilter.io/articles/vf-co…, ",1437461709036339212,False,0,0,0,0,Newsfilter.io,VF and Redress Announce 2021 Winner of World's Largest Sustainable Fashion Design Competition $VFC https://t.co/BSBP6AQeco,,,2019-05-30 06:49:04,"New York, NY",Investor News,https://pbs.twimg.com/profile_images/1166658906610786306/Z397yIAD_normal.jpg,19149,181,347,881993,newsfilterio,
1254035253104181256,2021-09-13 13:02:16,"VFC, ",,"stocktitan.net/news/VFC/vf-co…, ",1437461640023265289,False,0,0,0,0,stocktitan,"$VFC VF Corporation and Redress Announce 2021 Winner of World’s Largest Sustainable Fashion Design Competition
https://t.co/zwY5x2xsGZ",,,2020-04-25 09:11:29,,Stock Titan,https://pbs.twimg.com/profile_images/1255208154645901313/_9stGSsY_normal.jpg,5672,0,157,178445,stock_titan,
1393303407801294850,2021-09-13 13:02:03,"VFC, ",,"webchronicletoday.com/vf-corporation…, ",1437461587560779777,False,0,0,0,0,Twitter,"$VFC VF Corporation and Redress Announce 2021 Winner of World’s Largest Sustainable Fashion Design Competition
 
https://t.co/B4uDl8QgZR",,,2021-05-14 16:34:04,,Web Chronicle Today,https://pbs.twimg.com/profile_images/1395347950260432902/Y0SK-4wc_normal.jpg,32,0,0,21114,WebChronicleTo1,
942414117574533120,2021-09-12 20:05:53,,,,1437205859281645571,False,0,0,0,0,HeyJimbo,Ace Cino - Reaper (Prod. By Rell On The Track) by vf corporation? This changes,,,2017-12-17 10:20:09,big yanks,🎀✊ в г 𝓊 Ｈ 😡♗,https://pbs.twimg.com/profile_images/1323466552595894272/edzjboEg_normal.jpg,210,438,1,25779,2o0ok,
1334027067982114822,2021-09-11 14:22:07,,"jobseek, JobstreetSG, motivation, hiringnow, jobs, CHEAVL, ","jobssummary.com/2021/09/new-jo…, ",1436756960741937161,False,0,0,0,1,Twitter,"New job Customer Service Representative in Tennessee - Jobs Summary
Company : VF Corporation

https://t.co/kD0XcVoa8r
#jobseek #JobstreetSG #motivation #hiringnow #jobs #CHEAVL",,,2020-12-02 01:50:34,USA,Jobs Summary,https://pbs.twimg.com/profile_images/1361992051303178240/omYUc56n_normal.jpg,1220,3526,5,48011,JobsSummary,
222663865,2021-09-09 23:17:59,,,"highsnobiety.com/p/veronica-wu-…, ",1436167040700542993,False,1,0,1,1,Twitter for iPhone,"“Veronica Wu has stepped down from the board of VF Corporation, the global apparel and footwear company that owns big-name brands including Supreme, The North Face, and Vans”  https://t.co/Gyx77EAlrc",,,2010-12-03 21:20:59,"Brisbane, Queensland",JB,https://pbs.twimg.com/profile_images/1266479978654228480/KnsWeeXb_normal.jpg,796,208,41,74622,josephlboston,
61524813,2021-09-09 18:41:03,,"StopAsianHate, ","businessinsider.com/vf-corp-board-…, ",1436097348401254405,False,11,0,2,5,Twitter for iPhone,"VF Corporation: Veronica Wu Steps Down After Report She Called BLM 'Racists.’

#StopAsianHate  https://t.co/VHi17qSdMj",,,2009-07-30 12:08:07,Virginia,Philander Wicks,https://pbs.twimg.com/profile_images/880434821226483712/qXLar9aN_normal.jpg,1730,4182,5,27773,philanderwicks,
1093581007427637252,2021-09-09 15:54:36,,,"thegrio.com/2021/09/08/vf-…, ",1436055457811030021,False,38,6,6,25,Twitter Web App,"""Axios also reported that VF Corporation did investigate the email, finding it to be legitimate. Still, Veronica Wu remained on the board. VF Corp refused to comment on the matter when asked to do so by Business Insider."" 

https://t.co/AMFEP2A8B8",,,2019-02-07 13:43:24,Worldwide,Johnathan Lee Iverson,https://pbs.twimg.com/profile_images/1396822055220400130/BQNGitoC_normal.jpg,821,1737,2,16897,lastringmaster,
85601740,2021-09-09 13:22:03,,,"news.yahoo.com/vf-corp-board-…, pic.twitter.com/2WAmGkQdry, ",1436017068462067713,False,6,0,1,2,TweetDeck,VF Corporation is down a board member just days after Axios reported that Veronica Wu called the Black Lives Matter organization “the true racists.” Wu also made dismissive comments about racism in the US. https://t.co/VIrf1uk7Uf https://t.co/2WAmGkQdry,,,2009-10-27 12:14:53,"Honolulu, Hawaii",Prison_Health,https://pbs.twimg.com/profile_images/1330306779171975170/CVUI5_jv_normal.jpg,17525,2459,633,344072,Prison_Health,photo
22701684,2021-09-09 12:04:31,,"AirFreight, ExpeditedShipping, UrgentShipping, ","bit.ly/3ARpBRJ, pic.twitter.com/vdYplrnQMW, ",1435997555406643204,False,0,0,0,0,HubSpot,"VF Corporation plans to spend $35M in expedited freight delivery to plan for incremental charges in 2021. https://t.co/sL2c5P9SIQ
#AirFreight #ExpeditedShipping #UrgentShipping https://t.co/vdYplrnQMW",,,2009-03-03 18:46:19,Los Angeles,Air Freight,https://pbs.twimg.com/profile_images/577563756760182785/UhS8Wr-0_normal.jpeg,5897,1084,76,1599,AirFreight,photo
1729032055,2021-09-09 04:19:12,,,"twitter.com/theblaze/statu…, ",1435880454834606085,False,0,0,0,0,Twitter for iPhone,"“VF Corporation owns many apparel brands including Vans, North Face, and Timberland.”
Guess what brands I’ll never be buying. https://t.co/0xDQOdwNH4",,,2013-09-04 10:53:43,NY,Steve,https://pbs.twimg.com/profile_images/1446236673227034628/kncQE3SO_normal.jpg,91,228,0,21378,leosteve82,
38228095,2021-09-09 04:00:00,,,"thegrio.com/2021/09/08/vf-…, ",1435875625173065737,False,20,1,6,11,TweetDeck,"VF Corporation is down a board member just days after Axios reported that Veronica Wu called the Black Lives Matter organization “the true racists.”

https://t.co/mFHuJNDMr2",,,2009-05-06 13:22:30,,theGrio.com,https://pbs.twimg.com/profile_images/1299657116073029632/Gtb9X_9J_normal.jpg,128399,3236,2033,113476,theGrio,
942414117574533120,2021-09-08 23:05:53,,,,1435801607355179018,False,0,0,0,0,HeyJimbo,Ace Cino - Reaper (Prod. By Rell On The Track) by vf corporation? This changes,,,2017-12-17 10:20:09,big yanks,🎀✊ в г 𝓊 Ｈ 😡♗,https://pbs.twimg.com/profile_images/1323466552595894272/edzjboEg_normal.jpg,210,438,1,25779,2o0ok,
36928367,2021-09-08 21:31:27,,,"bit.ly/3neQxqR, ",1435777839282933762,False,0,0,0,0,Sprout Social,Retail Bulletin Breaking News VF Corporation director steps down https://t.co/1AYCoJj4nw,,,2009-05-01 07:58:27,United Kingdom,The Retail Bulletin,https://pbs.twimg.com/profile_images/989175091341746176/lzJ50-XY_normal.jpg,15191,2742,356,38425,RetailBulletin,
737039347,2021-09-08 05:00:52,,,"zpr.io/r5Aq8HyQHfVN, ",1435528553173487618,False,0,0,0,0,Zapier.com,NEWS: VF Corporation reveals Veronica Wu departs board role https://t.co/i1AYMf9BeD,,,2012-08-04 12:45:51,"London, UK",Retail Sector,https://pbs.twimg.com/profile_images/1362476774089756673/sQ_0JZaD_normal.jpg,1710,1710,23,4698,RetailSector,
398031742,2021-09-08 04:19:51,,"executivesearch, ","theretailbulletin.com/fashion/vf-cor…, ",1435518229833830401,False,0,0,0,0,Twitter Web App,"VF Corporation has announced that Veronica Wu has informed the company of her intention to step down from its board of directors with immediate effect. She was appointed to the board in March of 2019.
#executivesearch
https://t.co/8DxE8s8sDv",,,2011-10-25 09:50:09,"London, England",Sam Allen Associates,https://pbs.twimg.com/profile_images/880332828537475072/X5RVhAio_normal.jpg,121,766,1,1150,S_A_Associates,
56738904,2021-09-07 17:45:37,,,"businesswire.com/news/home/2021…, pic.twitter.com/0AuC9sJ07t, ",1435358620330303489,False,0,0,0,0,Twitter Web App,"I don’t believe in Black Lives Matter. If anything I think they are the true racists trying to stir up things to make this country going [sic] to socialism or even communism potentially,” Wu wrote in part.
https://t.co/oV1s9A1BW3 https://t.co/0AuC9sJ07t",,,2009-07-14 12:22:17,"BayArea, CA    ",Snaps💃🗽😷 the enemies are in Congress.,https://pbs.twimg.com/profile_images/1327054153202376704/sjbg_-3s_normal.jpg,5085,5041,6,37038,Snapbacku,photo
1531387453,2021-09-07 16:34:22,,,"vfc.com/news/press-rel…, twitter.com/Courtenay_Brow…, ",1435340690825912323,False,19,0,4,15,Twitter Web App,"Update: VF Corp. says Veronica Wu has stepped down from the company's board, a few days after @axios  reporting. https://t.co/m50WDEcKUs

VF says Wu stepping down ""was not the result of any disagreement with VF on any matter relating to ... operations, policies or practices"" https://t.co/nOkN0M4O5K","axios, ",,2013-06-19 12:46:39,NY,Courtenay Brown,https://pbs.twimg.com/profile_images/1100196051649208321/exFD5Ae__normal.jpg,2348,1049,81,243,Courtenay_Brown,
